1 Könige_1Kön_11_1_1_Und da der König David alt war und wohl betagt, konnte er nicht mehr warm werden, ob man ihn gleich mit Kleidern bedeckte.
1 Könige_1Kön_11_1_2_Da sprachen seine Knechte zu ihm: Laßt sie meinem Herrn, dem König, eine Dirne, eine Jungfrau, suchen, die vor dem König stehe und sein pflege und schlafe in seinen Armen und wärme meinen Herrn, den König.
1 Könige_1Kön_11_1_3_Und sie suchten eine schöne Dirne im ganzen Gebiet Israels und fanden Abisag von Sunem und brachten sie dem König.
1 Könige_1Kön_11_1_4_Und sie war eine sehr schöne Dirne und pflegte des Königs und diente ihm. Aber der König erkannte sie nicht.
1 Könige_1Kön_11_1_5_Adonia aber, der Sohn der Haggith, erhob sich und sprach: Ich will König werden! und machte sich Wagen und Reiter und fünfzig Mann zu Trabanten vor ihm her.
1 Könige_1Kön_11_1_6_Und sein Vater hatte ihn nie bekümmert sein Leben lang, daß er hätte gesagt: Warum tust du also? Und er war auch ein sehr schöner Mann und war geboren nächst nach Absalom.
1 Könige_1Kön_11_1_7_Und er hatte seinen Rat mit Joab, dem Sohn der Zeruja, und mit Abjathar, dem Priester; die halfen Adonia.
1 Könige_1Kön_11_1_8_Aber Zadok, der Priester, und Benaja, der Sohn Jojadas, und Nathan, der Prophet, und Simei und Rei und die Helden Davids waren nicht mit Adonia.
1 Könige_1Kön_11_1_9_Und da Adonia Schafe und Rinder und gemästetes Vieh opferte bei dem Stein Soheleth, der neben dem Brunnen Rogel liegt, lud er alle seine Brüder, des Königs Söhne, und alle Männer Juda's, des Königs Knechte.
1 Könige_1Kön_11_1_10_Aber den Propheten Nathan und Benaja und die Helden und Salomo, seinen Bruder, lud er nicht.
1 Könige_1Kön_11_1_11_Da sprach Nathan zu Bath-Seba, Salomos Mutter: Hast du nicht gehört, daß Adonia, der Sohn der Haggith, ist König geworden? Und unser Herr David weiß nichts darum.
1 Könige_1Kön_11_1_12_So komm nun, ich will dir einen Rat geben, daß du deine Seele und deines Sohnes Salomo Seele errettest.
1 Könige_1Kön_11_1_13_Auf, und gehe zum König David hinein und sprich zu ihm: Hast du nicht, mein Herr König, deiner Magd geschworen und geredet: Dein Sohn Salomo soll nach mir König sein, und er soll auf meinem Stuhl sitzen? Warum ist denn Adonia König geworden?
1 Könige_1Kön_11_1_14_Siehe, wenn du noch da bist und mit dem König redest, will ich dir nach hineinkommen und vollends deine Worte ausreden.
1 Könige_1Kön_11_1_15_Und Bath-Seba ging hinein zum König in die Kammer. Und der König war sehr alt, und Abisag von Sunem diente dem König.
1 Könige_1Kön_11_1_16_Und Bath-Seba neigte sich und fiel vor dem König nieder. Der König aber sprach: Was ist dir?
1 Könige_1Kön_11_1_17_Sie sprach zu ihm: Mein Herr, du hast deiner Magd geschworen bei dem HERRN, deinem Gott: Dein Sohn Salomo soll König sein nach mir und auf meinem Stuhl sitzen.
1 Könige_1Kön_11_1_18_Nun aber siehe, Adonia ist König geworden, und, mein Herr König, du weißt nichts darum.
1 Könige_1Kön_11_1_19_Er hat Ochsen und gemästetes Vieh und viele Schafe geopfert und hat geladen alle Söhne des Königs, dazu Abjathar, den Priester, und Joab den Feldhauptmann; aber deinen Knecht Salomo hat er nicht geladen.
1 Könige_1Kön_11_1_20_Du aber, mein Herr König, die Augen des ganzen Israel sehen auf dich, daß du ihnen anzeigest, wer auf dem Stuhl meines Herrn Königs sitzen soll.
1 Könige_1Kön_11_1_21_Wenn aber mein Herr König mit seinen Vätern entschlafen ist, so werden ich und mein Sohn Salomo müssen Sünder sein.
1 Könige_1Kön_11_1_22_Als sie aber noch redete mit dem König, kam der Prophet Nathan.
1 Könige_1Kön_11_1_23_Und sie sagten's dem König an: Siehe, da ist der Prophet Nathan. Und als er hinein vor den König kam, fiel er vor dem König nieder auf sein Angesicht zu Erde
1 Könige_1Kön_11_1_24_und sprach: Mein Herr König, hast du gesagt: Adonia soll nach mir König sein und auf meinem Stuhl sitzen?
1 Könige_1Kön_11_1_25_Denn er ist heute hinabgegangen und hat geopfert Ochsen und Mastvieh und viele Schafe und hat alle Söhne des Königs geladen und die Hauptleute, dazu den Priester Abjathar. Und siehe, sie essen und trinken vor ihm und sagen: Glück zu dem König Adonia!
1 Könige_1Kön_11_1_26_Aber mich, deinen Knecht, und Zadok, den Priester, und Benaja, den Sohn Jojadas, und deinen Knecht Salomo hat er nicht geladen.
1 Könige_1Kön_11_1_27_Ist das von meinem Herrn, dem König, befohlen, und hast du es deine Knechte nicht wissen lassen, wer auf dem Stuhl meines Herrn, des Königs, nach ihm sitzen soll?
1 Könige_1Kön_11_1_28_Der König David antwortete und sprach: Rufet mir Bath-Seba! Und sie kam hinein vor den König. Und da sie vor dem König stand,
1 Könige_1Kön_11_1_29_schwur der König und sprach: So wahr der HERR lebt, der meine Seele erlöst hat aus aller Not,
1 Könige_1Kön_11_1_30_ich will heute tun, wie ich dir geschworen habe bei dem HERRN, dem Gott Israels, und geredet, daß Salomo, dein Sohn, soll nach mir König sein, und er soll auf meinem Stuhl sitzen für mich.
1 Könige_1Kön_11_1_31_Da neigte sich Bath-Seba mit ihrem Antlitz zur Erde und fiel vor dem König nieder und sprach: Glück meinem Herrn, dem König David, ewiglich!
1 Könige_1Kön_11_1_32_Und der König David sprach: Rufet mir den Priester Zadok und den Propheten Nathan und Benaja, den Sohn Jojadas! Und da sie hineinkamen vor den König,
1 Könige_1Kön_11_1_33_sprach der König zu ihnen: Nehmet mit euch eures Herrn Knechte und setzet meinen Sohn Salomo auf mein Maultier und führet ihn hinab gen Gihon.
1 Könige_1Kön_11_1_34_Und der Priester Zadok samt dem Propheten Nathan salbe ihn daselbst zum König über Israel. Und blast mit den Posaunen und sprecht: Glück dem König Salomo!
1 Könige_1Kön_11_1_35_Und ziehet mit ihm herauf, und er soll kommen und sitzen auf meinem Stuhl und König sein für mich; und ich will ihm gebieten, daß er Fürst sei über Israel und Juda.
1 Könige_1Kön_11_1_36_Da antwortete Benaja, der Sohn Jojadas, dem König und sprach: Amen! Es sage der HERR, der Gott meines Herrn, des Königs, auch also!
1 Könige_1Kön_11_1_37_Wie der HERR mit meinem Herrn, dem König gewesen ist, so sei er auch mit Salomo, daß sein Stuhl größer werde denn der Stuhl meines Herrn, des Königs David.
1 Könige_1Kön_11_1_38_Da gingen hinab der Priester Zadok und der Prophet Nathan und Benaja, der Sohn Jojadas, und die Krether und Plether und setzten Salomo auf das Maultier des Königs David und führten ihn gen Gihon.
1 Könige_1Kön_11_1_39_Und der Priester Zadok nahm das Ölhorn aus der Hütte und salbte Salomo. Und sie bliesen mit der Posaune, und alles Volk sprach: Glück dem König Salomo!
1 Könige_1Kön_11_1_40_Und alles Volk zog ihm nach herauf, und das Volk pfiff mit Flöten und war sehr fröhlich, daß die Erde von ihrem Geschrei erscholl.
1 Könige_1Kön_11_1_41_Und Adonai hörte es und alle, die er geladen hatte, die bei ihm waren; und sie hatten schon gegessen. Und da Joab der Posaune Schall hörte, sprach er: Was will das Geschrei und Getümmel der Stadt?
1 Könige_1Kön_11_1_42_Da er aber noch redete, siehe, da kam Jonathan, der Sohn Abjathars, des Priesters. Und Adonia sprach: Komm herein, denn du bist ein redlicher Mann und bringst gute Botschaft.
1 Könige_1Kön_11_1_43_Jonathan antwortete und sprach zu Adonia: Ja, unser Herr, der König David, hat Salomo zum König gemacht
1 Könige_1Kön_11_1_44_und hat mit ihm gesandt den Priester Zadok und den Propheten Nathan und Benaja, den Sohn Jojadas, und die Krether und Plether; und sie haben ihn auf des Königs Maultier gesetzt;
1 Könige_1Kön_11_1_45_und Zadok, der Priester, samt dem Propheten Nathan hat ihn gesalbt zum König zu Gihon, und sind von da heraufgezogen mit Freuden, daß die Stadt voll Getümmels ist. Das ist das Geschrei, das ihr gehört habt.
1 Könige_1Kön_11_1_46_Dazu sitzt Salomo auf dem königlichen Stuhl.
1 Könige_1Kön_11_1_47_Und die Knechte des Königs sind hineingegangen, zu segnen unsern Herrn, den König David, und haben gesagt: Dein Gott mache Salomo einen bessern Namen, denn dein Name ist, und mache seinen Stuhl größer, denn deinen Stuhl! Und der König hat angebetet auf dem Lager.
1 Könige_1Kön_11_1_48_Auch hat der König also gesagt: Gelobt sei der HERR, der Gott Israels, der heute hat lassen einen sitzen auf meinem Stuhl, daß es meine Augen gesehen haben.
1 Könige_1Kön_11_1_49_Da erschraken und machten sich auf alle, die bei Adonia geladen waren, und gingen hin, ein jeglicher seinen Weg.
1 Könige_1Kön_11_1_50_Aber Adonia fürchtete sich vor Salomo und machte sich auf, ging hin und faßte die Hörner des Altars.
1 Könige_1Kön_11_1_51_Und es ward Salomo angesagt: Siehe, Adonia fürchtet den König Salomo; und siehe, er faßte die Hörner des Altars und spricht: Der König Salomo schwöre mir heute, daß er seinen Knecht nicht töte mit dem Schwert.
1 Könige_1Kön_11_1_52_Salomo sprach: Wird er redlich sein, so soll kein Haar von ihm auf die Erde fallen; wird aber Böses an ihm gefunden, so soll er sterben.
1 Könige_1Kön_11_1_53_Und der König Salomo sandte hin und ließ ihn herab vom Altar holen. Und da er kam, fiel er vor dem König Salomo nieder. Salomo aber sprach zu Ihm: Gehe in dein Haus!
1 Könige_1Kön_11_2_1_Als nun die Zeit herbeikam, daß David sterben sollte, gebot er seinem Sohn Salomo und sprach:
1 Könige_1Kön_11_2_2_Ich gehe hin den Weg aller Welt; so sei getrost und sei ein Mann
1 Könige_1Kön_11_2_3_und warte des Dienstes des HERRN, deines Gottes, daß du wandelst in seinen Wegen und haltest seine Sitten, Gebote und Rechte und Zeugnisse, wie geschrieben steht im Gesetz Mose's, auf daß du klug seist in allem, was du tust und wo du dich hin wendest;
1 Könige_1Kön_11_2_4_auf daß der HERR sein Wort erwecke, das er über mich geredet hat und gesagt: Werden deine Kinder ihre Wege behüten, daß sie vor mir treulich und von ganzem Herzen und von ganzer Seele wandeln, so soll dir nimmer gebrechen ein Mann auf dem Stuhl Israels.
1 Könige_1Kön_11_2_5_Auch weißt du wohl, was mir getan hat Joab, der Sohn der Zeruja, was er tat den zwei Feldhauptmännern Israels, Abner dem Sohn Ners, und Amasa, dem Sohn Jethers, die er erwürgt hat und vergoß Kriegsblut im Frieden und tat Kriegsblut an seinen Gürtel, der um seine Lenden war, und an seine Schuhe, die an seinen Füßen waren.
1 Könige_1Kön_11_2_6_Tue nach deiner Weisheit, daß du seine grauen Haare nicht mit Frieden hinunter in die Grube bringst.
1 Könige_1Kön_11_2_7_Aber den Kindern Barsillais, des Gileaditers, sollst du Barmherzigkeit beweisen, daß sie an deinem Tisch essen. Denn also nahten sie zu mir, da ich vor Absalom, deinem Bruder, floh.
1 Könige_1Kön_11_2_8_Und siehe, du hast bei mir Simei, den Sohn Geras, den Benjaminiter von Bahurim, der mir schändlich fluchte zu der Zeit, da ich gen Mahanaim ging. Er aber kam herab mir entgegen am Jordan. Da schwur ich ihm bei dem HERRN und sprach: Ich will dich nicht töten mit dem Schwert.
1 Könige_1Kön_11_2_9_Du aber laß ihn nicht unschuldig sein; denn du bist ein weiser Mann und wirst wohl wissen, was du ihm tun sollst, daß du seine grauen Haare mit Blut hinunter in die Grube bringst.
1 Könige_1Kön_11_2_10_Also entschlief David mit seinen Vätern und ward begraben in der Stadt Davids.
1 Könige_1Kön_11_2_11_Die Zeit aber, die David König gewesen ist über Israel, ist vierzig Jahre: sieben Jahre war er König zu Hebron und dreiunddreißig Jahre zu Jerusalem.
1 Könige_1Kön_11_2_12_Und Salomo saß auf dem Stuhl seines Vaters David, und sein Königreich ward sehr beständig.
1 Könige_1Kön_11_2_13_Aber Adonia, der Sohn der Haggith, kam hinein zu Bath-Seba, der Mutter Salomos. Und sie sprach: Kommst du auch in Frieden? Er sprach: Ja!
1 Könige_1Kön_11_2_14_und sprach: Ich habe mit dir zu reden. Sie sprach: Sage an!
1 Könige_1Kön_11_2_15_Er sprach: Du weißt, daß das Königreich mein war und ganz Israel hatte sich auf mich gerichtet, daß ich König sein sollte; aber nun ist das Königreich gewandt und meines Bruders geworden, von dem HERRN ist's ihm geworden.
1 Könige_1Kön_11_2_16_Nun bitte ich eine Bitte von dir; du wolltest mein Angesicht nicht beschämen. Sie sprach zu ihm: Sage an!
1 Könige_1Kön_11_2_17_Er sprach: Rede mit dem König Salomo, denn er wird dein Angesicht nicht beschämen, daß er mir gebe Abisag von Sunem zum Weibe.
1 Könige_1Kön_11_2_18_Bath-Seba sprach: Wohl, ich will mit dem König deinethalben reden.
1 Könige_1Kön_11_2_19_Und Bath-Seba kam hinein zum König Salomo, mit ihm zu reden Adonias halben. Und der König stand auf und ging ihr entgegen und neigte sich vor ihr und setzte sie auf seinen Stuhl. Und es ward der Mutter des Königs ein Stuhl gesetzt, daß sie sich setzte zu seiner Rechten.
1 Könige_1Kön_11_2_20_Und sie sprach: Ich bitte eine kleine Bitte von dir; du wollest mein Angesicht nicht beschämen. Der König sprach zu ihr: Bitte, meine Mutter; ich will dein Angesicht nicht beschämen.
1 Könige_1Kön_11_2_21_Sie sprach: Laß Abisag von Sunem deinem Bruder Adonia zum Weibe geben.
1 Könige_1Kön_11_2_22_Da antwortete der König Salomo und sprach zu seiner Mutter: Warum bittest du um Abisag von Sunem für Adonia? Bitte ihm das Königreich auch; denn er ist mein älterer Bruder und hat den Priester Abjathar und Joab, den Sohn der Zeruja.
1 Könige_1Kön_11_2_23_und der König Salomo schwur bei dem HERRN und sprach: Gott tue mir dies und das, Adonia soll das wider sein Leben geredet haben!
1 Könige_1Kön_11_2_24_Und nun, so wahr der HERR lebt, der mich bestätigt hat und sitzen lassen auf dem Stuhl meines Vaters David und der mir ein Haus gemacht hat, wie er geredet hat, heute soll Adonia sterben!
1 Könige_1Kön_11_2_25_Und der König Salomo sandte hin Benaja, den Sohn Jojadas; der schlug ihn, daß er starb.
1 Könige_1Kön_11_2_26_Und zu dem Priester Abjathar sprach der König: Gehe hin gen Anathoth zu deinem Acker; denn du bist des Todes. Aber ich will dich heute nicht töten; denn du hast die Lade des HERRN vor meinem Vater David getragen und hast mitgelitten, wo mein Vater gelitten hat.
1 Könige_1Kön_11_2_27_Also verstieß Salomo den Abjathar, daß er nicht durfte Priester des HERRN sein, auf daß erfüllet würde des HERRN Wort, das er über das Haus Elis geredet hatte zu Silo.
1 Könige_1Kön_11_2_28_Und dies Gerücht kam vor Joab; denn Joab hatte an Adonia gehangen, wiewohl nicht an Absalom. Da floh Joab in die Hütte des HERRN und faßte die Hörner des Altars.
1 Könige_1Kön_11_2_29_Und es ward dem König Salomo angesagt, daß Joab zur Hütte des HERRN geflohen wäre, und siehe, er steht am Altar. Da sandte Salomo hin Benaja, den Sohn Jojadas, und sprach: Gehe, schlage ihn!
1 Könige_1Kön_11_2_30_Und da Benaja zur Hütte des HERRN kam, sprach er zu ihm: So sagt der König: Gehe heraus! Er sprach: Nein, hier will ich sterben. Und Benaja sagte solches dem König wieder und sprach: So hat Joab geredet, und so hat er mir geantwortet.
1 Könige_1Kön_11_2_31_Der König sprach zu ihm: Tue, wie er geredet hat, und schlage ihn und begrabe ihn, daß du das Blut, das Joab ohne Ursache vergossen hat, von mir tust und von meines Vaters Hause;
1 Könige_1Kön_11_2_32_und der HERR bezahle ihm sein Blut auf seinen Kopf, daß er zwei Männer erschlagen hat, die gerechter und besser waren denn er, und hat sie erwürgt mit dem Schwert, daß mein Vater David nichts darum wußte: Abner, den Sohn Ners, den Feldhauptmann über Israel, und Amasa, den Sohn Jethers, den Feldhauptmann über Juda;
1 Könige_1Kön_11_2_33_daß ihr Blut bezahlt werde auf den Kopf Joabs und seines Samens ewiglich, aber David und sein Same, sein Haus und sein Stuhl Frieden habe ewiglich von dem HERRN.
1 Könige_1Kön_11_2_34_Und Benaja, der Sohn Jojadas, ging hinauf und schlug ihn und tötete ihn. Und er ward begraben in seinem Hause in der Wüste.
1 Könige_1Kön_11_2_35_Und der König setzte Benaja, den Sohn Jojadas, an seine Statt über das Heer, und Zadok, den Priester, setzte der König an die Statt Abjathars.
1 Könige_1Kön_11_2_36_Und der König sandte hin und ließ Simei rufen und sprach zu ihm: Baue dir ein Haus zu Jerusalem und wohne daselbst und gehe von da nicht heraus, weder hierher noch daher.
1 Könige_1Kön_11_2_37_Welches Tages du wirst hinausgehen und über den Bach Kidron gehen, so wisse, daß du des Todes sterben mußt; dein Blut sei auf deinem Kopf!
1 Könige_1Kön_11_2_38_Simei sprach zum König: Das ist eine gute Meinung; wie mein Herr, der König, geredet hat, so soll dein Knecht tun. Also wohnte Simei zu Jerusalem lange Zeit.
1 Könige_1Kön_11_2_39_Es begab sich aber über drei Jahre, daß zwei Knechte dem Simei entliefen zu Achis, dem Sohn Maachas, dem König zu Gath. Und es ward Simei angesagt: Siehe, deine Knechte sind zu Gath.
1 Könige_1Kön_11_2_40_Da machte sich Simei auf und sattelte seinen Esel und zog hin gen Gath zu Achis, daß er seine Knechte suchte. Und da er hinkam, brachte er seine Knechte von Gath.
1 Könige_1Kön_11_2_41_Und es ward Salomo angesagt, daß Simei hingezogen wäre von Jerusalem gen Gath und wiedergekommen.
1 Könige_1Kön_11_2_42_Da sandte der König hin und ließ Simei rufen und sprach zu ihm: Habe ich dir nicht geschworen bei dem HERRN und dir bezeugt und gesagt, welches Tages du würdest ausziehen und hierhin oder dahin gehen, daß du wissen solltest, du müßtest des Todes sterben? und du sprachst zu mir: Ich habe eine gute Meinung gehört.
1 Könige_1Kön_11_2_43_Warum hast du denn nicht dich gehalten nach dem Eid des HERRN und dem Gebot, das ich dir geboten habe?
1 Könige_1Kön_11_2_44_Und der König sprach zu Simei: Du weißt alle die Bosheit, der dir dein Herz bewußt ist, die du meinem Vater David getan hast; der HERR hat deine Bosheit bezahlt auf deinen Kopf,
1 Könige_1Kön_11_2_45_und der König Salomo ist gesegnet, und der Stuhl Davids wird beständig sein vor dem HERRN ewiglich.
1 Könige_1Kön_11_2_46_Und der König gebot Benaja, dem Sohn Jojadas; der ging hinaus und schlug ihn, daß er starb. Und das Königreich ward bestätigt durch Salomos Hand.
1 Könige_1Kön_11_3_1_Und Salomo verschwägerte sich mit Pharao, dem König in Ägypten und nahm Pharaos Tochter und brachte sie in die Stadt Davids, bis er ausbaute sein Haus und des HERRN Haus und die Mauer um Jerusalem her.
1 Könige_1Kön_11_3_2_Aber das Volk opferte noch auf den Höhen; denn es war noch kein Haus gebaut dem Namen des HERRN bis auf die Zeit.
1 Könige_1Kön_11_3_3_Salomo aber hatte den HERRN lieb und wandelte nach den Sitten seines Vaters David, nur daß er auf den Höhen opferte und räucherte.
1 Könige_1Kön_11_3_4_Und der König ging hin gen Gibeon daselbst zu opfern; denn das war die vornehmste Höhe. Und Salomo opferte tausend Brandopfer auf demselben Altar.
1 Könige_1Kön_11_3_5_Und der HERR erschien Salomo zu Gibeon im Traum des Nachts, und Gott sprach: Bitte, was ich dir geben soll!
1 Könige_1Kön_11_3_6_Salomo sprach: Du hast an meinem Vater David, deinem Knecht, große Barmherzigkeit getan, wie er denn vor dir gewandelt ist in Wahrheit und Gerechtigkeit und mit richtigem Herzen vor dir, und hast ihm diese große Barmherzigkeit gehalten und ihm einen Sohn gegeben, der auf seinem Stuhl säße, wie es denn jetzt geht.
1 Könige_1Kön_11_3_7_Nun, HERR, mein Gott, du hast deinen Knecht zum König gemacht an meines Vaters David Statt. So bin ich ein junger Knabe, weiß weder meinen Ausgang noch Eingang.
1 Könige_1Kön_11_3_8_Und dein Knecht ist unter dem Volk, das du erwählt hast, einem Volke, so groß das es niemand zählen noch beschreiben kann vor der Menge.
1 Könige_1Kön_11_3_9_So wollest du deinem Knecht geben ein gehorsames Herz, daß er dein Volk richten möge und verstehen, was gut und böse ist. Denn wer vermag dies dein mächtiges Volk zu richten?
1 Könige_1Kön_11_3_10_Das gefiel dem HERRN wohl, daß Salomo um ein solches bat.
1 Könige_1Kön_11_3_11_Und Gott sprach zu ihm: Weil du solches bittest und bittest nicht um langes Leben noch um Reichtum noch um deiner Feinde Seele, sondern um Verstand, Gericht zu hören,
1 Könige_1Kön_11_3_12_siehe, so habe ich getan nach deinen Worten. Siehe, ich habe dir ein weises und verständiges Herz gegeben, daß deinesgleichen vor dir nicht gewesen ist und nach dir nicht aufkommen wird.
1 Könige_1Kön_11_3_13_Dazu, was du nicht gebeten hast, habe ich dir auch gegeben, sowohl Reichtum als Ehre, daß deinesgleichen keiner unter den Königen ist zu deinen Zeiten.
1 Könige_1Kön_11_3_14_Und so du wirst in meinen Wegen wandeln, daß du hältst meine Sitten und Gebote, wie dein Vater David gewandelt hat, so will ich dir geben ein langes Leben.
1 Könige_1Kön_11_3_15_Und da Salomo erwachte, siehe, da war es ein Traum. Und er kam gen Jerusalem und trat vor die Lade des Bundes des HERRN und opferte Brandopfer und Dankopfer und machte ein großes Mahl allen seinen Knechten.
1 Könige_1Kön_11_3_16_Zu der Zeit kamen zwei Huren zum König und traten vor ihn.
1 Könige_1Kön_11_3_17_Und das eine Weib sprach: Ach, mein Herr, ich und dies Weib wohnten in einem Hause, und ich gebar bei ihr im Hause.
1 Könige_1Kön_11_3_18_Und über drei Tage, da ich geboren hatte, gebar sie auch. Und wir waren beieinander, daß kein Fremder mit uns war im Hause, nur wir beide.
1 Könige_1Kön_11_3_19_Und dieses Weibes Sohn starb in der Nacht; denn sie hatte ihn im Schlaf erdrückt.
1 Könige_1Kön_11_3_20_Und sie stand in der Nacht auf und nahm meinen Sohn von meiner Seite, da deine Magd schlief, und legte ihn an ihren Arm, und ihren toten Sohn legte sie an meinen Arm.
1 Könige_1Kön_11_3_21_Und da ich des Morgens aufstand, meinen Sohn zu säugen, siehe, da war er tot. Aber am Morgen sah ich ihn genau an, und siehe, es war nicht mein Sohn, den ich geboren hatte.
1 Könige_1Kön_11_3_22_Das andere Weib sprach: Nicht also; mein Sohn lebt, und dein Sohn ist tot. Jene aber sprach: Nicht also; dein Sohn ist tot, und mein Sohn lebt. Und redeten also vor dem König.
1 Könige_1Kön_11_3_23_Und der König sprach: Diese spricht: mein Sohn lebt, und dein Sohn ist tot; jene spricht: Nicht also; dein Sohn ist tot, und mein Sohn lebt.
1 Könige_1Kön_11_3_24_Und der König sprach: Holet mir ein Schwert her! und da das Schwert vor den König gebracht ward,
1 Könige_1Kön_11_3_25_sprach der König: Teilt das lebendige Kind in zwei Teile und gebt dieser die Hälfte und jener die Hälfte.
1 Könige_1Kön_11_3_26_Da sprach das Weib, des Sohn lebte, zum König (denn ihr mütterliches Herz entbrannte über ihren Sohn): Ach, mein Herr, gebt ihr das Kind lebendig und tötet es nicht! Jene aber sprach: Es sei weder mein noch dein; laßt es teilen!
1 Könige_1Kön_11_3_27_Da antwortete der König und sprach: Gebet dieser das Kind lebendig und tötet es nicht; die ist seine Mutter.
1 Könige_1Kön_11_3_28_Und das Urteil, das der König gefällt hatte, erscholl vor dem ganzen Israel, und sie fürchteten sich vor dem König; denn sie sahen, daß die Weisheit Gottes in ihm war, Gericht zu halten.
1 Könige_1Kön_11_4_1_Also war Salomo König über ganz Israel.
1 Könige_1Kön_11_4_2_Und dies waren seine Fürsten: Asarja, der Sohn Zadoks, des Priesters,
1 Könige_1Kön_11_4_3_Elihoreph und Ahija, die Söhne Sisas, waren Schreiber. Josaphat, der Sohn Ahiluds, war Kanzler.
1 Könige_1Kön_11_4_4_Benaja, der Sohn Jojadas, war Feldhauptmann. Zadok und Abjathar waren Priester.
1 Könige_1Kön_11_4_5_Asarja, der Sohn Nathans, war über die Amtleute. Sabud, der Sohn Nathans, war Priester, des Königs Freund.
1 Könige_1Kön_11_4_6_Ahisar war Hofmeister. Adoniram, der Sohn Abdas, war Rentmeister.
1 Könige_1Kön_11_4_7_Und Salomo hatte zwölf Amtleute über ganz Israel, die den König und sein Haus versorgten. Ein jeder hatte des Jahres eine Monat lang zu versorgen;
1 Könige_1Kön_11_4_8_und hießen also: Der Sohn Hurs auf dem Gebirge Ephraim;
1 Könige_1Kön_11_4_9_der Sohn Dekers zu Makaz und zu Saalbim und zu Beth-Semes und zu Elon und Beth-Hanan;
1 Könige_1Kön_11_4_10_der Sohn Heseds zu Arubboth, und hatte dazu Socho und das ganze Land Hepher;
1 Könige_1Kön_11_4_11_der Sohn Abinadabs über die ganze Herrschaft zu Dor, und hatte Taphath, Salomos Tochter zum Weibe;
1 Könige_1Kön_11_4_12_Baana, der Sohn Ahiluds, zu Thaanach und zu Megiddo und über ganz Beth-Sean, welches liegt neben Zarthan unter Jesreel, von Beth-Sean bis an Abel-Mehola, bis jenseit Jokmeams;
1 Könige_1Kön_11_4_13_der Sohn Gebers zu Ramoth in Gilead, und hatte die Flecken Jairs, des Sohnes Manasses, in Gilead und hatte die Gegend Argob, die in Basan liegt, sechzig große Städte, vermauert und mit ehernen Riegeln;
1 Könige_1Kön_11_4_14_Ahinadab, der Sohn Iddos, zu Mahanaim;
1 Könige_1Kön_11_4_15_Ahimaaz in Naphthali, und der nahm auch Salomos Tochter Basmath zum Weibe;
1 Könige_1Kön_11_4_16_Baana, der Sohn Husais, in Asser und zu Aloth;
1 Könige_1Kön_11_4_17_Josaphat, der Sohn Paruahs, in Isaschar;
1 Könige_1Kön_11_4_18_Simei, der Sohn Elas, in Benjamin;
1 Könige_1Kön_11_4_19_Geber, der Sohn Uris, im Lande Gilead, im Lande Sihons, des Königs der Amoriter und Ogs, des Königs von Basan (ein Amtmann war in demselben Lande).
1 Könige_1Kön_11_4_20_Juda aber und Israel, deren war viel wie der Sand am Meer, und sie aßen und tranken und waren fröhlich.
1 Könige_1Kön_11_4_21_Also war Salomo ein Herr über alle Königreiche, von dem Strom an bis zu der Philister Lande und bis an die Grenze Ägyptens, die ihm Geschenke zubrachten und ihm dienten sein Leben lang.
1 Könige_1Kön_11_4_22_Und Salomo mußte täglich zur Speisung haben dreißig Kor Semmelmehl, sechzig Kor anderes Mehl,
1 Könige_1Kön_11_4_23_zehn gemästete Rinder und zwanzig Weiderinder und hundert Schafe, ausgenommen Hirsche und Rehe und Gemsen und gemästetes Federvieh.
1 Könige_1Kön_11_4_24_Denn er herrschte im ganzen Lande diesseit des Stromes, von Tiphsah bis gen Gaza, über alle Könige diesseit des Stromes, und hatte Frieden von allen seinen Untertanen umher,
