1 Könige_1Kön_11_4_25_daß Juda und Israel sicher wohnten, ein jeglicher unter seinem Weinstock und unter seinem Feigenbaum, von Dan bis gen Beer-Seba, solange Salomo lebte.
1 Könige_1Kön_11_4_26_Und Salomo hatte vierzigtausend Wagenpferde und zwölftausend Reisige.
1 Könige_1Kön_11_4_27_Und die Amtleute versorgten den König Salomo und alles, was zum Tisch des Königs gehörte, ein jeglicher in seinem Monat, und ließen nichts fehlen.
1 Könige_1Kön_11_4_28_Auch Gerste und Stroh für die Rosse und Renner brachten sie an den Ort, da er war, ein jeglicher nach seinem Befehl.
1 Könige_1Kön_11_4_29_Und Gott gab Salomo sehr große Weisheit und Verstand und reichen Geist wie Sand, der am Ufer des Meeres liegt,
1 Könige_1Kön_11_4_30_daß die Weisheit Salomos größer war denn aller, die gegen Morgen wohnen, und aller Ägypter Weisheit.
1 Könige_1Kön_11_4_31_Und er war weiser denn alle Menschen, auch weiser denn Ethan, der Esrahiter, Heman, Chalkol und Darda, die Söhne Mahols, und war berühmt unter allen Heiden umher.
1 Könige_1Kön_11_4_32_Und er redete dreitausend Sprüche, und seine Lieder waren tausendundfünf.
1 Könige_1Kön_11_4_33_Und er redete von Bäumen, von der Zeder an auf dem Libanon bis an Isop, der aus der Wand wächst. Auch redete er von Vieh, von Vögeln, von Gewürm und von Fischen.
1 Könige_1Kön_11_4_34_Und es kamen aus allen Völkern, zu hören die Weisheit Salomos, von allen Königen auf Erden, die von seiner Weisheit gehört hatten.
1 Könige_1Kön_11_5_1_Und Hiram, der König zu Tyrus, sandte seine Knechte zu Salomo; denn er hatte gehört, daß sie ihn zum König gesalbt hatten an seines Vaters Statt. Denn Hiram liebte David sein Leben lang.
1 Könige_1Kön_11_5_2_Und Salomo sandte zu Hiram und ließ ihm sagen:
1 Könige_1Kön_11_5_3_Du weißt, daß mein Vater David nicht konnte bauen ein Haus dem Namen des HERRN, seines Gottes, um des Krieges willen, der um ihn her war, bis sie der HERR unter seiner Füße Sohlen gab.
1 Könige_1Kön_11_5_4_Nun aber hat mir der HERR, mein Gott, Ruhe gegeben umher, daß kein Widersacher noch böses Hindernis mehr ist.
1 Könige_1Kön_11_5_5_Siehe, so habe ich gedacht, ein Haus zu bauen dem Namen des HERRN, meines Gottes, wie der HERR geredet hat zu meinem Vater David und gesagt: Dein Sohn, den ich an deine Statt setzen werde auf deinen Stuhl, der soll meinem Namen das Haus bauen.
1 Könige_1Kön_11_5_6_So befiehl nun, daß man mir Zedern aus dem Libanon haue, und daß deine Knechte mit meinen Knechten seien. Und den Lohn deiner Knechte will ich dir geben, alles, wie du sagst. Denn du weißt, daß bei uns niemand ist, der Holz zu hauen wisse wie die Sidonier.
1 Könige_1Kön_11_5_7_Da Hiram aber hörte die Worte Salomos, freute er sich hoch und sprach: Gelobt sei der HERR heute, der David einen weisen Sohn gegeben hat über dies große Volk.
1 Könige_1Kön_11_5_8_Und Hiram sandte zu Salomo und ließ ihm sagen: Ich habe gehört, was du zu mir gesandt hast. Ich will tun nach allem deinem Begehr mit Zedern-und Tannenholz
1 Könige_1Kön_11_5_9_Meine Knechte sollen die Stämme vom Libanon hinabbringen ans Meer, und will sie in Flöße legen lassen auf dem Meer bis an den Ort, den du mir wirst ansagen lassen, und will sie daselbst abbinden, und du sollst's holen lassen. Aber du sollst auch mein Begehr tun und Speise geben meinem Gesinde.
1 Könige_1Kön_11_5_10_Also gab Hiram Salomo Zedern-und Tannenholz nach allem seinem Begehr.
1 Könige_1Kön_11_5_11_Salomo aber gab Hiram zwanzigtausend Kor Weizen, zu essen für sein Gesinde, und zwanzig Kor gestoßenen Öls. Solches gab Salomo jährlich dem Hiram.
1 Könige_1Kön_11_5_12_Und der HERR gab Salomo Weisheit, wie er ihm geredet hatte. Und es war Friede zwischen Hiram und Salomo, und sie machten beide einen Bund miteinander.
1 Könige_1Kön_11_5_13_Und Salomo hob Fronarbeiter aus von ganz Israel, und ihre Zahl war dreißigtausend Mann,
1 Könige_1Kön_11_5_14_und sandte sie auf den Libanon, je einen Monat zehntausend, daß sie einen Monat auf dem Libanon waren und zwei Monate daheim. Und Adoniram war über solche Anzahl.
1 Könige_1Kön_11_5_15_Und Salomo hatte siebzigtausend, die Last trugen, und achtzigtausend, die da Steine hieben auf dem Berge,
1 Könige_1Kön_11_5_16_ohne die obersten Amtleute Salomos, die über das Werk gesetzt waren: dreitausenddreihundert, welche über das Volk herrschten, das da am Werk arbeitete.
1 Könige_1Kön_11_5_17_und der König gebot, daß sie große und köstliche Steine ausbrächen, gehauene Steine zum Grund des Hauses.
1 Könige_1Kön_11_5_18_Und die Bauleute Salomos und die Bauleute Hirams und die Gebaliter hieben aus und bereiteten zu Holz und Steine, zu bauen das Haus.
1 Könige_1Kön_11_6_1_Im vierhundertachtzigsten Jahr nach dem Ausgang der Kinder Israel aus Ägyptenland, im vierten Jahr des Königreichs Salomo über Israel, im Monat Siv, das ist der zweite Monat, ward das Haus des HERRN gebaut.
1 Könige_1Kön_11_6_2_Das Haus aber, das der König Salomo dem HERRN baute, war sechzig Ellen lang, zwanzig Ellen breit und dreißig Ellen hoch.
1 Könige_1Kön_11_6_3_Und er baute eine Halle vor dem Tempel, zwanzig Ellen lang nach der Breite des Hauses und zehn Ellen breit vor dem Hause her.
1 Könige_1Kön_11_6_4_Und er machte an das Haus Fenster mit festen Stäben davor.
1 Könige_1Kön_11_6_5_Und er baute einen Umgang an der Wand des Hauses ringsumher, daß er um den Tempel und um den Chor her ging, und machte Seitengemächer umher.
1 Könige_1Kön_11_6_6_Der unterste Gang war fünf Ellen weit und der mittelste sechs Ellen weit und der dritte sieben Ellen weit; denn er machte Absätze außen am Hause umher, daß die Balken nicht in die Wände des Hauses eingriffen.
1 Könige_1Kön_11_6_7_Und da das Haus gesetzt ward, waren die Steine zuvor ganz zugerichtet, daß man kein Hammer noch Beil noch irgend ein eisernes Werkzeug im Bauen hörte.
1 Könige_1Kön_11_6_8_Eine Tür aber war zur rechten Seite mitten im Hause, daß man durch eine Wendeltreppe hinaufging auf den Mittelgang und vom Mittelgang auf den dritten.
1 Könige_1Kön_11_6_9_Also baute er das Haus und vollendete es; und er deckte das Haus mit Balken und Tafelwerk von Zedern.
1 Könige_1Kön_11_6_10_Und er baute die Gänge um das ganze Haus herum, je fünf Ellen hoch, und verband sie mit dem Hause durch Balken von Zedernholz.
1 Könige_1Kön_11_6_11_Und es geschah des HERRN Wort zu Salomo und sprach:
1 Könige_1Kön_11_6_12_Also sei es mit dem Hause, das du baust: Wirst du in meinen Geboten wandeln und nach meinen Rechten tun und alle meine Gebote halten, darin zu wandeln, so will ich mein Wort mit dir bestätigen, wie ich deinem Vater David geredet habe,
1 Könige_1Kön_11_6_13_und will wohnen unter den Kindern Israel und will mein Volk Israel nicht verlassen.
1 Könige_1Kön_11_6_14_Und Salomo baute das Haus und vollendete es.
1 Könige_1Kön_11_6_15_Er baute die Wände des Hauses inwendig mit Brettern von Zedern; von des Hauses Boden bis an die Decke täfelte er es mit Holz inwendig, und den Boden des Hauses täfelte er mit Tannenbrettern.
1 Könige_1Kön_11_6_16_Und er baute von der hintern Seite des Hauses an zwanzig Ellen mit zedernen Brettern vom Boden bis an die Decke und baute also inwendig den Chor, das Allerheiligste.
1 Könige_1Kön_11_6_17_Aber das Haus des Tempels (vor dem Chor) war vierzig Ellen lang.
1 Könige_1Kön_11_6_18_Inwendig war das ganze Haus eitel Zedern mit gedrehten Knoten und Blumenwerk, daß man keinen Stein sah.
1 Könige_1Kön_11_6_19_Aber den Chor bereitete er inwendig im Haus, daß man die Lade des Bundes des HERRN dahin täte.
1 Könige_1Kön_11_6_20_Und vor dem Chor, der zwanzig Ellen lang, zwanzig Ellen weit und zwanzig Ellen hoch war und überzogen mit lauterem Gold, täfelte er den Altar mit Zedern.
1 Könige_1Kön_11_6_21_Und Salomo überzog das Haus inwendig mit lauterem Golde und zog goldene Riegel vor dem Chor her, den er mit Gold überzogen hatte,
1 Könige_1Kön_11_6_22_also daß das ganze Haus ganz mit Gold überzogen war; dazu auch den ganzen Altar vor dem Chor überzog er mit Gold.
1 Könige_1Kön_11_6_23_Er machte auch im Chor zwei Cherubim, zehn Ellen hoch, von Ölbaumholz.
1 Könige_1Kön_11_6_24_Fünf Ellen hatte ein Flügel eines jeglichen Cherubs, daß zehn Ellen waren vom Ende seines einen Flügels zum Ende des andern Flügels.
1 Könige_1Kön_11_6_25_Also hatte der andere Cherub auch zehn Ellen, und war einerlei Maß und einerlei Gestalt beider Cherubim;
1 Könige_1Kön_11_6_26_auch war ein jeglicher Cherub zehn Ellen hoch.
1 Könige_1Kön_11_6_27_Und er tat die Cherubim inwendig ins Haus. Und die Cherubim breiteten ihre Flügel aus, daß eines Flügel rührte an diese Wand und des andern Cherubs Flügel rührte an die andere Wand; aber mitten im Hause rührte ein Flügel an den andern.
1 Könige_1Kön_11_6_28_Und er überzog die Cherubim mit Gold.
1 Könige_1Kön_11_6_29_Und an allen Wänden des Hauses um und um ließ er Schnitzwerk machen von ausgehöhlten Cherubim, Palmen und Blumenwerk inwendig und auswendig.
1 Könige_1Kön_11_6_30_Auch überzog er den Boden des Hauses mit goldenen Blechen inwendig und auswendig.
1 Könige_1Kön_11_6_31_Und am Eingang des Chors machte er zwei Türen von Ölbaumholz mit fünfeckigen Pfosten
1 Könige_1Kön_11_6_32_und ließ Schnitzwerk darauf machen von Cherubim, Palmen und Blumenwerk und überzog sie mit goldenen Blechen.
1 Könige_1Kön_11_6_33_Also machte er auch im Eingang des Tempels viereckige Pfosten von Ölbaumholz
1 Könige_1Kön_11_6_34_und zwei Türen von Tannenholz, daß eine jegliche Tür zwei Blatt hatte aneinander hangen in ihren Angeln,
1 Könige_1Kön_11_6_35_und machte Schnitzwerk darauf von Cherubim, Palmen und Blumenwerk und überzog es mit Gold, genau wie es eingegraben war.
1 Könige_1Kön_11_6_36_Und er baute auch den inneren Hof von drei Reihen behauener Steine und von einer Reihe zederner Balken.
1 Könige_1Kön_11_6_37_Im vierten Jahr, im Monat Siv, ward der Grund gelegt am Hause des HERRN,
1 Könige_1Kön_11_6_38_und im elften Jahr, im Monat Bul (das ist der achte Monat), ward das Haus bereitet, wie es sein sollte, daß sie sieben Jahre daran bauten,
1 Könige_1Kön_11_7_1_Aber an seinem Hause baute Salomo dreizehn Jahre, daß er's ganz ausbaute.
1 Könige_1Kön_11_7_2_Nämlich er baute das Haus vom Wald Libanon, hundert Ellen lang, fünfzig Ellen weit und dreißig Ellen hoch. Auf vier Reihen von zedernen Säulen legte er den Boden von zedernen Balken,
1 Könige_1Kön_11_7_3_und deckte mit Zedern die Gemächer auf den Säulen, und der Gemächer waren fünfundvierzig, je fünfzehn in einer Reihe.
1 Könige_1Kön_11_7_4_Und Gebälk lag in drei Reihen, und waren Fenster einander gegenüber dreimal.
1 Könige_1Kön_11_7_5_Und alle Türen waren in ihren Pfosten viereckig, und die Fenster waren einander gegenüber dreimal.
1 Könige_1Kön_11_7_6_Er baute auch eine Halle von Säulen, fünfzig Ellen lang und dreißig Ellen breit, und noch eine Halle vor diese mit Säulen und einem Aufgang davor,
1 Könige_1Kön_11_7_7_Und baute eine Halle zum Richtstuhl, darin man Gericht hielt, und täfelte sie vom Boden bis zur Decke mit Zedern.
1 Könige_1Kön_11_7_8_Dazu sein Haus, darin er wohnte, im Hinterhof, hinten an der Halle, gemacht wie die andern. Und machte auch ein Haus wie die Halle der Tochter Pharaos, die Salomo zum Weibe genommen hatte.
1 Könige_1Kön_11_7_9_Solches alles waren köstliche Steine, nach dem Winkeleisen gehauen, mit Sägen geschnitten auf allen Seiten, vom Grund an bis an das Dach und von außen bis zum großen Hof.
1 Könige_1Kön_11_7_10_Die Grundfeste aber waren auch köstliche und große Steine, zehn und acht Ellen groß,
1 Könige_1Kön_11_7_11_und darauf köstliche Steine, nach dem Winkeleisen gehauen, und Zedern.
1 Könige_1Kön_11_7_12_Aber der große Hof umher hatte drei Reihen behauene Steine und eine Reihe von zedernen Balken wie auch der innere Hof am Hause des HERRN und die Halle am Hause.
1 Könige_1Kön_11_7_13_Und der König Salomo sandte hin und ließ holen Hiram von Tyrus,
1 Könige_1Kön_11_7_14_einer Witwe Sohn aus dem Stamm Naphthali, und sein Vater war ein Mann von Tyrus gewesen; der war ein Meister im Erz, voll Weisheit, Verstand und Kunst, zu arbeiten allerlei Erzwerk. Da er zum König Salomo kam, machte er alle seine Werke.
1 Könige_1Kön_11_7_15_Und machte zwei eherne Säulen, eine jegliche achtzehn Ellen hoch, und ein Faden von zwölf Ellen war das Maß um jegliche Säule her.
1 Könige_1Kön_11_7_16_Und machte zwei Knäufe, von Erz gegossen, oben auf die Säulen zu setzen und ein jeglicher Knauf war fünf Ellen hoch.
1 Könige_1Kön_11_7_17_Und es war an jeglichem Knauf oben auf den Säulen Gitterwerk, sieben geflochtenen Reife wie Ketten.
1 Könige_1Kön_11_7_18_Und machte an jeglichem Knauf zwei Reihen Granatäpfel umher an dem Gitterwerk, womit der Knauf bedeckt ward.
1 Könige_1Kön_11_7_19_Und die Knäufe waren wie die Lilien, vor der Halle, vier Ellen groß.
1 Könige_1Kön_11_7_20_Und der Granatäpfel in den Reihen umher waren zweihundert, oben und unten an dem Gitterwerk, das um den Bauch des Knaufs her ging, an jeglichem Knauf auf beiden Säulen.
1 Könige_1Kön_11_7_21_Und er richtete die Säulen auf vor der Halle des Tempels. Und die er zur rechten Hand setzte, hieß er Jachin, und die er zur linken Hand setzte, hieß er Boas.
1 Könige_1Kön_11_7_22_Und es stand also oben auf den Säulen wie Lilien. Also ward vollendet das Werk der Säulen.
1 Könige_1Kön_11_7_23_Und er machte ein Meer, gegossen von einem Rand zum andern zehn Ellen weit, rundumher, und fünf Ellen hoch, und eine Schnur dreißig Ellen lang war das Maß ringsum.
1 Könige_1Kön_11_7_24_Und um das Meer gingen Knoten an seinem Rande rings ums Meer her, je zehn auf eine Elle; der Knoten aber waren zwei Reihen gegossen.
1 Könige_1Kön_11_7_25_Und es stand auf zwölf Rindern, deren drei gegen Mitternacht gewandt waren, drei gegen Abend, drei gegen Mittag und drei gegen Morgen, und das Meer obendrauf, daß alle ihre Hinterteile inwendig waren.
1 Könige_1Kön_11_7_26_Seine Dicke aber ward eine Hand breit, und sein Rand war wie eines Bechers Rand, wie eine aufgegangene Lilie, und gingen darein zweitausend Bath.
1 Könige_1Kön_11_7_27_Er machte auch zehn eherne Gestühle, ein jegliches vier Ellen lang und breit und drei Ellen hoch.
1 Könige_1Kön_11_7_28_Es war aber das Gestühl also gemacht, daß es Seiten hatte zwischen den Leisten.
1 Könige_1Kön_11_7_29_Und an den Seiten zwischen den Leisten waren Löwen, Ochsen und Cherubim. Und die Seiten, daran die Löwen und Ochsen waren, hatten Leisten oben und unten, dazu herabhängende Kränze.
1 Könige_1Kön_11_7_30_Und ein jegliches Gestühl hatte vier eherne Räder mit ehernem Gestell. Und auf vier Ecken waren Achseln gegossen, eine jegliche der andern gegenüber, unten an den Kessel gelehnt.
1 Könige_1Kön_11_7_31_Aber der Hals mitten auf dem Gestühl war eine Elle hoch und rund, anderthalb Ellen weit, und waren Buckeln an dem Hals, in Feldern, die viereckig waren und nicht rund.
1 Könige_1Kön_11_7_32_Die vier Räder aber standen unten an den Seiten, und die Achsen der Räder waren am Gestühl. Ein jegliches Rad war anderthalb Ellen hoch.
1 Könige_1Kön_11_7_33_Und es waren Räder wie Wagenräder. Und ihre Achsen, Naben, Speichen und Felgen waren alle gegossen.
1 Könige_1Kön_11_7_34_Und die vier Achseln auf den vier Ecken eines jeglichen Gestühls waren auch am Gestühl.
1 Könige_1Kön_11_7_35_Und am Hals oben auf dem Gestühl, eine halbe Elle hoch, rundumher, waren Leisten und Seiten am Gestühl.
1 Könige_1Kön_11_7_36_Und er ließ auf die Fläche der Seiten und Leisten graben Cherubim, Löwen und Palmenbäume, nach dem auf jeglichem Raum war, und Kränze ringsumher daran.
1 Könige_1Kön_11_7_37_Auf diese Weise machte er zehn Gestühle, gegossen; einerlei Maß und Gestalt war an allen.
1 Könige_1Kön_11_7_38_Und er machte zehn eherne Kessel, daß vierzig Bath in einen Kessel ging, und jeder war vier Ellen groß; und auf jeglichem Gestühl war ein Kessel.
1 Könige_1Kön_11_7_39_Und setzte fünf Gestühle an die rechte Ecke des Hauses und die andern fünf an die linke Ecke; aber das Meer setzte er zur Rechten vornan gegen Mittag.
1 Könige_1Kön_11_7_40_Und Hiram machte auch Töpfe, Schaufeln, Becken und vollendete also alle Werke, die der König Salomo am Hause des HERRN machen ließ:
1 Könige_1Kön_11_7_41_die zwei Säulen und die kugeligen Knäufe oben auf den zwei Säulen; die zwei Gitterwerke, zu bedecken die zwei kugeligen Knäufe auf den Säulen;
1 Könige_1Kön_11_7_42_und die vierhundert Granatäpfel an den zwei Gitterwerken, je zwei Reihen Granatäpfel an einem Gitterwerk, zu bedecken die zwei kugeligen Knäufe auf den Säulen;
1 Könige_1Kön_11_7_43_dazu die zehn Gestühle und zehn Kessel obendrauf;
1 Könige_1Kön_11_7_44_und das Meer und zwölf Rinder unter dem Meer;
1 Könige_1Kön_11_7_45_und die Töpfe, Schaufeln und Becken. Und alle diese Gefäße, die Hiram dem König Salomo machte zum Hause des HERRN, waren von geglättetem Erz.
1 Könige_1Kön_11_7_46_In der Gegend am Jordan ließ sie der König gießen in dicker Erde, zwischen Sukkoth und Zarthan.
1 Könige_1Kön_11_7_47_Und Salomo ließ alle Gefäße ungewogen vor der sehr großen Menge des Erzes.
1 Könige_1Kön_11_7_48_Auch machte Salomo alles Gerät, das zum Hause des HERRN gehörte: einen goldenen Altar, einen goldenen Tisch, darauf die Schaubrote liegen;
1 Könige_1Kön_11_7_49_fünf Leuchter zur rechten Hand und fünf Leuchter zur Linken vor dem Chor, von lauterem Gold, mit goldenen Blumen, Lampen und Schneuzen;
1 Könige_1Kön_11_7_50_dazu Schalen, Messer, Becken, Löffel und Pfannen von lauterem Gold. Auch waren die Angeln an der Tür am Hause inwendig, im Allerheiligsten, und an der Tür des Hauses des Tempels golden.
1 Könige_1Kön_11_7_51_Also ward vollendet alles Werk, das der König Salomo machte am Hause des HERRN. Und Salomo brachte hinein, was sein Vater David geheiligt hatte von Silber und Gold und Gefäßen, und legte es in den Schatz des Hauses des HERRN.
1 Könige_1Kön_11_8_1_Da versammelt der König Salomo zu sich die Ältesten in Israel, alle Obersten der Stämme und Fürsten der Vaterhäuser unter den Kindern Israel gen Jerusalem, die Lade des Bundes des HERRN heraufzubringen aus der Stadt Davids, das ist Zion.
1 Könige_1Kön_11_8_2_Und es versammelten sich zum König Salomo alle Männer in Israel im Monat Ethanim, am Fest, das ist der siebente Monat.
1 Könige_1Kön_11_8_3_Und da alle Ältesten Israels kamen, hoben die Priester die Lade des HERRN auf
1 Könige_1Kön_11_8_4_und brachten sie hinauf, dazu die Hütte des Stifts und alle Geräte des Heiligtums, das in der Hütte war. Das taten die Priester und die Leviten.
1 Könige_1Kön_11_8_5_Und der König Salomo und die ganze Gemeinde Israel, die sich zu ihm versammelt hatte, gingen mit ihm vor der Lade her und opferten Schafe und Rinder, so viel, daß man's nicht zählen noch rechnen konnte.
1 Könige_1Kön_11_8_6_Also brachten die Priester die Lade des Bundes des HERRN an ihren Ort, in den Chor des Hauses, in das Allerheiligste, unter die Flügel der Cherubim.
1 Könige_1Kön_11_8_7_Denn die Cherubim breiteten die Flügel aus an dem Ort, da die Lade stand, und bedeckten die Lade und ihre Stangen von obenher.
1 Könige_1Kön_11_8_8_Und die Stangen waren so lang, daß ihre Knäufe gesehen wurden in dem Heiligtum vor dem Chor, aber außen wurden sie nicht gesehen, und waren daselbst bis auf diesen Tag.
1 Könige_1Kön_11_8_9_Und war nichts in der Lade denn nur die zwei steinernen Tafeln Mose's, die er hineingelegt hatte am Horeb, da der HERR mit den Kindern Israel einen Bund machte, da sie aus Ägyptenland gezogen waren.
1 Könige_1Kön_11_8_10_Da aber die Priester aus dem Heiligtum gingen, erfüllte die Wolke das Haus des HERRN,
1 Könige_1Kön_11_8_11_daß die Priester nicht konnten stehen und des Amts pflegen vor der Wolke; denn die Herrlichkeit des HERRN erfüllte das Haus des HERRN.
1 Könige_1Kön_11_8_12_Da sprach Salomo: Der HERR hat geredet, er wolle im Dunkel wohnen.
1 Könige_1Kön_11_8_13_So habe ich nun ein Haus gebaut dir zur Wohnung, einen Sitz, daß du ewiglich da wohnest.
1 Könige_1Kön_11_8_14_Und der König wandte sein Angesicht und segnete die ganze Gemeinde Israel; und die ganze Gemeinde Israel stand.
1 Könige_1Kön_11_8_15_Und er sprach: Gelobet sei der HERR, der Gott Israels, der durch seinen Mund meinem Vater David geredet und durch seine Hand erfüllt hat und gesagt:
1 Könige_1Kön_11_8_16_Von dem Tage an, da ich mein Volk Israel aus Ägypten führte, habe ich keine Stadt erwählt unter irgend einem Stamm Israels, daß mir ein Haus gebaut würde, daß mein Name da wäre; David aber habe ich erwählt, daß er über mein Volk Israel sein sollte.
1 Könige_1Kön_11_8_17_Und mein Vater David hatte es zuvor im Sinn, daß er ein Haus baute dem Namen des HERRN, des Gottes Israels;
1 Könige_1Kön_11_8_18_aber der HERR sprach zu meinem Vater David: Daß du im Sinn hast, meinem Namen ein Haus zu bauen, hast du wohl getan, daß du dir solches vornahmst.
1 Könige_1Kön_11_8_19_Doch du sollst das Haus nicht bauen; sondern dein Sohn, der aus deinen Lenden kommen wird, der soll meinem Namen ein Haus bauen.
1 Könige_1Kön_11_8_20_Und der HERR hat sein Wort bestätigt, das er geredet hat; denn ich bin aufgekommen an meines Vaters Davids Statt und sitze auf dem Stuhl Israels, wie der HERR geredet hat, und habe gebaut ein Haus dem Namen des HERRN des Gottes Israels,
1 Könige_1Kön_11_8_21_und habe daselbst eine Stätte zugerichtet der Lade, darin der Bund des HERRN ist, den er gemacht hat mit unsern Vätern, da er sie aus Ägyptenland führte.
1 Könige_1Kön_11_8_22_Und Salomo trat vor den Altar des HERRN gegenüber der ganzen Gemeinde Israel und breitete seine Hände aus gen Himmel
1 Könige_1Kön_11_8_23_und sprach: HERR, Gott Israels, es ist kein Gott, weder droben im Himmel noch unten auf der Erden, dir gleich, der du hältst den Bund und die Barmherzigkeit deinen Knechten, die vor dir wandeln von ganzem Herzen;
1 Könige_1Kön_11_8_24_der du hast gehalten deinem Knecht, meinem Vater David, was du ihm geredet hast. Mit deinem Mund hast du es geredet, und mit deiner Hand hast du es erfüllt, wie es steht an diesem Tage.
1 Könige_1Kön_11_8_25_Nun, HERR, Gott Israels, halte deinem Knecht, meinem Vater David, was du ihm verheißen hast und gesagt: Es soll dir nicht gebrechen an einem Mann vor mir, der da sitze auf dem Stuhl Israels, so doch, daß deine Kinder ihren Weg bewahren, daß sie vor mir wandeln, wie du vor mir gewandelt hast.
1 Könige_1Kön_11_8_26_Nun, Gott Israels, laß deine Worte wahr werden, die du deinem Knecht, meinem Vater David, geredet hast.
1 Könige_1Kön_11_8_27_Denn sollte in Wahrheit Gott auf Erden wohnen? Siehe, der Himmel und aller Himmel Himmel können dich nicht fassen; wie sollte es denn dies Haus tun, das ich gebaut habe?
1 Könige_1Kön_11_8_28_Wende dich aber zum Gebet deines Knechtes und zu seinem Flehen, HERR, mein Gott, auf daß du hörest das Lob und Gebet, das dein Knecht heute vor dir tut;
1 Könige_1Kön_11_8_29_daß deine Augen offen stehen über dies Haus Nacht und Tag, über die Stätte, davon du gesagt hast: Mein Name soll da sein. Du wollest hören das Gebet, das dein Knecht an dieser Stätte tut,
1 Könige_1Kön_11_8_30_und wollest erhören das Flehen deines Knechtes und deines Volkes Israel, das sie hier tun werden an dieser Stätte; und wenn du es hörst in deiner Wohnung, im Himmel, wollest du gnädig sein.
1 Könige_1Kön_11_8_31_Wenn jemand wider seinen Nächsten sündigt und es wird ihm ein Eid aufgelegt, den er schwören soll, und der Eid kommt vor deinen Altar in diesem Hause:
1 Könige_1Kön_11_8_32_so wollest du hören im Himmel und recht schaffen deinen Knechten, den Gottlosen zu verdammen und seinen Wandel auf seinen Kopf zu bringen und den Gerechten gerecht zu sprechen, ihm zu geben nach seiner Gerechtigkeit.
1 Könige_1Kön_11_8_33_Wenn dein Volk Israel vor seinen Feinden geschlagen wird, weil sie an dir gesündigt haben, und sie bekehren sich zu dir und bekennen deinen Namen und beten und flehen zu dir in diesem Hause:
1 Könige_1Kön_11_8_34_so wollest du hören im Himmel und der Sünde deines Volkes Israel gnädig sein und sie wiederbringen in das Land, das du ihren Vätern gegeben hast.
1 Könige_1Kön_11_8_35_Wenn der Himmel verschlossen wird, daß es nicht regnet, weil sie an dir gesündigt haben, und sie werden beten an diesem Ort und deinen Namen bekennen und sich von ihren Sünden bekehren, weil du sie drängest;
1 Könige_1Kön_11_8_36_so wollest du hören im Himmel und gnädig sein der Sünde deiner Knechte und deines Volkes Israel, daß du ihnen den guten Weg weisest, darin sie wandeln sollen, und lassest regnen auf das Land, das du deinem Volk zum Erbe gegeben hast.
1 Könige_1Kön_11_8_37_Wenn eine Teuerung oder Pestilenz oder Dürre oder Brand oder Heuschrecken oder Raupen im Lande sein werden, oder sein Feind im Lande seine Tore belagert, oder irgend eine Plage oder Krankheit da ist;
1 Könige_1Kön_11_8_38_wer dann bittet und fleht, es seien sonst Menschen oder dein ganzes Volk Israel, die da gewahr werden ihrer Plage ein jeglicher in seinem Herzen, und breitet seine Hände aus zu diesem Hause:
1 Könige_1Kön_11_8_39_so wollest du hören im Himmel, in dem Sitz, da du wohnst, und gnädig sein und schaffen, daß du gebest einem jeglichen, wie er gewandelt hat, wie du sein Herz erkennst, denn du allein kennst das Herz aller Kinder der Menschen,
1 Könige_1Kön_11_8_40_auf daß sie dich fürchten allezeit, solange sie in dem Lande leben, das du unsern Vätern gegeben hast.
1 Könige_1Kön_11_8_41_Wenn auch ein Fremder, der nicht von deinem Volk Israel ist, kommt aus fernem Lande um deines Namens willen
