1 Könige_1Kön_11_8_42_(denn sie werden hören von deinem großen Namen und von deiner mächtigen Hand und von deinem ausgereckten Arm), und kommt, daß er bete vor diesem Hause:
1 Könige_1Kön_11_8_43_so wollest du hören im Himmel, im Sitz deiner Wohnung, und tun alles, darum der Fremde dich anruft, auf daß alle Völker auf Erden deinen Namen erkennen, daß sie auch dich fürchten wie dein Volk Israel und daß sie innewerden, wie dies Haus nach deinem Namen genannt sei, das ich gebaut habe.
1 Könige_1Kön_11_8_44_Wenn dein Volk auszieht in den Streit wider seine Feinde des Weges, den du sie senden wirst, und sie werden beten zum HERRN nach der Stadt hin, die du erwählt hast, und nach dem Hause, das ich deinem Namen gebaut habe:
1 Könige_1Kön_11_8_45_so wollest du ihr Gebet und Flehen hören im Himmel und Recht schaffen.
1 Könige_1Kön_11_8_46_Wenn sie an dir sündigen werden (denn es ist kein Mensch, der nicht sündigt), und du erzürnst und gibst sie dahin vor ihren Feinden, daß sie sie gefangen führen in der Feinde Land, fern oder nahe,
1 Könige_1Kön_11_8_47_und sie in ihr Herz schlagen in dem Lande, da sie gefangen sind, und bekehren sich und flehen zu dir im Lande ihres Gefängnisses und sprechen: Wir haben gesündigt und übel getan und sind gottlos gewesen,
1 Könige_1Kön_11_8_48_und bekehren sich also zu dir von ganzem Herzen und von ganzer Seele in ihrer Feinde Land, die sie weggeführt haben, und beten zu dir nach ihrem Lande hin, das du ihren Vätern gegeben hast, nach der Stadt hin, die du erwählt hast, und nach dem Hause, das ich deinem Namen gebaut habe:
1 Könige_1Kön_11_8_49_so wollest du ihr Gebet und Flehen hören im Himmel, vom Sitz deiner Wohnung, und Recht schaffen
1 Könige_1Kön_11_8_50_und deinem Volk gnädig sein, das an dir gesündigt hat, und allen ihren Übertretungen, damit sie wider dich übertreten haben, und Barmherzigkeit geben vor denen, die sie gefangen halten, daß sie sich ihrer erbarmen;
1 Könige_1Kön_11_8_51_denn sie sind dein Volk und dein Erbe, die du aus Ägypten, aus dem eisernen Ofen, geführt hast.
1 Könige_1Kön_11_8_52_Laß deine Augen offen sein auf das Flehen deines Knechtes und deines Volkes Israel, daß du sie hörest in allem, darum sie dich anrufen;
1 Könige_1Kön_11_8_53_denn du hast sie dir abgesondert zum Erbe aus allen Völkern auf Erden, wie du geredet hast durch Mose, deinen Knecht, da du unsre Väter aus Ägypten führtest, HERR!
1 Könige_1Kön_11_8_54_Und da Salomo all dieses Gebet und Flehen hatte vor dem HERRN ausgebetet, stand er auf von dem Altar des HERRN und ließ ab vom Knieen und Hände-Ausbreiten gen Himmel
1 Könige_1Kön_11_8_55_und trat dahin und segnete die ganze Gemeinde Israel mit lauter Stimme und sprach:
1 Könige_1Kön_11_8_56_Gelobet sei der HERR, der seinem Volk Israel Ruhe gegeben hat, wie er geredet hat. Es ist nicht eins dahingefallen aus allen seinen guten Worten, die er geredet hat durch seinen Knecht Mose.
1 Könige_1Kön_11_8_57_Der Herr, unser Gott, sei mit uns, wie er gewesen ist mit unsern Vätern. Er verlasse uns nicht und ziehe die Hand nicht ab von uns,
1 Könige_1Kön_11_8_58_zu neigen unser Herz zu ihm, daß wir wandeln in allen seinen Wegen und halten seine Gebote, Sitten und Rechte, die er unsern Vätern geboten hat.
1 Könige_1Kön_11_8_59_Und diese Worte, die ich vor dem HERR gefleht habe, müssen nahekommen dem HERRN, unserm Gott, Tag und Nacht, daß er Recht schaffe seinem Knecht und seinem Volk Israel, ein jegliches zu seiner Zeit,
1 Könige_1Kön_11_8_60_auf daß alle Völker auf Erden erkennen, daß der HERR Gott ist und keiner mehr.
1 Könige_1Kön_11_8_61_Und euer Herz sei rechtschaffen mit dem HERRN, unserm Gott, zu wandeln in seinen Sitten und zu halten seine Gebote, wie es heute geht.
1 Könige_1Kön_11_8_62_Und der König samt dem ganzen Israel opferten vor dem HERRN Opfer.
1 Könige_1Kön_11_8_63_Und Salomo opferte Dankopfer, die er dem HERR opferte, zweiundzwanzigtausend Ochsen und hundertzwanzigtausend Schafe. Also weihten sie das Haus des HERRN ein, der König und alle Kinder Israel.
1 Könige_1Kön_11_8_64_Desselben Tages weihte der König die Mitte des Hofes, der vor dem Hause des HERRN war, damit, daß er Brandopfer, Speisopfer und das Fett der Dankopfer daselbst ausrichtete. Denn der eherne Altar, der vor dem HERRN stand, war zu klein zu dem Brandopfer, Speisopfer und zum Fett der Dankopfer.
1 Könige_1Kön_11_8_65_Und Salomo machte zu der Zeit ein Fest und alles Israel mit ihm, eine große Versammlung, von der Grenze Hamaths an bis an den Bach Ägyptens, vor dem HERRN, unserm Gott, sieben Tage und abermals sieben Tage, das waren vierzehn Tage.
1 Könige_1Kön_11_8_66_Und er ließ das Volk des achten Tages gehen. Und sie segneten den König und gingen hin zu ihren Hütten fröhlich und guten Muts über all dem Guten, das der HERR an David, seinem Knecht und an seinem Volk Israel getan hatte.
1 Könige_1Kön_11_9_1_Und da Salomo hatte ausgebaut des HERRN Haus und des Königs Haus und alles, was er begehrte und Lust hatte zu machen,
1 Könige_1Kön_11_9_2_erschien ihm der HERR zum andernmal, wie er ihm erschienen war zu Gibeon.
1 Könige_1Kön_11_9_3_Und der HERR sprach zu ihm: Ich habe dein Gebet und Flehen gehört, das du vor mir gefleht hast, und habe dies Haus geheiligt, das du gebaut hast, daß ich meinen Namen dahin setze ewiglich; und meine Augen und mein Herz sollen da sein allewege.
1 Könige_1Kön_11_9_4_Und du, so du vor mir wandelst, wie dein Vater David gewandelt hat, mit rechtschaffenem Herzen und aufrichtig, daß du tust alles, was ich dir geboten habe, und meine Gebote und Rechte hältst:
1 Könige_1Kön_11_9_5_so will ich bestätigen den Stuhl deines Königreiches über Israel ewiglich, wie ich deinem Vater David geredet habe und gesagt: Es soll dir nicht gebrechen an einem Mann auf dem Stuhl Israels.
1 Könige_1Kön_11_9_6_Werdet ihr aber euch von mir abwenden, ihr und eure Kinder, und nicht halten meine Gebote und Rechte, die ich euch vorgelegt habe, und hingehen und andern Göttern dienen und sie anbeten:
1 Könige_1Kön_11_9_7_so werde ich Israel ausrotten von dem Lande, das ich ihnen gegeben habe; und das Haus, das ich geheiligt habe meinem Namen, will ich verwerfen von meinem Angesicht; und Israel wird ein Sprichwort und eine Fabel sein unter allen Völkern.
1 Könige_1Kön_11_9_8_Und das Haus wird eingerissen werden, daß alle, die vorübergehen, werden sich entsetzen und zischen und sagen: Warum hat der HERR diesem Lande und diesem Hause also getan?
1 Könige_1Kön_11_9_9_so wird man antworten: Darum, daß sie den HERRN, ihren Gott, verlassen haben, der ihre Väter aus Ägyptenland führte, und haben angenommen andere Götter und sie angebetet und ihnen gedient, darum hat der HERR all dies Übel über sie gebracht.
1 Könige_1Kön_11_9_10_Da nun die zwanzig Jahre um waren, in welchen Salomo die zwei Häuser baute, des HERRN Haus und des Königs Haus,
1 Könige_1Kön_11_9_11_dazu Hiram, der König zu Tyrus, Salomo Zedernbäume und Tannenbäume und Gold nach allem seinem Begehr brachte: Da gab der König Salomo Hiram zwanzig Städte im Land Galiläa.
1 Könige_1Kön_11_9_12_Und Hiram zog aus von Tyrus, die Städte zu besehen, die ihm Salomo gegeben hatte; und sie gefielen ihm nicht,
1 Könige_1Kön_11_9_13_und er sprach: Was sind das für Städte, mein Bruder, die du mir gegeben hast? Und hieß das Land Kabul bis auf diesen Tag.
1 Könige_1Kön_11_9_14_Und Hiram hatte gesandt dem König Salomo hundertzwanzig Zentner Gold.
1 Könige_1Kön_11_9_15_Und also verhielt sich's mit den Fronleuten, die der König Salomo aushob, zu bauen des HERRN Haus und sein Haus und Millo und die Mauer Jerusalems und Hazor und Megiddo und Geser.
1 Könige_1Kön_11_9_16_Denn Pharao, der König in Ägypten, war heraufgekommen und hatte Geser gewonnen und mit Feuer verbrannt und die Kanaaniter erwürgt, die in der Stadt wohnten, und hatte sie seiner Tochter, Salomos Weib, zum Geschenk gegeben.
1 Könige_1Kön_11_9_17_Also baute Salomo Geser und das niedere Beth-Horon
1 Könige_1Kön_11_9_18_und Baalath und Thamar in der Wüste im Lande
1 Könige_1Kön_11_9_19_und alle Städte der Kornhäuser, die Salomo hatte, und alle Städte der Wagen und die Städte der Reiter, und wozu er Lust hatte zu bauen in Jerusalem, im Libanon und im ganzen Lande seiner Herrschaft.
1 Könige_1Kön_11_9_20_Und alles übrige Volk von den Amoritern, Hethitern, Pheresitern, Hevitern und Jebusitern, die nicht von den Kindern Israel waren,
1 Könige_1Kön_11_9_21_derselben Kinder, die sie hinter sich übrigbleiben ließen im Lande, die die Kinder Israel nicht konnten verbannen: die machte Salomo zu Fronleuten bis auf diesen Tag.
1 Könige_1Kön_11_9_22_Aber von den Kindern Israel machte er nicht Knechte, sondern ließ sie Kriegsleute und seine Knechte und Fürsten und Ritter und über seine Wagen und Reiter sein.
1 Könige_1Kön_11_9_23_Und die obersten Amtleute, die über Salomos Geschäfte waren, deren waren fünfhundertfünfzig, die über das Volk herrschten, das die Geschäfte ausrichtete.
1 Könige_1Kön_11_9_24_Und die Tochter Pharaos zog herauf von der Stadt Davids in ihr Haus, das er für sie gebaut hatte. Da baute er auch Millo.
1 Könige_1Kön_11_9_25_Und Salomo opferte des Jahres dreimal Brandopfer und Dankopfer auf dem Altar, den er dem HERRN gebaut hatte, und räucherte auf ihm vor dem HERRN. Und ward also das Haus fertig.
1 Könige_1Kön_11_9_26_Und Salomo machte auch Schiffe zu Ezeon-Geber, das bei Eloth liegt am Ufer des Schilfmeers im Lande der Edomiter.
1 Könige_1Kön_11_9_27_Und Hiram sandte seine Knechte im Schiff, die gute Schiffsleute und auf dem Meer erfahren waren, mit den Knechten Salomos;
1 Könige_1Kön_11_9_28_und sie kamen gen Ophir und holten daselbst vierhundertzwanzig Zentner Gold und brachten's dem König Salomo.
1 Könige_1Kön_11_10_1_Und da das Gerücht von Salomo und von dem Namen des HERRN kam vor die Königin von Reicharabien, kam sie, Salomo zu versuchen mit Rätseln.
1 Könige_1Kön_11_10_2_Und sie kam gen Jerusalem mit sehr vielem Volk, mit Kamelen, die Spezerei trugen und viel Gold und Edelsteine. Und da sie zum König Salomo hineinkam, redete sie ihm alles, was sie sich vorgenommen hatte.
1 Könige_1Kön_11_10_3_Und Salomo sagte es ihr alles, und war dem König nichts verborgen, das er ihr nicht sagte.
1 Könige_1Kön_11_10_4_Da aber die Königin von Reicharabien sah alle Weisheit Salomos und das Haus, das er gebaut hatte,
1 Könige_1Kön_11_10_5_und die Speise für seinen Tisch und seiner Knechte Wohnung und seiner Diener Amt und ihre Kleider und seine Schenken und seine Brandopfer, die er im Hause des HERRN opferte, konnte sie sich nicht mehr enthalten
1 Könige_1Kön_11_10_6_und sprach zum König: Es ist wahr, was ich in meinem Lande gehört habe von deinem Wesen und von deiner Weisheit.
1 Könige_1Kön_11_10_7_Und ich habe es nicht wollen glauben, bis ich gekommen bin und habe es mit meinen Augen gesehen. Und siehe, es ist mir nicht die Hälfte gesagt. Du hast mehr Weisheit und Gut, denn das Gerücht ist, das ich gehört habe.
1 Könige_1Kön_11_10_8_Selig sind die Leute und deine Knechte, die allezeit vor dir stehen und deine Weisheit hören.
1 Könige_1Kön_11_10_9_Gelobt sei der HERR, dein Gott, der zu dir Lust hat, daß er dich auf den Stuhl Israels gesetzt hat; darum daß der HERR Israel liebhat ewiglich, hat er dich zum König gesetzt, daß du Gericht und Recht haltest.
1 Könige_1Kön_11_10_10_Und sie gab dem König hundertzwanzig Zentner Gold und sehr viel Spezerei und Edelgestein. Es kam nicht mehr so viel Spezerei, als die Königin von Reicharabien dem König Salomo gab.
1 Könige_1Kön_11_10_11_Dazu die Schiffe Hirams, die Gold aus Ophir führten, brachten sehr viel Sandelholz und Edelgestein.
1 Könige_1Kön_11_10_12_Und der König ließ machen von Sandelholz Pfeiler im Hause des HERRN und im Hause des Königs und Harfen und Psalter für die Sänger. Es kam nicht mehr solch Sandelholz, ward auch nicht mehr gesehen bis auf diesen Tag.
1 Könige_1Kön_11_10_13_Und der König Salomo gab der Königin von Reicharabien alles, was sie begehrte und bat, außer was er ihr von selbst gab. Und sie wandte sich und zog in ihr Land samt ihren Knechten.
1 Könige_1Kön_11_10_14_Des Goldes aber, das Salomo in einem Jahr bekam, war am Gewicht sechshundertsechsundsechzig Zentner,
1 Könige_1Kön_11_10_15_außer was von den Krämern und dem Handel der Kaufleute und von allen Königen Arabiens und von den Landpflegern kam.
1 Könige_1Kön_11_10_16_Und der König Salomo ließ machen zweihundert Schilde vom besten Gold, sechshundert Lot tat er zu einem Schild,
1 Könige_1Kön_11_10_17_und dreihundert Tartschen vom besten Gold, je drei Pfund Gold zu einer Tartsche. Und der König tat sie in das Haus am Wald Libanon.
1 Könige_1Kön_11_10_18_Und der König machte einen großen Stuhl von Elfenbein und überzog ihn mit dem edelsten Golde.
1 Könige_1Kön_11_10_19_Und der Stuhl hatte sechs Stufen, und das Haupt hinten am Stuhl war rund, und waren Lehnen auf beiden Seiten um den Sitz, und zwei Löwen standen an den Lehnen.
1 Könige_1Kön_11_10_20_Und zwölf Löwen standen auf den sechs Stufen auf beiden Seiten. Solches ist nie gemacht in allen Königreichen.
1 Könige_1Kön_11_10_21_Alle Trinkgefäße des Königs Salomo waren golden, und alle Gefäße im Hause vom Wald Libanon waren auch lauter Gold; denn das Silber achtete man zu den Zeiten Salomos für nichts.
1 Könige_1Kön_11_10_22_Denn die Meerschiffe des Königs, die auf dem Meer mit den Schiffen Hirams fuhren, kamen in drei Jahren einmal und brachten Gold, Silber, Elfenbein, Affen und Pfauen.
1 Könige_1Kön_11_10_23_Also ward der König Salomo größer an Reichtum und Weisheit denn alle Könige auf Erden.
1 Könige_1Kön_11_10_24_Und alle Welt begehrte Salomo zu sehen, daß sie die Weisheit hörten, die ihm Gott in sein Herz gegeben hatte.
1 Könige_1Kön_11_10_25_Und jedermann brachte ihm Geschenke, silberne und goldene Geräte, Kleider und Waffen, Würze, Rosse, Maultiere-jährlich.
1 Könige_1Kön_11_10_26_Und Salomo brachte zuhauf Wagen und Reiter, daß er hatte tausend und vierhundert Wagen und zwölftausend Reiter, und legte sie in die Wagenstädte und zum König nach Jerusalem.
1 Könige_1Kön_11_10_27_Und der König machte, daß des Silbers zu Jerusalem so viel war wie die Steine, und Zedernholz so viel wie die wilden Feigenbäume in den Gründen
1 Könige_1Kön_11_10_28_Und man brachte dem Salomo Pferde aus Ägypten und allerlei Ware; und die Kaufleute des Königs kauften diese Ware
1 Könige_1Kön_11_10_29_und brachten's aus Ägypten heraus, je einen Wagen um sechshundert Silberlinge und ein Pferd um hundertfünfzig. Also brachte man sie auch allen Königen der Hethiter und den Königen von Syrien durch ihre Hand.
1 Könige_1Kön_11_11_1_Aber der König Salomo liebte viel ausländische Weiber: Die Tochter Pharaos und moabitische, ammonitische, edomitische, sidonische und hethitische,
1 Könige_1Kön_11_11_2_von solchen Völkern, davon der HERR gesagt hatte den Kindern Israel: Gehet nicht zu ihnen und laßt sie nicht zu euch kommen; sie werden gewiß eure Herzen neigen ihren Göttern nach. An diesen hing Salomo mit Liebe.
1 Könige_1Kön_11_11_3_Und er hatte siebenhundert Weiber zu Frauen und dreihundert Kebsweiber; und seine Weiber neigten sein Herz.
1 Könige_1Kön_11_11_4_Und da er nun alt war, neigten seine Weiber sein Herz den fremden Göttern nach, daß sein Herz nicht ganz war mit dem HERRN, seinem Gott, wie das Herz seines Vaters David.
1 Könige_1Kön_11_11_5_Also wandelte Salomo Asthoreth, der Göttin derer von Sidon, nach und Milkom, dem Greuel der Ammoniter.
1 Könige_1Kön_11_11_6_Und Salomo tat, was dem HERRN übel gefiel, und folgte nicht gänzlich dem HERRN wie sein Vater David.
1 Könige_1Kön_11_11_7_Da baute Salomo eine Höhe Kamos, dem Greuel der Moabiter, auf dem Berge, der vor Jerusalem liegt, und Moloch, dem Greuel der Ammoniter.
1 Könige_1Kön_11_11_8_Also tat Salomo allen seinen Weibern, die ihren Göttern räucherten und opferten.
1 Könige_1Kön_11_11_9_Der HERR aber ward zornig über Salomo, daß sein Herz von dem HERRN, dem Gott Israels, abgewandt war, der ihm zweimal erschienen war
1 Könige_1Kön_11_11_10_und ihm solches geboten hatte, daß er nicht andern Göttern nachwandelte, und daß er doch nicht gehalten hatte, was ihm der HERR geboten hatte.
1 Könige_1Kön_11_11_11_Darum sprach der HERR zu Salomo: Weil solches bei dir geschehen ist, und hast meinen Bund und meine Gebote nicht gehalten, die ich dir geboten habe, so will ich auch das Königreich von dir reißen und deinem Knecht geben.
1 Könige_1Kön_11_11_12_Doch bei deiner Zeit will ich's nicht tun um deines Vaters David willen; sondern von der Hand deines Sohnes will ich's reißen.
1 Könige_1Kön_11_11_13_Doch ich will nicht das ganze Reich abreißen; einen Stamm will ich deinem Sohn geben um Davids willen, meines Knechtes, und um Jerusalems willen, das ich erwählt habe.
1 Könige_1Kön_11_11_14_Und der HERR erweckte Salomo einen Widersacher, Hadad, den Edomiter, vom königlichen Geschlecht in Edom.
1 Könige_1Kön_11_11_15_Denn da David in Edom war und Joab, der Feldhauptmann, hinaufzog, die Erschlagenen zu begraben, schlug er was ein Mannsbild war in Edom.
1 Könige_1Kön_11_11_16_(Denn Joab blieb sechs Monate daselbst und das ganze Israel, bis er ausrottete alles, was ein Mannsbild war in Edom.)
1 Könige_1Kön_11_11_17_Da floh Hadad und mit ihm etliche Männer der Edomiter von seines Vaters Knechten, daß sie nach Ägypten kämen; Hadad aber war ein junger Knabe.
1 Könige_1Kön_11_11_18_Und sie machten sich auf von Midian und kamen gen Pharan und nahmen Leute mit sich aus Pharan und kamen nach Ägypten zu Pharao, dem König in Ägypten; der gab ihm ein Haus und Nahrung und wies ihm ein Land an.
1 Könige_1Kön_11_11_19_Und Hadad fand große Gnade vor dem Pharao, daß er ihm auch seines Weibes Thachpenes, der Königin, Schwester zum Weibe gab.
1 Könige_1Kön_11_11_20_Und die Schwester der Thachpenes gebar ihm Genubath, seinen Sohn; und Thachpenes zog ihn auf im Hause Pharaos, daß Genubath war im Hause Pharaos unter den Kindern Pharaos.
1 Könige_1Kön_11_11_21_Da nun Hadad hörte in Ägypten, daß David entschlafen war mit seinen Vätern und daß Joab, der Feldhauptmann, tot war, sprach er zu Pharao: Laß mich in mein Land ziehen!
1 Könige_1Kön_11_11_22_Pharao sprach zu ihm: Was fehlt dir bei mir, daß du willst in dein Land ziehen? Er sprach: Nichts; aber laß mich ziehen!
1 Könige_1Kön_11_11_23_Auch erweckte Gott ihm einen Widersacher, Reson, den Sohn Eljadas, der von seinem Herrn, Hadadeser, dem König zu Zoba, geflohen war,
1 Könige_1Kön_11_11_24_und sammelte wider ihn Männer und ward ein Hauptmann der Kriegsknechte, da sie David erwürgte; und sie zogen gen Damaskus und wohnten daselbst und regierten zu Damaskus.
1 Könige_1Kön_11_11_25_Und er war Israels Widersacher, solange Salomo lebte. Das kam zu dem Schaden, den Hadad tat; und Reson hatte einen Haß wider Israel und ward König über Syrien.
1 Könige_1Kön_11_11_26_Dazu Jerobeam, der Sohn Nebats, ein Ephraimiter von Zereda, Salomos Knecht (und seine Mutter hieß Zeruga, eine Witwe), der hob auch die Hand auf wider den König.
1 Könige_1Kön_11_11_27_Und das ist die Sache, darum er die Hand wider den König aufhob: da Salomo Millo baute, verschloß er die Lücke an der Stadt Davids, seines Vaters.
1 Könige_1Kön_11_11_28_Und Jerobeam war ein streitbarer Mann. Und da Salomo sah, daß der Jüngling tüchtig war, setzte er ihn über alle Lastarbeit des Hauses Joseph.
1 Könige_1Kön_11_11_29_Es begab sich aber zu der Zeit, daß Jerobeam ausging von Jerusalem, und es traf ihn der Prophet Ahia von Silo auf dem Wege und hatte einen Mantel an, und waren beide allein im Felde.
1 Könige_1Kön_11_11_30_Und Ahia faßte den neuen Mantel, den er anhatte, und riß ihn in zwölf Stücke
1 Könige_1Kön_11_11_31_und sprach zu Jerobeam: Nimm zehn Stücke zu dir! Denn so spricht der HERR, der Gott Israels: Siehe, ich will das Königreich von der Hand Salomos reißen und dir zehn Stämme geben,
1 Könige_1Kön_11_11_32_einen Stamm soll er haben um meines Knechtes David willen und um der Stadt Jerusalem willen, die ich erwählt habe aus allen Stämmen Israels,
1 Könige_1Kön_11_11_33_darum daß sie mich verlassen und angebetet haben Asthoreth, die Göttin der Sidonier, Kamos, den Gott der Moabiter, und Milkom, den Gott der Kinder Ammon, und nicht gewandelt haben in meinen Wegen, daß sie täten, was mir wohl gefällt, meine Gebote und Rechte, wie David, sein Vater.
1 Könige_1Kön_11_11_34_Ich will aber nicht das ganze Reich aus seiner Hand nehmen; sondern ich will ihn zum Fürsten machen sein Leben lang um Davids, meines Knechtes, willen, den ich erwählt habe, der meine Gebote und Rechte gehalten hat.
1 Könige_1Kön_11_11_35_Aus der Hand seines Sohnes will ich das Königreich nehmen und will dir zehn Stämme
1 Könige_1Kön_11_11_36_und seinem Sohn einen Stamm geben, auf daß David, mein Knecht, vor mir eine Leuchte habe allewege in der Stadt Jerusalem, die ich mir erwählt habe, daß ich meinen Namen dahin stellte.
1 Könige_1Kön_11_11_37_So will ich nun dich nehmen, daß du regierest über alles, was dein Herz begehrt, und sollst König sein über Israel.
1 Könige_1Kön_11_11_38_Wirst du nun gehorchen allem, was ich dir gebieten werde, und in meinen Wegen wandeln und tun, was mir gefällt, daß du haltest meine Rechte und Gebote, wie mein Knecht David getan hat: so will ich mit dir sein und dir ein beständiges Haus bauen, wie ich David gebaut habe, und will dir Israel geben
1 Könige_1Kön_11_11_39_und will den Samen Davids um deswillen demütigen, doch nicht ewiglich.
1 Könige_1Kön_11_11_40_Salomo aber trachtete, Jerobeam zu töten. Da machte sich Jerobeam auf und floh nach Ägypten zu Sisak, dem König in Ägypten, und blieb in Ägypten, bis daß Salomo starb.
1 Könige_1Kön_11_11_41_Was mehr von Salomo zu sagen ist, und alles, was er getan hat, und seine Weisheit, das ist geschrieben in der Chronik von Salomo.
1 Könige_1Kön_11_11_42_Die Zeit aber, die Salomo König war zu Jerusalem über ganz Israel, ist vierzig Jahre.
1 Könige_1Kön_11_11_43_Und Salomo entschlief mit seinen Vätern und ward begraben in der Stadt Davids, seines Vaters. Und sein Sohn Rehabeam ward König an seiner Statt.
1 Könige_1Kön_11_12_1_Und Rehabeam zog gen Sichem; denn das ganze Israel war gen Sichem gekommen, ihn zum König zu machen.
1 Könige_1Kön_11_12_2_Und Jerobeam, der Sohn Nebats, hörte das, da er noch in Ägypten war, dahin er vor dem König Salomo geflohen war, und blieb in Ägypten.
1 Könige_1Kön_11_12_3_Und sie sandten hin und ließen ihn rufen. Und Jerobeam samt der ganzen Gemeinde Israel kamen und redeten mit Rehabeam und sprachen:
1 Könige_1Kön_11_12_4_Dein Vater hat unser Joch zu hart gemacht; so mache du nun den harten Dienst und das schwere Joch leichter, das er uns aufgelegt hat, so wollen wir dir untertänig sein.
1 Könige_1Kön_11_12_5_Er aber sprach zu ihnen: Gehet hin bis an den dritten Tag, dann kommt wieder zu mir. Und das Volk ging hin.
1 Könige_1Kön_11_12_6_Und der König Rehabeam hielt einen Rat mit den Ältesten, die vor seinem Vater Salomo standen, da er lebte, und sprach: Wie ratet ihr, daß wir diesem Volk eine Antwort geben?
1 Könige_1Kön_11_12_7_Sie sprachen zu ihm: Wirst du heute diesem Volk einen Dienst tun und ihnen zu Willen sein und sie erhören und ihnen gute Worte geben, so werden sie dir untertänig sein dein Leben lang.
1 Könige_1Kön_11_12_8_Aber er ließ außer acht der Ältesten Rat, den sie ihm gegeben hatten, und hielt einen Rat mit den Jungen, die mit ihm aufgewachsen waren und vor ihm standen.
1 Könige_1Kön_11_12_9_Und er sprach zu Ihnen: Was ratet ihr, daß wir antworten diesem Volk, die zu mir gesagt haben: Mache das Joch leichter, das dein Vater auf uns gelegt hat?
1 Könige_1Kön_11_12_10_Und die Jungen, die mit ihm aufgewachsen waren, sprachen zu ihm: Du sollst zu dem Volk, das zu dir sagt: \"Dein Vater hat unser Joch zu schwer gemacht; mache du es uns leichter\", also sagen: Mein kleinster Finger soll dicker sein denn meines Vaters Lenden.
1 Könige_1Kön_11_12_11_Nun, mein Vater hat auf euch ein schweres Joch geladen; ich aber will des noch mehr über euch machen: Mein Vater hat euch mit Peitschen gezüchtigt; ich will euch mit Skorpionen züchtigen.
1 Könige_1Kön_11_12_12_Also kam Jerobeam samt dem ganzen Volk zu Rehabeam am dritten Tage, wie der König gesagt hatte und gesprochen: Kommt wieder zu mir am dritten Tage.
1 Könige_1Kön_11_12_13_Und der König gab dem Volk eine harte Antwort und ließ außer acht den Rat, den ihm die Ältesten gegeben hatten,
1 Könige_1Kön_11_12_14_und redete mit ihnen nach dem Rat der Jungen und sprach: Mein Vater hat euer Joch schwer gemacht; ich aber will des noch mehr über euch machen: Mein Vater hat euch mit Peitschen gezüchtigt; ich aber will euch mit Skorpionen züchtigen.
1 Könige_1Kön_11_12_15_Also gehorchte der König dem Volk nicht; denn es war also abgewandt von dem HERRN, auf daß er sein Wort bekräftigte, das er durch Ahia von Silo geredet hatte zu Jerobeam, dem Sohn Nebats.
1 Könige_1Kön_11_12_16_Da aber das ganze Israel sah, daß der König nicht auf sie hören wollte, gab das Volk dem König eine Antwort und sprach: Was haben wir für Teil an David oder Erbe am Sohn Isais? Israel, hebe dich zu deinen Hütten! So, siehe nun du zu deinem Hause, David! Also ging Israel in seine Hütten,
1 Könige_1Kön_11_12_17_daß Rehabeam regierte nur über die Kinder Israel, die in den Städten Juda's wohnten.
1 Könige_1Kön_11_12_18_Und da der König Rehabeam hinsandte Adoram, den Rentmeister, warf ihn ganz Israel mit Steinen zu Tode. Aber der König Rehabeam stieg stracks auf einen Wagen, daß er flöhe gen Jerusalem.
1 Könige_1Kön_11_12_19_Also fiel Israel ab vom Hause David bis auf diesen Tag.
