1 Könige_1Kön_11_16_31_Und es war ihm ein Geringes, daß er wandelte in der Sünde Jerobeams, des Sohnes Nebats, und nahm dazu Isebel, die Tochter Ethbaals, des Königs zu Sidon, zum Weibe und ging hin und diente Baal und betete ihn an
1 Könige_1Kön_11_16_32_und richtete Baal einen Altar auf im Hause Baals, das er baute zu Samaria,
1 Könige_1Kön_11_16_33_und machte ein Ascherabild; daß Ahab mehr tat, den HERRN, den Gott Israels, zu erzürnen, denn alle Könige Israels, die vor ihm gewesen waren.
1 Könige_1Kön_11_16_34_Zur selben Zeit baute Hiel von Beth-El Jericho. Es kostete ihn seinen ersten Sohn Abiram, da er den Grund legte, und den jüngsten Sohn Segub, da er die Türen setzte, nach dem Wort des HERRN, das er geredet hatte durch Josua, den Sohn Nuns.
1 Könige_1Kön_11_17_1_Und es sprach Elia, der Thisbiter, aus den Bürgern Gileads, zu Ahab: So wahr der HERR, der Gott Israels, lebt, vor dem ich stehe, es soll diese Jahre weder Tau noch Regen kommen, ich sage es denn.
1 Könige_1Kön_11_17_2_Und das Wort des HERRN kam zu ihm und sprach:
1 Könige_1Kön_11_17_3_Gehe weg von hinnen und wende dich gegen Morgen und verbirg dich am Bach Krith, der gegen den Jordan fließt;
1 Könige_1Kön_11_17_4_und sollst vom Bach trinken; und ich habe den Raben geboten, daß sie dich daselbst sollen versorgen.
1 Könige_1Kön_11_17_5_Er aber ging hin und tat nach dem Wort des HERRN und ging weg und setzte sich am Bach Krith, der gegen den Jordan fließt.
1 Könige_1Kön_11_17_6_Und die Raben brachten ihm das Brot und Fleisch des Morgens und des Abends, und er trank vom Bach.
1 Könige_1Kön_11_17_7_Und es geschah nach etlicher Zeit, daß der Bach vertrocknete; denn es war kein Regen im Lande.
1 Könige_1Kön_11_17_8_Da kam das Wort des HERRN zu ihm und sprach:
1 Könige_1Kön_11_17_9_Mache dich auf und gehe gen Zarpath, welches bei Sidon liegt, und bleibe daselbst; denn ich habe einer Witwe geboten, daß sie dich versorge.
1 Könige_1Kön_11_17_10_Und er machte sich auf und ging gen Zarpath. Und da er kam an das Tor der Stadt, siehe, da war eine Witwe und las Holz auf. Und er rief ihr und sprach: Hole mir ein wenig Wasser im Gefäß, daß ich trinke!
1 Könige_1Kön_11_17_11_Da sie aber hinging, zu holen, rief er ihr und sprach: Bringe mir auch einen Bissen Brot mit!
1 Könige_1Kön_11_17_12_Sie sprach: So wahr der HERR, dein Gott, lebt, ich habe nichts gebackenes, nur eine Handvoll Mehl im Kad und ein wenig Öl im Krug. Und siehe, ich habe ein Holz oder zwei aufgelesen und gehe hinein und will mir und meinem Sohn zurichten, daß wir essen und sterben.
1 Könige_1Kön_11_17_13_Elia sprach zu ihr: Fürchte dich nicht! Gehe hin und mach's, wie du gesagt hast. Doch mache mir am ersten ein kleines Gebackenes davon und bringe mir's heraus; dir aber und deinem Sohn sollst du darnach auch machen.
1 Könige_1Kön_11_17_14_Denn also spricht der HERR, der Gott Israels: Das Mehl im Kad soll nicht verzehrt werden, und dem Ölkrug soll nichts mangeln bis auf den Tag, da der HERR regnen lassen wird auf Erden.
1 Könige_1Kön_11_17_15_Sie ging hin und machte, wie Elia gesagt hatte. Und er aß und sie auch und ihr Haus eine Zeitlang.
1 Könige_1Kön_11_17_16_Das Mehl im Kad ward nicht verzehrt, und dem Ölkrug mangelte nichts nach dem Wort des HERRN, daß er geredet hatte durch Elia.
1 Könige_1Kön_11_17_17_Und nach diesen Geschichten ward des Weibes, seiner Hauswirtin, Sohn krank, und seine Krankheit war sehr hart, daß kein Odem mehr in ihm blieb.
1 Könige_1Kön_11_17_18_Und sie sprach zu Elia: Was habe ich mit dir zu schaffen, du Mann Gottes? Bist du zu mir hereingekommen, daß meiner Missetat gedacht und mein Sohn getötet würde.
1 Könige_1Kön_11_17_19_Er sprach zu ihr: Gib mir her deinen Sohn! Und er nahm ihn von ihrem Schoß und ging hinauf auf den Söller, da er wohnte, und legte ihn auf sein Bett
1 Könige_1Kön_11_17_20_und rief den HERRN an und sprach: HERR, mein Gott, hast du auch der Witwe, bei der ich ein Gast bin, so übel getan, daß du ihren Sohn tötetest?
1 Könige_1Kön_11_17_21_Und er maß sich über dem Kinde dreimal und rief den HERRN an und sprach: HERR, mein Gott, laß die Seele dieses Kindes wieder zu ihm kommen!
1 Könige_1Kön_11_17_22_Und der HERR erhörte die Stimme Elia's; und die Seele des Kindes kam wieder zu ihm, und es ward lebendig.
1 Könige_1Kön_11_17_23_Und Elia nahm das Kind und brachte es hinab vom Söller ins Haus und gab's seiner Mutter und sprach: Siehe da, dein Sohn lebt!
1 Könige_1Kön_11_17_24_Und das Weib sprach zu Elia: Nun erkenne ich, daß du ein Mann Gottes bist, und des HERRN Wort in deinem Munde ist Wahrheit.
1 Könige_1Kön_11_18_1_Und über eine lange Zeit kam das Wort des HERRN zu Elia, im dritten Jahr, und sprach: Gehe hin und zeige dich Ahab, daß ich regnen lasse auf Erden.
1 Könige_1Kön_11_18_2_Und Elia ging hin, daß er sich Ahab zeigte. Es war aber eine große Teuerung zu Samaria.
1 Könige_1Kön_11_18_3_Und Ahab rief Obadja, seinen Hofmeister. (Obadja aber fürchtete den HERRN sehr.
1 Könige_1Kön_11_18_4_Denn da Isebel die Propheten des HERRN ausrottete, nahm Obadja hundert Propheten und versteckte sie in Höhlen, hier fünfzig und da fünfzig, und versorgte sie mit Brot und Wasser.)
1 Könige_1Kön_11_18_5_So sprach nun Ahab zu Obadja: Zieh durchs Land zu allen Wasserbrunnen und Bächen, ob wir möchten Heu finden und die Rosse und Maultiere erhalten, daß nicht das Vieh alles umkomme.
1 Könige_1Kön_11_18_6_Und sie teilten sich ins Land, daß sie es durchzogen. Ahab zog allein auf einem Wege und Obadja auch allein den andern Weg.
1 Könige_1Kön_11_18_7_Da nun Obadja auf dem Wege war, siehe, da begegnete ihm Elia; und er erkannte ihn, fiel auf sein Antlitz und sprach: Bist du nicht mein Herr Elia?
1 Könige_1Kön_11_18_8_Er sprach: Ja. Gehe hin und sage deinem Herrn: Siehe, Elia ist hier!
1 Könige_1Kön_11_18_9_Er aber sprach: Was habe ich gesündigt, daß du deinen Knecht willst in die Hände Ahabs geben, daß er mich töte?
1 Könige_1Kön_11_18_10_So wahr der HERR, dein Gott, lebt, es ist kein Volk noch Königreich, dahin mein Herr nicht gesandt hat, dich zu suchen; und wenn sie sprachen: Er ist nicht hier, nahm er einen Eid von dem Königreich und Volk, daß man dich nicht gefunden hätte.
1 Könige_1Kön_11_18_11_Und du sprichst nun: Gehe hin, sage deinem Herrn: Siehe, Elia ist hier!
1 Könige_1Kön_11_18_12_Wenn ich nun hinginge von dir, so würde dich der Geist des HERRN wegnehmen, weiß nicht, wohin; und wenn ich dann käme und sagte es Ahab an und er fände dich nicht, so erwürgte er mich. Aber dein Knecht fürchtet den HERRN von seiner Jugend auf.
1 Könige_1Kön_11_18_13_Ist's meinem Herrn nicht angesagt, was ich getan habe, da Isebel die Propheten des HERR erwürgte? daß ich der Propheten des HERRN hundert versteckte, hier fünfzig und da fünfzig, in Höhlen und versorgte sie mit Brot und Wasser?
1 Könige_1Kön_11_18_14_Und du sprichst nun: Gehe hin, sage deinem Herrn: Elia ist hier! daß er mich erwürge.
1 Könige_1Kön_11_18_15_Elia sprach: So wahr der HERR Zebaoth lebt, vor dem ich stehe, ich will mich ihm heute zeigen.
1 Könige_1Kön_11_18_16_Da ging Obadja hin Ahab entgegen und sagte es ihm an. Und Ahab ging hin Elia entgegen.
1 Könige_1Kön_11_18_17_Und da Ahab Elia sah, sprach Ahab zu ihm: Bist du, der Israel verwirrt?
1 Könige_1Kön_11_18_18_Er aber sprach: Ich verwirre Israel nicht, sondern Du und deines Vaters Haus, damit daß ihr des HERRN Gebote verlassen habt und wandelt Baalim nach.
1 Könige_1Kön_11_18_19_Wohlan, so sende nun hin und versammle zu mir das ganze Israel auf den Berg Karmel und die vierhundertfünfzig Propheten Baals, auch die vierhundert Propheten der Aschera, die vom Tisch Isebels essen.
1 Könige_1Kön_11_18_20_Also sandte Ahab hin unter alle Kinder Israel und versammelte die Propheten auf den Berg Karmel.
1 Könige_1Kön_11_18_21_Da trat Elia zu allem Volk und sprach: Wie lange hinkt ihr auf beide Seiten? Ist der HERR Gott, so wandelt ihm nach; ist's aber Baal, so wandelt ihm nach. Und das Volk antwortete ihm nichts.
1 Könige_1Kön_11_18_22_Da sprach Elia zum Volk: Ich bin allein übriggeblieben als Prophet des HERRN; aber der Propheten Baals sind vierhundertfünfzig Mann.
1 Könige_1Kön_11_18_23_So gebt uns zwei Farren und laßt sie erwählen einen Farren und ihn zerstücken und aufs Holz legen und kein Feuer daran legen; so will ich den andern Farren nehmen und aufs Holz legen und auch kein Feuer daran legen.
1 Könige_1Kön_11_18_24_So rufet ihr an den Namen eures Gottes, und ich will den Namen des HERRN anrufen. Welcher Gott nun mit Feuer antworten wird, der sei Gott. Und das ganze Volk antwortete und sprach: Das ist recht.
1 Könige_1Kön_11_18_25_Und Elia sprach zu den Propheten Baals: Erwählt ihr einen Farren und richtet zu am ersten, denn euer ist viel; und ruft eures Gottes Namen an und legt kein Feuer daran.
1 Könige_1Kön_11_18_26_Und sie nahmen den Farren, den man ihnen gab, und richteten zu und riefen an den Namen Baals vom Morgen bis an den Mittag und sprachen: Baal, erhöre uns! Aber es war da keine Stimme noch Antwort. Und sie hinkten um den Altar, den sie gemacht hatten.
1 Könige_1Kön_11_18_27_Da es nun Mittag ward, spottete ihrer Elia und sprach: Ruft laut! denn er ist ein Gott; er dichtet oder hat zu schaffen oder ist über Feld oder schläft vielleicht, daß er aufwache.
1 Könige_1Kön_11_18_28_Und sie riefen laut und ritzten sich mit Messern und Pfriemen nach ihrer Weise, bis daß ihr Blut herabfloß.
1 Könige_1Kön_11_18_29_Da aber Mittag vergangen war, weissagten sie bis um die Zeit, da man Speisopfer tun sollte; und da war keine Stimme noch Antwort noch Aufmerken.
1 Könige_1Kön_11_18_30_Da sprach Elia zu allem Volk: Kommt her, alles Volk zu mir! Und da alles Volk zu ihm trat, baute er den Altar des HERRN wieder auf, der zerbrochen war,
1 Könige_1Kön_11_18_31_und nahm zwölf Steine nach der Zahl der Stämme der Kinder Jakobs (zu welchem das Wort des HERRN redete und sprach: Du sollst Israel heißen),
1 Könige_1Kön_11_18_32_und baute mit den Steinen einen Altar im Namen des HERRN und machte um den Altar her eine Grube, zwei Kornmaß weit,
1 Könige_1Kön_11_18_33_und richtete das Holz zu und zerstückte den Farren und legte ihn aufs Holz
1 Könige_1Kön_11_18_34_und sprach: Holt vier Kad Wasser voll und gießt es auf das Brandopfer und aufs Holz! Und sprach: Tut's noch einmal! Und sie taten's noch einmal. Und er sprach: Tut's zum drittenmal! Und sie taten's zum drittenmal.
1 Könige_1Kön_11_18_35_Und das Wasser lief um den Altar her, und die Grube ward auch voll Wasser.
1 Könige_1Kön_11_18_36_Und da die Zeit war, Speisopfer zu opfern, trat Elia, der Prophet, herzu und sprach: HERR, Gott Abrahams, Isaaks und Israels, laß heute kund werden, daß du Gott in Israel bist und ich dein Knecht, und daß ich solches alles nach deinem Wort getan habe!
1 Könige_1Kön_11_18_37_Erhöre mich HERR, erhöre mich, daß dies Volk wisse, daß du, HERR, Gott bist, daß du ihr Herz darnach bekehrst!
1 Könige_1Kön_11_18_38_Da fiel das Feuer des HERRN herab und fraß Brandopfer, Holz, Steine und Erde und leckte das Wasser auf in der Grube.
1 Könige_1Kön_11_18_39_Da das alles Volk sah, fiel es auf sein Angesicht und sprach: Der HERR ist Gott, der HERR ist Gott!
1 Könige_1Kön_11_18_40_Elia aber sprach zu ihnen: Greift die Propheten Baals, daß ihrer keiner entrinne! und sie griffen sie. Und Elia führte sie hinab an den Bach Kison und schlachtete sie daselbst.
1 Könige_1Kön_11_18_41_Und Elia sprach zu Ahab: Zieh hinauf, iß und trink; denn es rauscht, als wollte es sehr regnen.
1 Könige_1Kön_11_18_42_Und da Ahab hinaufzog, zu essen und zu trinken, ging Elia auf des Karmels Spitze und bückte sich zur Erde und tat sein Haupt zwischen seine Kniee
1 Könige_1Kön_11_18_43_und sprach zu seinem Diener: Geh hinauf und schau zum Meer zu! Er ging hinauf und schaute und sprach: Es ist nichts da. Er sprach: Geh wieder hin siebenmal!
1 Könige_1Kön_11_18_44_Und beim siebentenmal sprach er: Siehe, es geht eine kleine Wolke auf aus dem Meer wie eines Mannes Hand. Er sprach: Geh hinauf und sage Ahab: Spanne an und fahre hinab, daß dich der Regen nicht ergreife!
1 Könige_1Kön_11_18_45_Und ehe man zusah, ward der Himmel schwarz von Wolken und Wind, und kam ein großer Regen. Ahab aber fuhr und zog gen Jesreel.
1 Könige_1Kön_11_18_46_Und die Hand des HERRN kam über Elia, und er gürtete seine Lenden und lief vor Ahab hin, bis er kam gen Jesreel.
1 Könige_1Kön_11_19_1_Und Ahab sagte Isebel alles an, was Elia getan hatte und wie er hatte alle Propheten Baals mit dem Schwert erwürgt.
1 Könige_1Kön_11_19_2_Da sandte Isebel einen Boten zu Elia und ließ ihm sagen: Die Götter tun mir dies und das, wo ich nicht morgen um diese Zeit deiner Seele tue wie dieser Seelen einer.
1 Könige_1Kön_11_19_3_Da er das sah, machte er sich auf und ging hin um seines Lebens willen und kam gen Beer-Seba in Juda und ließ seinen Diener daselbst.
1 Könige_1Kön_11_19_4_Er aber ging hin in die Wüste eine Tagereise und kam hinein und setzte sich unter einen Wacholder und bat, daß seine Seele stürbe, und sprach: Es ist genug, so nimm nun, HERR, meine Seele; ich bin nicht besser denn meine Väter.
1 Könige_1Kön_11_19_5_Und er legte sich und schlief unter dem Wacholder. Und siehe, ein Engel rührte ihn an und sprach zu ihm: Steh auf und iß!
1 Könige_1Kön_11_19_6_Und er sah sich um, und siehe, zu seinen Häupten lag ein geröstetes Brot und eine Kanne mit Wasser. Und da er gegessen und getrunken hatte, legte er sich wieder schlafen.
1 Könige_1Kön_11_19_7_Und der Engel des HERRN kam zum andernmal wieder und rührte ihn an und sprach: Steh auf und iß! denn du hast einen großen Weg vor dir.
1 Könige_1Kön_11_19_8_Er stand auf und aß und trank und ging durch die Kraft derselben Speise vierzig Tage und vierzig Nächte bis an den Berg Gottes Horeb
1 Könige_1Kön_11_19_9_und kam daselbst in eine Höhle und blieb daselbst über Nacht. Und siehe, das Wort des HERRN kam zu ihm und sprach zu ihm: Was machst du hier, Elia?
1 Könige_1Kön_11_19_10_Er sprach: Ich habe geeifert um den HERRN, den Gott Zebaoth; denn die Kinder Israel haben deinen Bund verlassen und deine Altäre zerbrochen und deine Propheten mit dem Schwert erwürgt, und ich bin allein übriggeblieben, und sie stehen darnach, daß sie mir mein Leben nehmen.
1 Könige_1Kön_11_19_11_Er sprach: Gehe heraus und tritt auf den Berg vor den HERRN! Und siehe, der HERR ging vorüber und ein großer, starker Wind, der die Berge zerriß und die Felsen zerbrach, vor dem HERRN her; der HERR war aber nicht im Winde. Nach dem Winde aber kam ein Erdbeben; aber der HERR war nicht im Erdbeben.
1 Könige_1Kön_11_19_12_Und nach dem Erdbeben kam ein Feuer; aber der HERR war nicht im Feuer. Und nach dem Feuer kam ein stilles, sanftes Sausen.
1 Könige_1Kön_11_19_13_Da das Elia hörte, verhüllte er sein Antlitz mit seinem Mantel und ging heraus und trat in die Tür der Höhle. Und siehe, da kam eine Stimme zu ihm und sprach: Was hast du hier zu tun, Elia?
1 Könige_1Kön_11_19_14_Er sprach: Ich habe um den HERRN, den Gott Zebaoth, geeifert; denn die Kinder Israel haben deinen Bund verlassen, deine Altäre zerbrochen, deine Propheten mit dem Schwert erwürgt, und ich bin allein übriggeblieben, und sie stehen darnach, daß sie mir das Leben nehmen.
1 Könige_1Kön_11_19_15_Aber der HERR sprach zu ihm: Gehe wiederum deines Weges durch die Wüste gen Damaskus und gehe hinein und salbe Hasael zum König über Syrien,
1 Könige_1Kön_11_19_16_Und Jehu, den Sohn Nimsis, zum König über Israel, und Elisa, den Sohn Saphats, von Abel-Mehola, zum Propheten an deiner Statt.
1 Könige_1Kön_11_19_17_Und es soll geschehen, daß wer dem Schwert Hasaels entrinnt, den soll Jehu töten.
1 Könige_1Kön_11_19_18_Und ich will übriglassen siebentausend in Israel: alle Kniee, die sich nicht gebeugt haben vor Baal, und allen Mund, der ihn nicht geküßt hat.
1 Könige_1Kön_11_19_19_Und er ging von dannen und fand Elisa, den Sohn Saphats, daß er pflügte mit zwölf Jochen vor sich hin; und er war selbst bei dem zwölften. Und Elia ging zu ihm und warf seinen Mantel auf ihn.
1 Könige_1Kön_11_19_20_Er aber ließ die Rinder und lief Elia nach und sprach: Laß mich meinen Vater und meine Mutter küssen, so will ich dir nachfolgen. Er sprach zu ihm: Gehe hin und komme wieder; bedenke, was ich dir getan habe!
1 Könige_1Kön_11_19_21_Und er lief wieder von ihm und nahm ein Joch Rinder und opferte es und kochte das Fleisch mit dem Holzwerk an den Rindern und gab's dem Volk, daß sie aßen. Und machte sich auf und folgte Elia nach und diente ihm.
1 Könige_1Kön_11_20_1_Und Benhadad, der König von Syrien, versammelte alle seine Macht, und waren zweiunddreißig Könige mit ihm und Roß und Wagen, und zog herauf und belagerte Samaria und stritt dawider
1 Könige_1Kön_11_20_2_und sandte Boten zu Ahab, dem König Israels, in die Stadt
1 Könige_1Kön_11_20_3_und ließ ihm sagen: So spricht Benhadad: Dein Silber und dein Gold ist mein, und deine Weiber und deine besten Kinder sind auch mein.
1 Könige_1Kön_11_20_4_Der König Israels antwortete und sprach: Mein Herr König, wie du geredet hast! Ich bin dein und alles, was ich habe.
1 Könige_1Kön_11_20_5_Und die Boten kamen wieder und sprachen: So spricht Benhadad: Weil ich zu dir gesandt habe und lassen sagen: Dein Silber und dein Gold, deine Weiber und deine Kinder sollst du mir geben,
1 Könige_1Kön_11_20_6_so will ich morgen um diese Zeit meine Knechte zu dir senden, daß sie dein Haus und deiner Untertanen Häuser durchsuchen; und was dir lieblich ist, sollen sie in ihre Hände nehmen und wegtragen.
1 Könige_1Kön_11_20_7_Da rief der König Israels alle Ältesten des Landes und sprach: Merkt und seht, wie böse er's vornimmt! Er hat zu mir gesandt um meine Weiber und Kinder, Silber und Gold, und ich hab ihm nichts verweigert.
1 Könige_1Kön_11_20_8_Da sprachen zu ihm alle Alten und das Volk: Du sollst nicht gehorchen noch bewilligen.
1 Könige_1Kön_11_20_9_Und er sprach zu den Boten Benhadads: Sagt meinem Herrn, dem König: Alles, was du am ersten entboten hast, will ich tun; aber dies kann ich nicht tun. Und die Boten gingen hin und sagten solches wieder.
1 Könige_1Kön_11_20_10_Da sandte Benhadad zu ihm und ließ ihm sagen: Die Götter tun mir dies und das, wo der Staub Samarias genug sein soll, daß alles Volk unter mir eine Handvoll davon bringe.
1 Könige_1Kön_11_20_11_Aber der König Israels antwortete und sprach: Sagt: Der den Harnisch anlegt, soll sich nicht rühmen wie der, der ihn hat abgelegt.
1 Könige_1Kön_11_20_12_Da das Benhadad hörte und er eben trank mit den Königen in den Gezelten, sprach er zu seinen Knechten: Schickt euch! Und sie schickten sich wider die Stadt.
1 Könige_1Kön_11_20_13_Und siehe, ein Prophet trat zu Ahab, dem Königs Israels, und sprach: So spricht der HERR: Du hast ja gesehen all diesen großen Haufen. Siehe, ich will ihn heute in deine Hand geben, daß du wissen sollst, ich sei der HERR.
1 Könige_1Kön_11_20_14_Ahab sprach: Durch wen? Er sprach: So spricht der HERR: Durch die Leute der Landvögte. Er sprach: Wer soll den Streit anheben? Er sprach: Du.
1 Könige_1Kön_11_20_15_Da zählte er die Landvögte, und ihrer waren zweihundertzweiunddreißig, und zählte nach ihnen das Volk aller Kinder Israel, siebentausend Mann.
1 Könige_1Kön_11_20_16_Und sie zogen aus am Mittag. Benhadad aber trank und war trunken im Gezelt samt den zweiunddreißig Königen, die ihm zu Hilfe gekommen waren.
1 Könige_1Kön_11_20_17_Und die Leute der Landvögte zogen am ersten aus. Benhadad aber sandte aus, und die sagten ihm an und sprachen: Es ziehen Männer aus Samaria.
1 Könige_1Kön_11_20_18_Er sprach: Greift sie lebendig, sie seien um Friedens oder um Streit ausgezogen!
1 Könige_1Kön_11_20_19_Da aber die Leute der Landvögte waren ausgezogen und das Heer ihnen nach,
1 Könige_1Kön_11_20_20_schlug ein jeglicher, wer ihm vorkam. Und die Syrer flohen und Israel jagte ihnen nach. Und Benhadad, der König von Syrien, entrann mit Rossen und Reitern.
1 Könige_1Kön_11_20_21_Und der König Israels zog aus und schlug Roß und Wagen, daß er an den Syrern eine große Schlacht tat.
1 Könige_1Kön_11_20_22_Da trat der Prophet zum König Israels und sprach zu ihm: Gehe hin und stärke dich und merke und siehe, was du tust! Denn der König von Syrien wird wider dich heraufziehen, wenn das Jahr um ist.
1 Könige_1Kön_11_20_23_Denn die Knechte des Königs von Syrien sprachen zu ihm: Ihre Götter sind Berggötter; darum haben sie uns überwunden. O daß wir mit ihnen auf der Ebene streiten müßten! Was gilt's, wir wollten sie überwinden!
1 Könige_1Kön_11_20_24_Tue also: Tue die Könige weg, einen jeglichen an seinen Ort, und stelle die Landpfleger an ihre Stätte
1 Könige_1Kön_11_20_25_und ordne dir ein Heer, wie das Heer war, das du verloren hast, und Roß und Wagen, wie jene waren, und laß uns wider sie streiten auf der Ebene. Was gilt's, wir wollen ihnen obliegen! Er gehorchte ihrer Stimme und tat also.
1 Könige_1Kön_11_20_26_Als nun das Jahr um war, ordnete Benhadad die Syrer und zog herauf gen Aphek, wider Israel zu streiten.
1 Könige_1Kön_11_20_27_Und die Kinder Israel ordneten sich auch und versorgten sich und zogen hin ihnen entgegen und lagerten sich gegen sie wie zwei kleine Herden Ziegen. Der Syrer aber war das Land voll.
1 Könige_1Kön_11_20_28_Und es trat der Mann Gottes herzu und sprach zum König Israels: So spricht der HERR: Darum daß die Syrer haben gesagt, der HERR sei ein Gott der Berge und nicht ein Gott der Gründe, so habe ich all diesen großen Haufen in deine Hand gegeben, daß ihr wisset, ich sei der HERR.
1 Könige_1Kön_11_20_29_Und sie lagerten sich stracks gegen jene, sieben Tage. Am siebenten Tage zogen sie zuhauf in den Streit; und die Kinder Israel schlugen die Syrer hunderttausend Mann Fußvolk auf einen Tag.
1 Könige_1Kön_11_20_30_Und die übrigen flohen gen Aphek in die Stadt; und die Mauer fiel auf die übrigen siebenundzwanzigtausend Mann. Und Benhadad floh auch in die Stadt von einer Kammer in die andere.
1 Könige_1Kön_11_20_31_Da sprachen seine Knechte zu ihm: Siehe, wir haben gehört, daß die Könige des Hauses Israel barmherzige Könige sind; so laßt uns Säcke um unsere Lenden tun und Stricke um unsre Häupter und zum König Israels hinausgehen; vielleicht läßt er deine Seele leben.
1 Könige_1Kön_11_20_32_Und sie gürteten Säcke um ihre Lenden und Stricke um ihre Häupter und kamen zum König Israels und sprachen: Benhadad, dein Knecht, läßt dir sagen: Laß doch meine Seele leben! Er aber sprach: Lebt er noch, so ist er mein Bruder.
1 Könige_1Kön_11_20_33_Und die Männer nahmen eilend das Wort von ihm und deuteten's für sich und sprachen: Ja dein Bruder Benhadad. Er sprach: Kommt und bringt ihn! Da ging Benhadad zu ihm heraus. Und er ließ ihn auf dem Wagen sitzen.
1 Könige_1Kön_11_20_34_Und Benhadad sprach zu ihm: Die Städte, die mein Vater deinem Vater genommen hat, will ich dir wiedergeben; und mache dir Gassen zu Damaskus, wie mein Vater zu Samaria getan hat. So will ich (sprach Ahab) mit einem Bund dich ziehen lassen. Und er machte mit ihm einen Bund und ließ ihn ziehen.
1 Könige_1Kön_11_20_35_Da sprach ein Mann unter den Kindern der Propheten zu seinem Nächsten durch das Wort des HERRN: Schlage mich doch! Er aber weigerte sich, ihn zu schlagen.
1 Könige_1Kön_11_20_36_Da sprach er zu ihm: Darum daß du der Stimme des HERRN nicht hast gehorcht, siehe, so wird dich ein Löwe schlagen, wenn du von mir gehst. Und da er von ihm abging, fand ihn ein Löwe und schlug ihn.
1 Könige_1Kön_11_20_37_Und er fand einen anderen Mann und sprach: Schlage mich doch! und der Mann schlug ihn wund.
1 Könige_1Kön_11_20_38_Da ging der Prophet hin und trat zum König an den Weg und verstellte sein Angesicht mit einer Binde.
1 Könige_1Kön_11_20_39_Und da der König vorüberzog, schrie er den König an und sprach: Dein Knecht war ausgezogen mitten in den Streit. Und siehe, ein Mann war gewichen und brachte einen Mann zu mir und sprach: Verwahre diesen Mann; wo man ihn wird vermissen, so soll deine Seele anstatt seiner Seele sein, oder du sollst einen Zentner Silber darwägen.
1 Könige_1Kön_11_20_40_Und da dein Knecht hier und da zu tun hatte, war der nicht mehr da. Der König Israels sprach zu ihm: Das ist dein Urteil; du hast es selbst gefällt.
1 Könige_1Kön_11_20_41_Da tat er eilend die Binde von seinem Angesicht; und der König Israels kannte ihn, daß er der Propheten einer war.
1 Könige_1Kön_11_20_42_Und er sprach zu ihm: So spricht der HERR: Darum daß du hast den verbannten Mann von dir gelassen, wird deine Seele für seine Seele sein und dein Volk für sein Volk.
1 Könige_1Kön_11_20_43_Aber der König Israels zog hin voll Unmuts und zornig in sein Haus und kam gen Samaria.
1 Könige_1Kön_11_21_1_Nach diesen Geschichten begab sich's, daß Naboth, ein Jesreeliter, einen Weinberg hatte zu Jesreel, bei dem Palast Ahabs, des Königs zu Samaria.
1 Könige_1Kön_11_21_2_Und Ahab redete mit Naboth und sprach: Gib mir deinen Weinberg; ich will mir einen Kohlgarten daraus machen, weil er so nahe an meinem Hause liegt. Ich will dir einen bessern Weinberg dafür geben, oder, so dir's gefällt, will ich dir Silber dafür geben, soviel er gilt.
1 Könige_1Kön_11_21_3_Aber Naboth sprach zu Ahab: Das lasse der HERR fern von mir sein, daß ich dir meiner Väter Erbe sollte geben!
1 Könige_1Kön_11_21_4_Da kam Ahab heim voll Unmuts und zornig um des Wortes willen, das Naboth, der Jesreeliter, zu ihm hatte gesagt und gesprochen: Ich will dir meiner Väter Erbe nicht geben. Und er legte sich auf sein Bett und wandte sein Antlitz und aß kein Brot.
1 Könige_1Kön_11_21_5_Da kam zu ihm hinein Isebel, sein Weib, und redete mit ihm: Was ist's, daß du nicht Brot ißt?
