Nehemia_Neh_16_12_12_Und zu den Zeiten Jojakims waren diese Oberste der Vaterhäuser unter den Priestern: nämlich von Seraja war Meraja, von Jeremia war Hananja,
Nehemia_Neh_16_12_13_von Esra war Mesullam, von Amarja war Johanan,
Nehemia_Neh_16_12_14_von Malluch war Jonathan, von Sebanja war Joseph,
Nehemia_Neh_16_12_15_von Harim war Adna, von Merajoth war Helkai,
Nehemia_Neh_16_12_16_von Iddo war Sacharja, von Ginthon war Mesullam,
Nehemia_Neh_16_12_17_von Abia war Sichri, von Minjamin-Moadja war Piltai,
Nehemia_Neh_16_12_18_von Bilga war Sammua, von Semaja war Jonathan,
Nehemia_Neh_16_12_19_von Jojarib war Matthnai, von Jedaja war Usi,
Nehemia_Neh_16_12_20_von Sallai war Kallai, von Amok war Eber,
Nehemia_Neh_16_12_21_von Hilkia war Hasabja, von Jedaja war Nathanael.
Nehemia_Neh_16_12_22_Und zu den Zeiten Eljasibs, Jojadas, Johanans und Jadduas wurden die Obersten der Vaterhäuser unter den Leviten aufgeschrieben und die Priester, unter dem Königreich des Darius, des Persers.
Nehemia_Neh_16_12_23_Es wurden aber die Kinder Levi, die Obersten der Vaterhäuser, aufgeschrieben in der Chronik bis zur Zeit Johanans, des Sohnes Eljasibs.
Nehemia_Neh_16_12_24_Und dies waren die Obersten unter den Leviten: Hasabja, Serebja und Jesua, der Sohn Kadmiels; und ihre Brüder neben ihnen, verordnet, zu loben und zu danken, wie es David, der Mann Gottes, geboten hatte, eine Ordnung um die andere,
Nehemia_Neh_16_12_25_waren Matthanja, Bakbukja, Obadja. Aber Mesullam, Talmon und Akkub, die Torhüter, hatten die Hut an den Vorratskammern der Tore.
Nehemia_Neh_16_12_26_Diese waren zu den Zeiten Jojakims, des Sohnes Jesuas, des Sohnes Jozadaks, und zu den Zeiten Nehemias, des Landpflegers, und des Priesters Esra, des Schriftgelehrten.
Nehemia_Neh_16_12_27_Und bei der Einweihung der Mauer zu Jerusalem suchte man die Leviten aus allen ihren Orten, daß man sie gen Jerusalem brächte, zu halten Einweihung in Freuden, mit Danken, mit Singen, mit Zimbeln, Psalter und Harfen.
Nehemia_Neh_16_12_28_Und es versammelten sich die Kinder der Sänger von der Gegend um Jerusalem her und von den Höfen der Netophathiter
Nehemia_Neh_16_12_29_und von Beth-Gilgal und von den Äckern zu Geba und Asmaveth; denn die Sänger hatten sich Höfe gebaut um Jerusalem her.
Nehemia_Neh_16_12_30_Und die Priester und Leviten reinigten sich und reinigten das Volk, die Tore und die Mauer.
Nehemia_Neh_16_12_31_Und ich ließ die Fürsten Juda's oben auf die Mauer steigen und bestellte zwei große Dankchöre. Die einen gingen hin zur Rechten oben auf der Mauer zum Misttor hin,
Nehemia_Neh_16_12_32_und ihnen ging nach Hosaja und die Hälfte der Fürsten Juda's
Nehemia_Neh_16_12_33_und Asarja, Esra, Mesullam,
Nehemia_Neh_16_12_34_Juda, Benjamin, Semaja und Jeremia
Nehemia_Neh_16_12_35_und etliche der Priester-Kinder mit Drommeten, dazu Sacharja, der Sohn Jonathans, des Sohnes Semajas, des Sohnes Matthanjas, des Sohnes Michajas, des Sohnes Sakkurs, des Sohnes Asaphs,
Nehemia_Neh_16_12_36_und seine Brüder: Semaja, Asareel, Milalai, Gilalai, Maai, Nathanael und Juda, Hanani, mit den Saitenspielen Davids, des Mannes Gottes, Esra aber, der Schriftgelehrte, vor ihnen her.
Nehemia_Neh_16_12_37_Und zogen zum Brunnentor hin und gingen stracks vor sich auf den Stufen zur Stadt Davids, die Mauer hinauf zu dem Hause Davids hinan und bis an das Wassertor gegen Morgen.
Nehemia_Neh_16_12_38_Der andere Dankchor ging ihnen gegenüber, und ich ihm nach und die Hälfte des Volks, oben auf der Mauer zum Ofenturm hinan und bis an die breite Mauer
Nehemia_Neh_16_12_39_und zum Tor Ephraim hinan und zum alten Tor und zum Fischtor und zum Turm Hananeel und zum Turm Mea bis an das Schaftor, und blieben stehen im Kerkertor.
Nehemia_Neh_16_12_40_Und standen also die zwei Dankchöre am Hause Gottes, und ich und die Hälfte der Obersten mit mir,
Nehemia_Neh_16_12_41_und die Priester, nämlich Eljakim, Maaseja, Minjamin, Michaja, Eljoenai, Sacharja, Hananja mit Drommeten,
Nehemia_Neh_16_12_42_und Maaseja, Semaja, Eleasar, Usi, Johanan, Malchia, Elam und Eser. Und die Sänger sangen laut, und Jisrahja war der Vorsteher.
Nehemia_Neh_16_12_43_Und es wurden desselben Tages große Opfer geopfert, und sie waren fröhlich; denn Gott hatte ihnen eine große Freude gemacht, daß sich auch die Weiber und Kinder freuten, und man hörte die Freude Jerusalems ferne.
Nehemia_Neh_16_12_44_Zu der Zeit wurden verordnet Männer über die Vorratskammern, darin die Heben, Erstlinge und Zehnten waren, daß sie sammeln sollten von den Äckern um die Städte her, auszuteilen nach dem Gesetz für die Priester und Leviten; denn Juda hatte eine Freude an den Priestern und Leviten, daß sie standen
Nehemia_Neh_16_12_45_und warteten des Dienstes ihres Gottes und des Dienstes der Reinigung. Und die Sänger und Torhüter standen nach dem Gebot Davids und seines Sohnes Salomo;
Nehemia_Neh_16_12_46_denn vormals, zu den Zeiten Davids und Asaphs, wurden gestiftet die obersten Sänger und Loblieder und Dank zu Gott.
Nehemia_Neh_16_12_47_Aber ganz Israel gab den Sängern und Torhütern Teile zu den Zeiten Serubabels und Nehemias, einen jeglichen Tag sein Teil; und sie gaben Geheiligtes für die Leviten, die Leviten aber gaben Geheiligtes für die Kinder Aaron.
Nehemia_Neh_16_13_1_Und es ward zu der Zeit gelesen das Buch Mose vor den Ohren des Volks und ward gefunden darin geschrieben, daß die Ammoniter und Moabiter sollen nimmermehr in die Gemeinde Gottes kommen,
Nehemia_Neh_16_13_2_darum daß sie den Kindern Israel nicht entgegenkamen mit Brot und Wasser und dingten sie wider Bileam, daß er sie verfluchen sollte; aber unser Gott wandte den Fluch in einen Segen.
Nehemia_Neh_16_13_3_Da sie nun dies Gesetz hörten, schieden sie alle Fremdlinge von Israel.
Nehemia_Neh_16_13_4_Und vor dem hatte der Priester Eljasib, der gesetzt war über die Kammern am Hause unsres Gottes, ein Verwandter des Tobia, demselben eine große Kammer gemacht;
Nehemia_Neh_16_13_5_und dahin hatten sie zuvor gelegt Speisopfer, Weihrauch, Geräte und die Zehnten vom Getreide, Most und Öl, die Gebühr der Leviten, Sänger und Torhüter, dazu die Hebe der Priester.
Nehemia_Neh_16_13_6_Aber bei diesem allem war ich nicht zu Jerusalem; denn im zweiunddreißigsten Jahr Arthahsasthas, des Königs zu Babel, kam ich zum König, und nach etlicher Zeit erwarb ich vom König,
Nehemia_Neh_16_13_7_daß ich gen Jerusalem zog. Und ich merkte, daß nicht gut war, was Eljasib an Tobia getan hatte, da er sich eine Kammer machte im Hofe am Hause Gottes;
Nehemia_Neh_16_13_8_und es verdroß mich sehr, und ich warf alle Geräte vom Hause hinaus vor die Kammer
Nehemia_Neh_16_13_9_und hieß, daß sie die Kammern reinigten; und ich brachte wieder dahin das Gerät des Hauses Gottes, das Speisopfer und den Weihrauch.
Nehemia_Neh_16_13_10_Und ich erfuhr, daß der Leviten Teile ihnen nicht gegeben waren, derhalben die Leviten und die Sänger, die das Geschäft des Amts ausrichten sollten, geflohen waren, ein jeglicher zu seinen Acker.
Nehemia_Neh_16_13_11_Da schalt ich die Obersten und sprach: Warum ist das Haus Gottes verlassen? Aber ich versammelte sie und stellte sie an ihre Stätte.
Nehemia_Neh_16_13_12_Da brachte ganz Juda den Zehnten vom Getreide, Most und Öl zum Vorrat.
Nehemia_Neh_16_13_13_Und ich setzte über die Vorräte Selemja, den Priester, und Zadok, den Schriftgelehrten, und aus den Leviten Pedaja und ihnen zur Hand Hanan, den Sohn Sakkurs, des Sohnes Matthanjas; denn sie wurden für treu gehalten, und ihnen ward befohlen, ihren Brüdern auszuteilen.
Nehemia_Neh_16_13_14_Gedenke, mein Gott, mir daran und tilge nicht aus meine Barmherzigkeit, die ich an meines Gottes Hause und an seinem Dienst getan habe!
Nehemia_Neh_16_13_15_Zur selben Zeit sah ich in Juda Kelter treten am Sabbat und Garben hereinbringen und Esel, beladen mit Wein, Trauben, Feigen und allerlei Last, gen Jerusalem bringen am Sabbattag. Und ich zeugte wider sie des Tages, da sie die Nahrung verkauften.
Nehemia_Neh_16_13_16_Es wohnten auch Tyrer darin; die brachten Fische und allerlei Ware und verkauften's am Sabbat den Kinder Juda's in Jerusalem.
Nehemia_Neh_16_13_17_Da schalt ich die Obersten in Juda und sprach zu ihnen: Was ist das für ein böses Ding, das ihr tut, und brecht den Sabbattag?
Nehemia_Neh_16_13_18_Taten nicht eure Väter also, und unser Gott führte all dies Unglück über uns und über diese Stadt? Und ihr macht des Zorns über Israel noch mehr, daß ihr den Sabbat brecht!
Nehemia_Neh_16_13_19_Und da es in den Toren zu Jerusalem dunkel ward vor dem Sabbat, hieß ich die Türen zuschließen und befahl, man sollte sie nicht auftun bis nach dem Sabbat. Und ich bestellte meiner Leute etliche an die Tore, daß man keine Last hereinbrächte am Sabbattage.
Nehemia_Neh_16_13_20_Da blieben die Krämer und Verkäufer mit allerlei Ware über Nacht draußen vor Jerusalem, ein Mal oder zwei.
Nehemia_Neh_16_13_21_Da zeugte ich wider sie und sprach zu ihnen: Warum bleibt ihr über Nacht um die Mauer? Werdet ihr's noch einmal tun, so will ich Hand an euch legen. Von der Zeit an kamen sie des Sabbats nicht.
Nehemia_Neh_16_13_22_Und ich sprach zu den Leviten, daß sie sich reinigten und kämen und hüteten die Tore, zu heiligen den Sabbattag. Mein Gott, gedenke mir des auch und schone mein nach deiner großen Barmherzigkeit.
Nehemia_Neh_16_13_23_Ich sah auch zu der Zeit Juden, die Weiber genommen hatten von Asdod, Ammon und Moab.
Nehemia_Neh_16_13_24_Und ihre Kinder redeten die Hälfte asdodisch und konnten nicht jüdisch reden, sondern nach der Sprache eines jeglichen Volks.
Nehemia_Neh_16_13_25_Und ich schalt sie und fluchte ihnen und schlug etliche Männer und raufte sie und nahm einen Eid von ihnen bei Gott: Ihr sollt eure Töchter nicht geben ihren Söhnen noch ihre Töchter nehmen euren Söhnen oder euch selbst.
Nehemia_Neh_16_13_26_Hat nicht Salomo, der König Israels, daran gesündigt? Und war doch in vielen Heiden kein König ihm gleich, und er war seinem Gott lieb, und Gott setzte ihn zum König über ganz Israel; dennoch machten ihn die ausländischen Weiber sündigen.
Nehemia_Neh_16_13_27_Und von euch muß man das hören, daß ihr solches Übel tut, euch an unserm Gott zu vergreifen und ausländische Weiber zu nehmen?
Nehemia_Neh_16_13_28_Und einer aus den Kindern Jojadas, des Sohnes Eljasibs, des Hohenpriesters, war Saneballats, des Horoniters, Eidam; aber ich jagte ihn von mir.
Nehemia_Neh_16_13_29_Gedenke an sie, mein Gott, daß sie das Priestertum befleckt haben und den Bund des Priestertums und der Leviten!
Nehemia_Neh_16_13_30_Also reinigte ich sie von allem Ausländischen und bestellte den Dienst der Priester und Leviten, einen jeglichen zu seinem Geschäft,
Nehemia_Neh_16_13_31_und für die Opfergaben an Holz zu bestimmten Zeiten und für die Erstlinge. Gedenke meiner, mein Gott, im Besten!
