Nehemia_Neh_16_7_39_Die Priester: der Kinder Jedaja, vom Hause Jesua, neunhundert und dreiundsiebzig;
Nehemia_Neh_16_7_40_der Kinder Immer tausend und zweiundfünfzig;
Nehemia_Neh_16_7_41_der Kinder Pashur tausend zweihundert und siebenundvierzig;
Nehemia_Neh_16_7_42_der Kinder Harim tausend und siebzehn;
Nehemia_Neh_16_7_43_Die Leviten: der Kinder Jesua von Kadmiel, von den Kindern Hodavja, vierundsiebzig;
Nehemia_Neh_16_7_44_Die Sänger: der Kinder Asaph hundert und achtundvierzig;
Nehemia_Neh_16_7_45_Die Torhüter waren: die Kinder Sallum, die Kinder Ater, die Kinder Talmon, die Kinder Akkub, die Kinder Hatita, die Kinder Sobai, allesamt hundert und achtunddreißig;
Nehemia_Neh_16_7_46_Die Tempelknechte: die Kinder Ziha, die Kinder Hasupha, die Kinder Tabbaoth,
Nehemia_Neh_16_7_47_die Kinder Keros, die Kinder Sia, die Kinder Padon,
Nehemia_Neh_16_7_48_die Kinder Lebana, die Kinder Hagaba, die Kinder Salmai,
Nehemia_Neh_16_7_49_die Kinder Hanan, die Kinder Giddel, die Kinder Gahar,
Nehemia_Neh_16_7_50_die Kinder Reaja, die Kinder Rezin, die Kinder Nekoda,
Nehemia_Neh_16_7_51_die Kinder Gassam, die Kinder Usa, die Kinder Paseah,
Nehemia_Neh_16_7_52_die Kinder Besai, die Kinder der Meuniter, die Kinder der Nephusiter,
Nehemia_Neh_16_7_53_die Kinder Bakbuk, die Kinder Hakupha, die Kinder Harhur,
Nehemia_Neh_16_7_54_die Kinder Bazlith, die Kinder Mehida, die Kinder Harsa,
Nehemia_Neh_16_7_55_die Kinder Barkos, die Kinder Sisera, die Kinder Themah,
Nehemia_Neh_16_7_56_die Kinder Neziah, die Kinder Hatipha.
Nehemia_Neh_16_7_57_Die Kinder der Knechte Salomos waren: die Kinder Sotai, die Kinder Sophereth, die Kinder Perida,
Nehemia_Neh_16_7_58_die Kinder Jaala, die Kinder Darkon, die Kinder Giddel,
Nehemia_Neh_16_7_59_die Kinder Sephatja, die Kinder Hattil, die Kinder Pochereth von Zebaim, die Kinder Amon.
Nehemia_Neh_16_7_60_Aller Tempelknechte und Kinder der Knechte Salomos waren dreihundert und zweiundneunzig;
Nehemia_Neh_16_7_61_Und diese zogen auch mit herauf von Thel-Melah, Thel-Harsa, Cherub, Addon und Immer, aber sie konnten nicht anzeigen ihr Vaterhaus noch ihr Geschlecht, ob sie aus Israel wären:
Nehemia_Neh_16_7_62_die Kinder Delaja, die Kinder Tobia und die Kinder Nekoda, sechshundert und zweiundvierzig;
Nehemia_Neh_16_7_63_Und von den Priestern waren die Kinder Habaja, die Kinder Hakkoz, die Kinder Barsillai, der aus den Töchtern Barsillais, des Gileaditers, ein Weib nahm und ward nach ihrem Namen genannt.
Nehemia_Neh_16_7_64_Diese suchten ihr Geburtsregister; und da sie es nicht fanden, wurden sie untüchtig geachtet zum Priestertum.
Nehemia_Neh_16_7_65_Und der Landpfleger sprach zu ihnen, sie sollten nicht essen vom Hocheiligen, bis daß ein Priester aufkäme mit dem Licht und Recht.
Nehemia_Neh_16_7_66_Der ganzen Gemeinde wie ein Mann waren zweiundvierzigtausend und dreihundertundsechzig,
Nehemia_Neh_16_7_67_ausgenommen ihre Knechte und Mägde; derer waren siebentausend dreihundert und siebenunddreißig, dazu zweihundert und fünfundvierzig Sänger und Sängerinnen.
Nehemia_Neh_16_7_68_Und sie hatten siebenhundert und sechsunddreißig Rosse, zweihundert und fünfundvierzig Maultiere,
Nehemia_Neh_16_7_69_vierhundert und fünfunddreißig Kamele, sechstausend siebenhundert und zwanzig Esel.
Nehemia_Neh_16_7_70_Und etliche Obersten der Vaterhäuser gaben zum Werk. Der Landpfleger gab zum Schatz tausend Goldgulden, fünfzig Becken, fünfhundert und dreißig Priesterröcke.
Nehemia_Neh_16_7_71_Und etliche Obersten der Vaterhäuser gaben zum Schatz fürs Werk zwanzigtausend Goldgulden, zweitausend und zweihundert Pfund Silber.
Nehemia_Neh_16_7_72_Und das andere Volk gab zwanzigtausend Goldgulden und zweitausend Pfund Silber und siebenundsechzig Priesterröcke.
Nehemia_Neh_16_7_73_Und die Priester und die Leviten, die Torhüter, die Sänger und die vom Volk und die Tempelknechte und ganz Israel setzten sich in ihre Städte.
Nehemia_Neh_16_8_1_Da nun herzukam der siebente Monat und die Kinder Israel in ihren Städten waren, versammelte sich das ganze Volk wie ein Mann auf die breite Gasse vor dem Wassertor und sprachen zu Esra, dem Schriftgelehrten, daß er das Buch des Gesetzes Mose's holte, das der HERR Israel geboten hat.
Nehemia_Neh_16_8_2_Und Esra, der Priester, brachte das Gesetz vor die Gemeinde, Männer und Weiber und alle, die es vernehmen konnten, am ersten Tage des siebenten Monats
Nehemia_Neh_16_8_3_und las daraus auf der breiten Gasse, die vor dem Wassertor ist, vom lichten Morgen an bis auf den Mittag, vor Mann und Weib und wer's vernehmen konnte. Und des ganzen Volkes Ohren waren zu dem Gesetz gekehrt.
Nehemia_Neh_16_8_4_Und Esra, der Schriftgelehrte, stand auf einem hölzernen, hohen Stuhl, den sie gemacht hatten, zu predigen, und standen neben ihm Matthithja, Sema, Anaja, Uria, Hilkia und Maaseja, zu seiner Rechten, aber zu seiner Linken Pedaja, Misael, Malchia, Hasum, Hasbaddana, Sacharja und Mesullam.
Nehemia_Neh_16_8_5_Und Esra tat das Buch auf vor dem ganzen Volk, denn er ragte über alles Volk; und da er's auftat, stand alles Volk.
Nehemia_Neh_16_8_6_Und Esra lobte den HERRN, den großen Gott. Und alles Volk antwortete: Amen, Amen! mit ihren Händen empor und neigten sich und beteten den HERRN an mit dem Antlitz zur Erde.
Nehemia_Neh_16_8_7_Und Jesua, Bani, Serebja, Jamin, Akkub, Sabthai, Hodia, Maaseja, Kelita, Asarja, Josabad, Hanan, Pelaja und die Leviten machten, daß das Volk aufs Gesetz merkte; und das Volk stand auf seiner Stätte.
Nehemia_Neh_16_8_8_Und sie lasen im Gesetzbuch Gottes klar und verständlich, daß man verstand, was gelesen ward.
Nehemia_Neh_16_8_9_Und Nehemia, der da ist der Landpfleger, und Esra, der Priester, der Schriftgelehrte, und die Leviten, die alles Volk aufmerken machten sprachen zum Volk: Dieser Tag ist heilig dem HERRN, eurem Gott; darum seid nicht traurig und weint nicht! Denn alles Volk weinte, da sie die Worte des Gesetzes hörten.
Nehemia_Neh_16_8_10_Darum sprach er zu ihnen: Geht hin und eßt das Fette und trinkt das Süße und sendet denen auch Teile, die nichts für sich bereitet haben; denn dieser Tag ist heilig unserm HERRN. Und bekümmert euch nicht; denn die Freude am HERRN ist eure Stärke.
Nehemia_Neh_16_8_11_Und die Leviten stillten alles Volk und sprachen: Seid still, denn der Tag ist heilig; bekümmert euch nicht!
Nehemia_Neh_16_8_12_Und alles Volk ging hin, daß es äße, tränke und Teile sendete und eine große Freude machte; denn sie hatten die Worte verstanden, die man hatte kundgetan.
Nehemia_Neh_16_8_13_Und des andern Tages versammelten sich die Obersten der Vaterhäuser unter dem ganzen Volk und die Priester und Leviten zu Esra, dem Schriftgelehrten, daß er sie in den Worten des Gesetzes unterrichtete.
Nehemia_Neh_16_8_14_Und sie fanden geschrieben im Gesetz, das der HERR durch Mose geboten hatte, daß die Kinder Israel in Laubhütten wohnen sollten am Fest im siebenten Monat
Nehemia_Neh_16_8_15_und sollten's lassen laut werden und ausrufen in allen ihren Städten und zu Jerusalem und sagen: Geht hinaus auf die Berge und holt Ölzweige, Myrtenzweige, Palmenzweige und Zweige von dichten Bäumen, daß man Laubhütten mache, wie es geschrieben steht.
Nehemia_Neh_16_8_16_Und das Volk ging hinaus und holten und machten sich Laubhütten, ein jeglicher auf seinem Dach und in ihren Höfen und in den Höfen am Hause Gottes und auf der breiten Gasse am Wassertor und auf der breiten Gasse am Tor Ephraim.
Nehemia_Neh_16_8_17_Und die ganze Gemeinde derer, die aus der Gefangenschaft waren wiedergekommen, machten Laubhütten und wohnten darin. Denn die Kinder Israel hatten seit der Zeit Josuas, des Sohnes Nuns, bis auf diesen Tag nicht also getan; und es war eine große Freude.
Nehemia_Neh_16_8_18_Und ward im Gesetzbuch Gottes gelesen alle Tage, vom ersten Tag an bis auf den letzten; und sie hielten das Fest sieben Tage und am achten Tage die Versammlung, wie sich's gebührt.
Nehemia_Neh_16_9_1_Am vierundzwanzigsten Tage dieses Monats kamen die Kinder Israel zusammen mit Fasten und Säcken und Erde auf ihnen
Nehemia_Neh_16_9_2_und sonderten den Samen Israels ab von allen fremden Kindern und traten hin und bekannten ihre Sünden und ihrer Väter Missetaten.
Nehemia_Neh_16_9_3_Und standen auf an ihrer Stätte, und man las im Gesetzbuch des HERRN, ihres Gottes, ein Viertel des Tages; und ein Viertel bekannten sie und beteten an den HERRN, ihren Gott.
Nehemia_Neh_16_9_4_Und auf dem hohen Platz für die Leviten standen auf Jesua, Bani, Kadmiel, Sebanja, Bunni, Serebja, Bani und Chenani und schrieen laut zu dem HERRN, ihrem Gott.
Nehemia_Neh_16_9_5_Und die Leviten Jesua, Kadmiel, Bani, Hasabneja, Serebja, Hodia, Sebanja, Pethahja sprachen: Auf! Lobet den HERRN, euren Gott, von Ewigkeit zu Ewigkeit, und man lobe den Namen deiner Herrlichkeit, der erhaben ist über allen Preis und Ruhm.
Nehemia_Neh_16_9_6_HERR, du bist's allein, du hast gemacht den Himmel und aller Himmel Himmel mit allem ihrem Heer, die Erde und alles, was darauf ist, die Meere und alles, was darin ist; du machst alles lebendig, und das himmlische Heer betet dich an.
Nehemia_Neh_16_9_7_Du bist der HERR, Gott, der du Abram erwählt hast und ihn von Ur in Chaldäa ausgeführt und Abraham genannt
Nehemia_Neh_16_9_8_und sein Herz treu vor dir gefunden und einen Bund mit ihm gemacht, seinem Samen zu geben das Land der Kanaaniter, Hethiter, Amoriter, Pheresiter, Jebusiter und Girgasiter; und hast dein Wort gehalten, denn du bist gerecht.
Nehemia_Neh_16_9_9_Und du hast angesehen das Elend unsrer Väter in Ägypten und ihr Schreien erhört am Schilfmeer
Nehemia_Neh_16_9_10_und Zeichen und Wunder getan an Pharao und allen seinen Knechten und an allem Volk seines Landes, denn du erkanntest, daß sie stolz wider sie waren, und hast dir einen Namen gemacht, wie er jetzt ist.
Nehemia_Neh_16_9_11_Und hast das Meer vor ihnen zerrissen, daß sie mitten im Meer trocken hindurchgingen, und ihre Verfolger in die Tiefe geworfen wie Steine in mächtige Wasser
Nehemia_Neh_16_9_12_und sie geführt des Tages in einer Wolkensäule und des Nachts in einer Feuersäule, ihnen zu leuchten auf dem Weg, den sie zogen.
Nehemia_Neh_16_9_13_Und bist herabgestiegen auf den Berg Sinai und hast mit ihnen vom Himmel geredet und gegeben ein wahrhaftiges Recht und ein rechtes Gesetz und gute Gebote und Sitten
Nehemia_Neh_16_9_14_und deinen heiligen Sabbat ihnen kundgetan und Gebote, Sitten und Gesetz ihnen geboten durch deinen Knecht Mose,
Nehemia_Neh_16_9_15_und hast ihnen Brot vom Himmel gegeben, da sie hungerte, und Wasser aus dem Felsen lassen gehen, da sie dürstete, und mit ihnen geredet, sie sollten hineingehen und das Land einnehmen, darüber du deine Hand hobst, es ihnen zu geben.
Nehemia_Neh_16_9_16_Aber unsre Väter wurden stolz und halsstarrig, daß sie deinen Geboten nicht gehorchten,
Nehemia_Neh_16_9_17_und weigerten sich zu hören und gedachten auch nicht an deine Wunder, die du an ihnen tatest; sondern sie wurden halsstarrig und warfen ihr Haupt auf, daß sie sich zurückwendeten zu Dienstbarkeit in ihrer Ungeduld. Aber du, mein Gott, vergabst und warst gnädig, barmherzig, geduldig und von großer Barmherzigkeit und verließest sie nicht.
Nehemia_Neh_16_9_18_Und ob sie wohl ein gegossenes Kalb machten und sprachen: Das ist dein Gott, der dich aus Ägyptenland geführt hat! und taten große Lästerungen:
Nehemia_Neh_16_9_19_doch verließest du sie nicht in der Wüste nach deiner großen Barmherzigkeit, und die Wolkensäule wich nicht von ihnen des Tages, sie zu führen auf dem Wege, noch die Feuersäule des Nachts, ihnen zu leuchten auf dem Wege, den sie zogen.
Nehemia_Neh_16_9_20_Und du gabst ihnen einen guten Geist, sie zu unterweisen; und dein Man wandtest du nicht von ihrem Munde, und gabst ihnen Wasser, da sie dürstete.
Nehemia_Neh_16_9_21_Vierzig Jahre versorgtest du sie in der Wüste, daß ihnen nichts mangelte. Ihre Kleider veralteten nicht und ihre Füße zerschwollen nicht.
Nehemia_Neh_16_9_22_Und gabst ihnen Königreiche und Völker und teiltest sie hierher und daher, daß sie einnahmen das Land Sihons, des Königs zu Hesbon, und das Land Ogs, des Königs von Basan.
Nehemia_Neh_16_9_23_Und vermehrtest ihre Kinder wie die Sterne am Himmel und brachtest sie in das Land, das du ihren Vätern verheißen hattest, daß sie einziehen und es einnehmen sollten.
Nehemia_Neh_16_9_24_Und die Kinder zogen hinein und nahmen das Land ein; und du demütigtest vor ihnen die Einwohner des Landes, die Kanaaniter, und gabst sie in ihre Hände, ihre Könige und die Völker im Lande, daß sie mit ihnen täten nach ihrem Willen.
Nehemia_Neh_16_9_25_Und sie gewannen feste Städte und ein fettes Land und nahmen Häuser ein voll allerlei Güter, ausgehauene Brunnen, Weinberge, Ölgärten und Bäume, davon man ißt, die Menge, und sie aßen und wurden satt und fett und lebten in Wonne durch deine große Güte.
Nehemia_Neh_16_9_26_Aber sie wurden ungehorsam und widerstrebten dir und warfen dein Gesetz hinter sich zurück und erwürgten deine Propheten, die ihnen zeugten, daß sie sollten sich zu dir bekehren, und taten große Lästerungen.
Nehemia_Neh_16_9_27_Darum gabst du sie in die Hand ihrer Feinde, die sie ängsteten. Und zur Zeit ihrer Angst schrieen sie zu dir; und du erhörtest sie vom Himmel, und durch deine große Barmherzigkeit gabst du ihnen Heilande, die ihnen halfen aus ihrer Feinde Hand.
Nehemia_Neh_16_9_28_Wenn sie aber zur Ruhe kamen, taten sie wieder übel vor dir. So verließest du sie in ihrer Feinde Hand, daß sie über sie herrschten. So schrieen sie dann wieder zu dir; und du erhörtest sie vom Himmel und errettetest sie nach deiner großen Barmherzigkeit vielmal.
Nehemia_Neh_16_9_29_Und du ließest ihnen bezeugen, daß sie sich bekehren sollten zu deinem Gesetz. Aber sie waren stolz und gehorchten deinen Geboten nicht und sündigten an deinen Rechten (durch welche ein Mensch lebt, so er sie tut) und kehrten dir den Rücken zu und wurden halsstarrig und gehorchten nicht.
Nehemia_Neh_16_9_30_Und du verzogst viele Jahre über ihnen und ließest ihnen bezeugen durch deinen Geist in deinen Propheten; aber sie nahmen es nicht zu Ohren. Darum hast du sie gegeben in die Hand der Völker in den Ländern.
Nehemia_Neh_16_9_31_Aber nach deiner großen Barmherzigkeit hast du es nicht gar aus mit ihnen gemacht noch sie verlassen; denn du bist ein gnädiger und barmherziger Gott.
Nehemia_Neh_16_9_32_Nun, unser Gott, du großer Gott, mächtig und schrecklich, der du hältst Bund und Barmherzigkeit, achte nicht gering alle die Mühsal, die uns getroffen hat, unsre Könige, Fürsten, Priester, Propheten, Väter und dein ganzes Volk von der Zeit an der Könige von Assyrien bis auf diesen Tag.
Nehemia_Neh_16_9_33_Du bist gerecht in allem, was du über uns gebracht hast; denn du hast recht getan, wir aber sind gottlos gewesen.
Nehemia_Neh_16_9_34_Und unsre Könige, Fürsten, Priester und Väter haben nicht nach deinem Gesetz getan und auch nicht achtgehabt auf deine Gebote und Zeugnisse, die du hast ihnen lassen bezeugen.
Nehemia_Neh_16_9_35_Und sie haben dir nicht gedient in ihrem Königreich und in deinen großen Gütern, die du ihnen gabst, und in dem weiten und fetten Lande, das du ihnen dargegeben hast, und haben sich nicht bekehrt von ihrem bösen Wesen.
Nehemia_Neh_16_9_36_Siehe, wir sind heutigestages Knechte, und in dem Lande, das du unsern Vätern gegeben hast, zu essen seine Früchte und Güter, siehe, da sind wir Knechte.
Nehemia_Neh_16_9_37_Und sein Ertrag mehrt sich den Königen, die du über uns gesetzt hast um unsrer Sünden willen; und sie herrschen über unsre Leiber und unser Vieh nach ihrem Willen, und wir sind in großer Not.
Nehemia_Neh_16_9_38_Und in diesem allem machen wir einen festen Bund und schreiben und lassen's unsere Fürsten, Leviten und Priester versiegeln.
Nehemia_Neh_16_10_1_Die Versiegler aber waren: Nehemia, der Landpfleger, der Sohn Hachaljas, und Zedekia,
Nehemia_Neh_16_10_2_Seraja, Asarja, Jeremia,
Nehemia_Neh_16_10_3_Pashur, Amarja, Malchia,
Nehemia_Neh_16_10_4_Hattus, Sebanja, Malluch,
Nehemia_Neh_16_10_5_Harim, Meremoth, Obadja,
Nehemia_Neh_16_10_6_Daniel, Ginthon, Baruch,
Nehemia_Neh_16_10_7_Mesullam, Abia, Mijamin,
Nehemia_Neh_16_10_8_Maasja, Bilgai und Semaja, das waren die Priester;
Nehemia_Neh_16_10_9_die Leviten aber waren: Jesua, der Sohn Asanjas, Binnui von den Kindern Henadads, Kadmiel
Nehemia_Neh_16_10_10_und ihre Brüder: Sechanja, Hodia, Kelita, Pelaja, Hanan,
Nehemia_Neh_16_10_11_Micha, Rehob, Hasabja,
Nehemia_Neh_16_10_12_Sakkur, Serebja, Sebanja,
Nehemia_Neh_16_10_13_Hodia, Bani und Beninu;
Nehemia_Neh_16_10_14_die Häupter im Volk waren: Pareos, Pahath-Moab, Elam, Satthu, Bani,
Nehemia_Neh_16_10_15_Bunni, Asgad, Bebai,
Nehemia_Neh_16_10_16_Adonia, Bigevai, Adin,
Nehemia_Neh_16_10_17_Ater, Hiskia, Assur,
Nehemia_Neh_16_10_18_Hodia, Hasum, Bezai,
Nehemia_Neh_16_10_19_Hariph, Anathoth, Nobai,
Nehemia_Neh_16_10_20_Magpias, Mesullam, Hesir,
Nehemia_Neh_16_10_21_Mesesabeel, Zadok, Jaddua,
Nehemia_Neh_16_10_22_Pelatja, Hanan, Anaja,
Nehemia_Neh_16_10_23_Hosea, Hananja, Hassub,
Nehemia_Neh_16_10_24_Halohes, Pilha, Sobek,
Nehemia_Neh_16_10_25_Rehum, Hasabna, Maaseja,
Nehemia_Neh_16_10_26_Ahia, Hanan, Anan,
Nehemia_Neh_16_10_27_Malluch, Harim und Baana.
Nehemia_Neh_16_10_28_Und das andere Volk, Priester, Leviten, Torhüter, Sänger, Tempelknechte und alle, die sich von den Völker in den Landen abgesondert hatten zum Gesetz Gottes, samt ihren Weibern, Söhnen und Töchtern, alle, die es verstehen konnten,
Nehemia_Neh_16_10_29_hielten sich zu ihren Brüdern, den Mächtigen, und kamen, daß sie schwuren und sich mit einem Eide verpflichteten, zu wandeln im Gesetz Gottes, das durch Mose, den Knecht Gottes, gegeben ist, daß sie es hielten und tun wollten nach allen Geboten, Rechten und Sitten des HERRN, unsers Herrschers;
Nehemia_Neh_16_10_30_und daß wir den Völkern im Lande unsere Töchter nicht geben noch ihre Töchter unsern Söhnen nehmen wollten;
Nehemia_Neh_16_10_31_auch wenn die Völker im Lande am Sabbattage bringen Ware und allerlei Getreide zu verkaufen, daß wir nichts von ihnen nehmen wollten am Sabbat und den Heiligen Tagen; und daß wir das siebente Jahr von aller Hand Beschwerung freilassen wollten.
Nehemia_Neh_16_10_32_Und wir legten ein Gebot auf uns, daß wir jährlich einen dritten Teil eines Silberlings gäben zum Dienst im Hause unsers Gottes,
Nehemia_Neh_16_10_33_nämlich zu Schaubrot, zu täglichem Speisopfer, zum täglichen Brandopfer, zum Opfer des Sabbats, der Neumonde und Festtage und zu dem Geheiligten und zum Sündopfer, damit Israel versöhnt werde, und zu allem Geschäft im Hause unsers Gottes.
Nehemia_Neh_16_10_34_Und wir warfen das Los unter den Priestern, Leviten und dem Volk um das Opfer des Holzes, das man zum Hause unsers Gottes bringen sollte jährlich nach unsern Vaterhäusern auf bestimmte Zeit, zu brennen auf dem Altar des HERRN, unsers Gottes, wie es im Gesetz geschrieben steht.
Nehemia_Neh_16_10_35_Und wir wollen jährlich bringen die Erstlinge unsers Landes und die Erstlinge aller Früchte auf allen Bäumen zum Hause des HERRN;
Nehemia_Neh_16_10_36_und die Erstlinge unsrer Söhne und unsres Viehs, wie es im Gesetz geschrieben steht, und die Erstlinge unsrer Rinder und unsrer Schafe wollen wir zum Hause unsres Gottes bringen den Priestern, die im Hause unsres Gottes dienen.
Nehemia_Neh_16_10_37_Auch wollen wir bringen das Erste unsres Teiges und unsre Hebopfer und Früchte von allerlei Bäumen, Most und Öl den Priestern in die Kammern am Hause unsres Gottes und den Zehnten unsres Landes den Leviten, daß die Leviten den Zehnten haben in allen Städten unsres Ackerwerks.
Nehemia_Neh_16_10_38_Und der Priester, der Sohn Aarons, soll mit den Leviten sein, wenn sie den Zehnten nehmen, daß die Leviten den Zehnten ihrer Zehnten heraufbringen zum Hause unsres Gottes in die Kammern im Vorratshause.
Nehemia_Neh_16_10_39_Denn die Kinder Israel und die Kinder Levi sollen die Hebe des Getreides, Mosts und Öls herauf in die Kammern bringen. Daselbst sind die Gefäße des Heiligtums und die Priester, die da dienen, und die Torhüter und Sänger. So wollen wir das Haus unsres Gottes nicht verlassen.
Nehemia_Neh_16_11_1_Und die Obersten des Volks wohnten zu Jerusalem. Das andere Volk aber warf das Los darum, daß unter zehn ein Teil gen Jerusalem, in die heilige Stadt, zöge zu wohnen, und neun Teile in den Städten wohnten.
Nehemia_Neh_16_11_2_Und das Volk segnete alle die Männer, die willig waren, zu Jerusalem zu wohnen.
Nehemia_Neh_16_11_3_Dies sind die Häupter in der Landschaft, die zu Jerusalem und in den Städten Juda's wohnten. (Sie wohnten aber ein jeglicher in seinem Gut, das in ihren Städten war: nämlich Israel, Priester, Leviten, Tempelknechte und die Kinder der Knechte Salomos.)
Nehemia_Neh_16_11_4_Und zu Jerusalem wohnten etliche der Kinder Juda und Benjamin. Von den Kindern Juda: Athaja, der Sohn Usias, des Sohnes Sacharjas, des Sohnes Amarjas, des Sohnes Sephatjas, des Sohnes Mahalaleels, aus den Kindern Perez,
Nehemia_Neh_16_11_5_und Maaseja, der Sohn Baruchs, des Sohnes Chol-Hoses, des Sohnes Hasajas, des Sohnes Adajas, des Sohnes Jojaribs, des Sohnes Sacharjas, des Sohnes des Selaniters.
Nehemia_Neh_16_11_6_Aller Kinder Perez, die zu Jerusalem wohnten, waren vierhundert und achtundsechzig, tüchtige Leute.
Nehemia_Neh_16_11_7_Dies sind die Kinder Benjamin: Sallu, der Sohn Mesullams, des Sohnes Joeds, des Sohnes Pedajas, des Sohnes Kolajas, des Sohnes Maasejas, des Sohnes Ithiels, des Sohnes Jesaja's,
Nehemia_Neh_16_11_8_und nach ihm Gabbai, Sallai, neunhundert und achtundzwanzig;
Nehemia_Neh_16_11_9_und Joel, der Sohn Sichris, war ihr Vorsteher, und Juda, der Sohn Hasnuas, über den andern Teil der Stadt.
Nehemia_Neh_16_11_10_Von den Priestern wohnten daselbst Jedaja, der Sohn Jojaribs, Jachin,
Nehemia_Neh_16_11_11_Seraja, der Sohn Hilkias, des Sohnes Mesullams, des Sohnes Zadoks, des Sohnes Merajoths, des Sohnes Ahitobs, ein Fürst im Hause Gottes,
Nehemia_Neh_16_11_12_und ihre Brüder, die im Hause schafften, derer waren achthundert und zweiundzwanzig; und Adaja, der Sohn Jerohams, des Sohnes Pelaljas, des Sohnes Amzis, des Sohnes Sacharjas, des Sohnes Pashurs, des Sohnes Malchias,
Nehemia_Neh_16_11_13_und seine Brüder, Oberste der Vaterhäuser, zweihundert und zweiundvierzig; und Amassai, der Sohn Asareels, des Sohnes Ahsais, des Sohnes Mesillemoths, des Sohnes Immers,
Nehemia_Neh_16_11_14_und ihre Brüder, gewaltige Männer, hundert und achtundzwanzig; und ihr Vorsteher war Sabdiel, der Sohn Gedolims.
Nehemia_Neh_16_11_15_Von den Leviten: Semaja, der Sohn Hassubs, des Sohnes Asrikams, des Sohnes Hasabjas, des Sohnes Bunnis,
Nehemia_Neh_16_11_16_und Sabthai und Josabad, aus der Leviten Obersten, an den äußerlichen Geschäften im Hause Gottes,
Nehemia_Neh_16_11_17_und Matthanja, der Sohn Michas, des Sohnes Sabdis, des Sohnes Asaphs, der das Haupt war, Dank anzuheben zum Gebet, und Bakbukja, der andere unter seinen Brüdern, und Abda, der Sohn Sammuas, des Sohnes Galals, des Sohnes Jedithuns.
Nehemia_Neh_16_11_18_Alle Leviten in der heiligen Stadt waren zweihundert und vierundachtzig.
Nehemia_Neh_16_11_19_Und die Torhüter: Akkub und Talmon und ihre Brüder, die in den Toren hüteten, waren hundert und zweiundsiebzig.
Nehemia_Neh_16_11_20_Das andere Israel aber, Priester und Leviten, waren in allen Städten Juda's, ein jeglicher in seinem Erbteil.
Nehemia_Neh_16_11_21_Und die Tempelknechte wohnten am Ophel; und Ziha und Gispa waren über die Tempelknechte.
Nehemia_Neh_16_11_22_Der Vorsteher aber über die Leviten zu Jerusalem war Usi, der Sohn Banis, des Sohnes Hasabjas, des Sohnes Matthanjas, des Sohnes Michas, aus den Kindern Asaphs, den Sängern, für das Geschäft im Hause Gottes.
Nehemia_Neh_16_11_23_Denn es war des Königs Gebot über sie, daß man den Sängern treulich gäbe, einen jeglichen Tag seine Gebühr.
Nehemia_Neh_16_11_24_Und Pethahja, der Sohn Mesesabeels, aus den Kindern Serahs, des Sohnes Juda's, war zu Handen des Königs in allen Geschäften an das Volk.
Nehemia_Neh_16_11_25_Und der Kinder Juda, die außen auf den Dörfern auf ihrem Lande waren, wohnten etliche zu Kirjath-Arba und seinen Ortschaften und zu Dibon und seinen Ortschaften und zu Kabzeel und seinen Ortschaften
Nehemia_Neh_16_11_26_und zu Jesua, Molada, Beth-Pelet,
Nehemia_Neh_16_11_27_Hazar-Sual, Beer-Seba und ihren Ortschaften
Nehemia_Neh_16_11_28_und zu Ziklag und Mechona und ihren Ortschaften
Nehemia_Neh_16_11_29_und zu En-Rimmon, Zora, Jarmuth,
Nehemia_Neh_16_11_30_Sanoah, Adullam und ihren Dörfern, zu Lachis und auf seinem Felde, zu Aseka und seinen Ortschaften. Und sie lagerten sich von Beer-Seba an bis an das Tal Hinnom.
Nehemia_Neh_16_11_31_Die Kinder Benjamin aber wohnten von Geba an zu Michmas, Aja, Beth-El und seinen Ortschaften
Nehemia_Neh_16_11_32_und zu Anathoth, Nob, Ananja,
Nehemia_Neh_16_11_33_Hazor, Rama, Gitthaim,
Nehemia_Neh_16_11_34_Hadid, Zeboim, Neballat,
Nehemia_Neh_16_11_35_Lod und Ono im Tal der Zimmerleute.
Nehemia_Neh_16_11_36_Und etliche Leviten, die Teile in Juda hatten, wohnten unter Benjamin.
Nehemia_Neh_16_12_1_Dies sind die Priester und die Leviten, die mit Serubabel, dem Sohn Sealthiels, und mit Jesua heraufzogen: Seraja, Jeremia, Esra,
Nehemia_Neh_16_12_2_Amarja, Malluch, Hattus,
Nehemia_Neh_16_12_3_Sechanja, Rehum, Meremoth,
Nehemia_Neh_16_12_4_Iddo, Ginthoi, Abia,
Nehemia_Neh_16_12_5_Mijamin, Maadja, Bilga,
Nehemia_Neh_16_12_6_Semaja, Jojarib, Jedaja,
Nehemia_Neh_16_12_7_Sallu, Amok, Hilkia und Jedaja. Dies waren die Häupter unter den Priestern und ihren Brüdern zu den Zeiten Jesuas.
Nehemia_Neh_16_12_8_Die Leviten aber waren diese: Jesua, Binnui, Kadmiel, Serebja, Juda und Matthanja, der hatte das Dankamt mit seinen Brüdern;
Nehemia_Neh_16_12_9_Bakbukja und Unni, ihre Brüder, waren ihnen gegenüber zum Dienst.
Nehemia_Neh_16_12_10_Jesua zeugte Jojakim, Jojakim zeugte Eljasib, Eljasib zeugte Jojada,
Nehemia_Neh_16_12_11_Jojada zeugte Jonathan, Jonathan zeugte Jaddua.
