Hiob_Hi_18_31_1_Ich habe einen Bund gemacht mit meinen Augen, daß ich nicht achtete auf eine Jungfrau.
Hiob_Hi_18_31_2_Was gäbe mir Gott sonst als Teil von oben und was für ein Erbe der Allmächtige in der Höhe?
Hiob_Hi_18_31_3_Wird nicht der Ungerechte Unglück haben und ein Übeltäter verstoßen werden?
Hiob_Hi_18_31_4_Sieht er nicht meine Wege und zählt alle meine Gänge?
Hiob_Hi_18_31_5_Habe ich gewandelt in Eitelkeit, oder hat mein Fuß geeilt zum Betrug?
Hiob_Hi_18_31_6_So wäge man mich auf der rechten Waage, so wird Gott erfahren meine Unschuld.
Hiob_Hi_18_31_7_Ist mein Gang gewichen aus dem Wege und mein Herz meinen Augen nachgefolgt und klebt ein Flecken an meinen Händen,
Hiob_Hi_18_31_8_so müsse ich säen, und ein andrer esse es; und mein Geschlecht müsse ausgewurzelt werden.
Hiob_Hi_18_31_9_Hat sich mein Herz lassen reizen zum Weibe und habe ich an meines Nächsten Tür gelauert,
Hiob_Hi_18_31_10_so müsse mein Weib von einem andern geschändet werden, und andere müssen bei ihr liegen;
Hiob_Hi_18_31_11_denn das ist ein Frevel und eine Missetat für die Richter.
Hiob_Hi_18_31_12_Denn das wäre ein Feuer, das bis in den Abgrund verzehrte und all mein Einkommen auswurzelte.
Hiob_Hi_18_31_13_Hab ich verachtet das Recht meines Knechtes oder meiner Magd, wenn sie eine Sache wider mich hatten?
Hiob_Hi_18_31_14_Was wollte ich tun, wenn Gott sich aufmachte, und was würde ich antworten, wenn er heimsuchte?
Hiob_Hi_18_31_15_Hat ihn nicht auch der gemacht, der mich in Mutterleibe machte, und hat ihn im Schoße ebensowohl bereitet?
Hiob_Hi_18_31_16_Habe ich den Dürftigen ihr Begehren versagt und die Augen der Witwe lassen verschmachten?
Hiob_Hi_18_31_17_Hab ich meinen Bissen allein gegessen, und hat nicht der Waise auch davon gegessen?
Hiob_Hi_18_31_18_Denn ich habe mich von Jugend auf gehalten wie ein Vater, und von meiner Mutter Leib an habe ich gerne getröstet.
Hiob_Hi_18_31_19_Hab ich jemand sehen umkommen, daß er kein Kleid hatte, und den Armen ohne Decke gehen lassen?
Hiob_Hi_18_31_20_Haben mich nicht gesegnet seine Lenden, da er von den Fellen meiner Lämmer erwärmt ward?
Hiob_Hi_18_31_21_Hab ich meine Hand an den Waisen gelegt, weil ich sah, daß ich im Tor Helfer hatte?
Hiob_Hi_18_31_22_So falle meine Schulter von der Achsel, und mein Arm breche von der Röhre.
Hiob_Hi_18_31_23_Denn ich fürchte Gottes Strafe über mich und könnte seine Last nicht ertragen.
Hiob_Hi_18_31_24_Hab ich das Gold zu meiner Zuversicht gemacht und zu dem Goldklumpen gesagt: \"Mein Trost\"?
Hiob_Hi_18_31_25_Hab ich mich gefreut, daß ich großes Gut hatte und meine Hand allerlei erworben hatte?
Hiob_Hi_18_31_26_Hab ich das Licht angesehen, wenn es hell leuchtete, und den Mond, wenn er voll ging,
Hiob_Hi_18_31_27_daß ich mein Herz heimlich beredet hätte, ihnen Küsse zuzuwerfen mit meiner Hand?
Hiob_Hi_18_31_28_was auch eine Missetat ist vor den Richtern; denn damit hätte ich verleugnet Gott in der Höhe.
Hiob_Hi_18_31_29_Hab ich mich gefreut, wenn's meinem Feind übel ging, und habe mich überhoben, darum daß ihn Unglück betreten hatte?
Hiob_Hi_18_31_30_Denn ich ließ meinen Mund nicht sündigen, daß ich verwünschte mit einem Fluch seine Seele.
Hiob_Hi_18_31_31_Haben nicht die Männer in meiner Hütte müssen sagen: \"Wo ist einer, der von seinem Fleisch nicht wäre gesättigt worden?\"
Hiob_Hi_18_31_32_Draußen mußte der Gast nicht bleiben, sondern meine Tür tat ich dem Wanderer auf.
Hiob_Hi_18_31_33_Hab ich meine Übertretungen nach Menschenweise zugedeckt, daß ich heimlich meine Missetat verbarg?
Hiob_Hi_18_31_34_Habe ich mir grauen lassen vor der großen Menge, und hat die Verachtung der Freundschaften mich abgeschreckt, daß ich stille blieb und nicht zur Tür ausging?
Hiob_Hi_18_31_35_O hätte ich einen, der mich anhört! Siehe, meine Unterschrift, der Allmächtige antworte mir!, und siehe die Schrift, die mein Verkläger geschrieben!
Hiob_Hi_18_31_36_Wahrlich, dann wollte ich sie auf meine Achsel nehmen und mir wie eine Krone umbinden;
Hiob_Hi_18_31_37_ich wollte alle meine Schritte ihm ansagen und wie ein Fürst zu ihm nahen.
Hiob_Hi_18_31_38_Wird mein Land gegen mich schreien und werden miteinander seine Furchen weinen;
Hiob_Hi_18_31_39_hab ich seine Früchte unbezahlt gegessen und das Leben der Ackerleute sauer gemacht:
Hiob_Hi_18_31_40_so mögen mir Disteln wachsen für Weizen und Dornen für Gerste. Die Worte Hiobs haben ein Ende.
Hiob_Hi_18_32_1_Da hörten die drei Männer auf, Hiob zu antworten, weil er sich für gerecht hielt.
Hiob_Hi_18_32_2_Aber Elihu, der Sohn Baracheels von Bus, des Geschlechts Rams, ward zornig über Hiob, daß er seine Seele gerechter hielt denn Gott.
Hiob_Hi_18_32_3_Auch ward er zornig über seine drei Freunde, daß sie keine Antwort fanden und doch Hiob verdammten.
Hiob_Hi_18_32_4_Denn Elihu hatte geharrt, bis daß sie mit Hiob geredet hatten, weil sie älter waren als er.
Hiob_Hi_18_32_5_Darum, da er sah, daß keine Antwort war im Munde der drei Männer, ward er zornig.
Hiob_Hi_18_32_6_Und so antwortete Elihu, der Sohn Baracheels von Bus, und sprach: Ich bin jung, ihr aber seid alt; darum habe ich mich gescheut und gefürchtet, mein Wissen euch kundzutun.
Hiob_Hi_18_32_7_Ich dachte: Laß das Alter reden, und die Menge der Jahre laß Weisheit beweisen.
Hiob_Hi_18_32_8_Aber der Geist ist in den Leuten und der Odem des Allmächtigen, der sie verständig macht.
Hiob_Hi_18_32_9_Die Großen sind nicht immer die Weisesten, und die Alten verstehen nicht das Recht.
Hiob_Hi_18_32_10_Darum will ich auch reden; höre mir zu. Ich will mein Wissen auch kundtun.
Hiob_Hi_18_32_11_Siehe, ich habe geharrt auf das, was ihr geredet habt; ich habe aufgemerkt auf eure Einsicht, bis ihr träfet die rechte Rede,
Hiob_Hi_18_32_12_und ich habe achtgehabt auf euch. Aber siehe, da ist keiner unter euch, der Hiob zurechtweise oder seiner Rede antworte.
Hiob_Hi_18_32_13_Sagt nur nicht: \"Wir haben Weisheit getroffen; Gott muß ihn schlagen, kein Mensch.\"
Hiob_Hi_18_32_14_Gegen mich hat er seine Worte nicht gerichtet, und mit euren Reden will ich ihm nicht antworten.
Hiob_Hi_18_32_15_Ach! sie sind verzagt, können nicht mehr antworten; sie können nicht mehr reden.
Hiob_Hi_18_32_16_Weil ich denn geharrt habe, und sie konnten nicht reden (denn sie stehen still und antworten nicht mehr),
Hiob_Hi_18_32_17_will ich auch mein Teil antworten und will mein Wissen kundtun.
Hiob_Hi_18_32_18_Denn ich bin der Reden so voll, daß mich der Odem in meinem Innern ängstet.
Hiob_Hi_18_32_19_Siehe, mein Inneres ist wie der Most, der zugestopft ist, der die neuen Schläuche zerreißt.
Hiob_Hi_18_32_20_Ich muß reden, daß ich mir Luft mache; ich muß meine Lippen auftun und antworten.
Hiob_Hi_18_32_21_Ich will niemands Person ansehen und will keinem Menschen schmeicheln.
Hiob_Hi_18_32_22_Denn ich weiß nicht zu schmeicheln; leicht würde mich sonst mein Schöpfer dahinraffen.
Hiob_Hi_18_33_1_Höre doch, Hiob, meine Rede und merke auf alle meine Worte!
Hiob_Hi_18_33_2_Siehe, ich tue meinen Mund auf, und meine Zunge redet in meinem Munde.
Hiob_Hi_18_33_3_Mein Herz soll recht reden, und meine Lippen sollen den reinen Verstand sagen.
Hiob_Hi_18_33_4_Der Geist Gottes hat mich gemacht, und der Odem des Allmächtigen hat mir das Leben gegeben.
Hiob_Hi_18_33_5_Kannst du, so antworte mir; rüste dich gegen mich und stelle dich.
Hiob_Hi_18_33_6_Siehe, ich bin Gottes ebensowohl als du, und aus Lehm bin ich auch gemacht.
Hiob_Hi_18_33_7_Siehe, du darfst vor mir nicht erschrecken, und meine Hand soll dir nicht zu schwer sein.
Hiob_Hi_18_33_8_Du hast geredet vor meinen Ohren; die Stimme deiner Reden mußte ich hören:
Hiob_Hi_18_33_9_\"Ich bin rein, ohne Missetat, unschuldig und habe keine Sünde;
Hiob_Hi_18_33_10_siehe, er hat eine Sache gegen mich gefunden, er achtet mich für einen Feind;
Hiob_Hi_18_33_11_er hat meinen Fuß in den Stock gelegt und hat acht auf alle meine Wege.\"
Hiob_Hi_18_33_12_Siehe, darin hast du nicht recht, muß ich dir antworten; denn Gott ist mehr als ein Mensch.
Hiob_Hi_18_33_13_Warum willst du mit ihm zanken, daß er dir nicht Rechenschaft gibt alles seines Tuns?
Hiob_Hi_18_33_14_Denn in einer Weise redet Gott und wieder in einer anderen, nur achtet man's nicht.
Hiob_Hi_18_33_15_Im Traum, im Nachtgesicht, wenn der Schlaf auf die Leute fällt, wenn sie schlafen auf dem Bette,
Hiob_Hi_18_33_16_da öffnet er das Ohr der Leute und schreckt sie und züchtigt sie,
Hiob_Hi_18_33_17_daß er den Menschen von seinem Vornehmen wende und behüte ihn vor Hoffart
Hiob_Hi_18_33_18_und verschone seine Seele vor dem Verderben und sein Leben, daß es nicht ins Schwert falle.
Hiob_Hi_18_33_19_Auch straft er ihn mit Schmerzen auf seinem Bette und alle seinen Gebeine heftig
Hiob_Hi_18_33_20_und richtet ihm sein Leben so zu, daß ihm vor seiner Speise ekelt, und seine Seele, daß sie nicht Lust zu essen hat.
Hiob_Hi_18_33_21_Sein Fleisch verschwindet, daß man's nimmer sehen kann; und seine Gebeine werden zerschlagen, daß man sie nicht gerne ansieht,
Hiob_Hi_18_33_22_daß seine Seele naht zum Verderben und sein Leben zu den Toten.
Hiob_Hi_18_33_23_So dann für ihn ein Engel als Mittler eintritt, einer aus tausend, zu verkündigen dem Menschen, wie er solle recht tun,
Hiob_Hi_18_33_24_so wird er ihm gnädig sein und sagen: \"Erlöse ihn, daß er nicht hinunterfahre ins Verderben; denn ich habe eine Versöhnung gefunden.\"
Hiob_Hi_18_33_25_Sein Fleisch wird wieder grünen wie in der Jugend, und er wird wieder jung werden.
Hiob_Hi_18_33_26_Er wird Gott bitten; der wird ihm Gnade erzeigen und wird ihn sein Antlitz sehen lassen mit Freuden und wird dem Menschen nach seiner Gerechtigkeit vergelten.
Hiob_Hi_18_33_27_Er wird vor den Leuten bekennen und sagen: \"Ich hatte gesündigt und das Recht verkehrt; aber es ist mir nicht vergolten worden.
Hiob_Hi_18_33_28_Er hat meine Seele erlöst, daß sie nicht führe ins Verderben, sondern mein Leben das Licht sähe.\"
Hiob_Hi_18_33_29_Siehe, das alles tut Gott zwei-oder dreimal mit einem jeglichen,
Hiob_Hi_18_33_30_daß er seine Seele zurückhole aus dem Verderben und erleuchte ihn mit dem Licht der Lebendigen.
Hiob_Hi_18_33_31_Merke auf, Hiob, und höre mir zu und schweige, daß ich rede!
Hiob_Hi_18_33_32_Hast du aber was zu sagen, so antworte mir; Sage an! ich wollte dich gerne rechtfertigen.
Hiob_Hi_18_33_33_Hast du aber nichts, so höre mir zu und schweige; ich will dich die Weisheit lehren.
Hiob_Hi_18_34_1_Und es hob an Elihu und sprach:
Hiob_Hi_18_34_2_Hört, ihr Weisen, meine Rede, und ihr Verständigen, merkt auf mich!
Hiob_Hi_18_34_3_Denn das Ohr prüft die Rede, und der Mund schmeckt die Speise.
Hiob_Hi_18_34_4_Laßt uns ein Urteil finden, daß wir erkennen unter uns, was gut sei.
Hiob_Hi_18_34_5_Denn Hiob hat gesagt: \"Ich bin gerecht, und Gott weigert mir mein Recht;
Hiob_Hi_18_34_6_ich muß lügen, ob ich wohl recht habe, und bin gequält von meinen Pfeilen, ob ich wohl nichts verschuldet habe.\"
Hiob_Hi_18_34_7_Wer ist ein solcher Hiob, der da Spötterei trinkt wie Wasser
Hiob_Hi_18_34_8_und auf dem Wege geht mit den Übeltätern und wandelt mit gottlosen Leuten?
Hiob_Hi_18_34_9_Denn er hat gesagt: \"Wenn jemand schon fromm ist, so gilt er doch nichts bei Gott.\"
Hiob_Hi_18_34_10_Darum hört mir zu, ihr weisen Leute: Es sei ferne, daß Gott sollte gottlos handeln und der Allmächtige ungerecht;
Hiob_Hi_18_34_11_sondern er vergilt dem Menschen, darnach er verdient hat, und trifft einen jeglichen nach seinem Tun.
Hiob_Hi_18_34_12_Ohne zweifel, Gott verdammt niemand mit Unrecht, und der Allmächtige beugt das Recht nicht.
Hiob_Hi_18_34_13_Wer hat, was auf Erden ist, verordnet, und wer hat den ganzen Erdboden gesetzt?
Hiob_Hi_18_34_14_So er nun an sich dächte, seinen Geist und Odem an sich zöge,
Hiob_Hi_18_34_15_so würde alles Fleisch miteinander vergehen, und der Mensch würde wieder zu Staub werden.
Hiob_Hi_18_34_16_Hast du nun Verstand, so höre das und merke auf die Stimme meiner Reden.
Hiob_Hi_18_34_17_Kann auch, der das Recht haßt regieren? Oder willst du den, der gerecht und mächtig ist, verdammen?
Hiob_Hi_18_34_18_Sollte einer zum König sagen: \"Du heilloser Mann!\" und zu den Fürsten: \"Ihr Gottlosen!\"?
Hiob_Hi_18_34_19_Und er sieht nicht an die Person der Fürsten und kennt den Herrlichen nicht mehr als den Armen; denn sie sind alle seiner Hände Werk.
Hiob_Hi_18_34_20_Plötzlich müssen die Leute sterben und zu Mitternacht erschrecken und vergehen; die Mächtigen werden weggenommen nicht durch Menschenhand.
Hiob_Hi_18_34_21_Denn seine Augen sehen auf eines jeglichen Wege, und er schaut alle ihre Gänge.
Hiob_Hi_18_34_22_Es ist keine Finsternis noch Dunkel, daß sich da möchten verbergen die Übeltäter.
Hiob_Hi_18_34_23_Denn er darf auf den Menschen nicht erst lange achten, daß er vor Gott ins Gericht komme.
Hiob_Hi_18_34_24_Er bringt die Stolzen um, ohne erst zu forschen, und stellt andere an ihre Statt:
Hiob_Hi_18_34_25_darum daß er kennt ihre Werke und kehrt sie um des Nachts, daß sie zerschlagen werden.
Hiob_Hi_18_34_26_Er straft sie ab wie die Gottlosen an einem Ort, da man es sieht:
Hiob_Hi_18_34_27_darum daß sie von ihm weggewichen sind und verstanden seiner Wege keinen,
Hiob_Hi_18_34_28_daß das Schreien der Armen mußte vor ihn kommen und er das Schreien der Elenden hörte.
Hiob_Hi_18_34_29_Wenn er Frieden gibt, wer will verdammen? und wenn er das Antlitz verbirgt, wer will ihn schauen unter den Völkern und Leuten allzumal?
Hiob_Hi_18_34_30_Denn er läßt nicht über sie regieren einen Heuchler, das Volk zu drängen.
Hiob_Hi_18_34_31_Denn zu Gott muß man sagen: \"Ich habe gebüßt, ich will nicht übel tun.
Hiob_Hi_18_34_32_Habe ich's nicht getroffen, so lehre du mich's besser; habe ich Unrecht gehandelt, ich will's nicht mehr tun.\"
Hiob_Hi_18_34_33_Soll er nach deinem Sinn vergelten? Denn du verwirfst alles; du hast zu wählen, und nicht ich. Weißt du nun was, so sage an.
Hiob_Hi_18_34_34_Verständige Leute werden zu mir sagen und ein weiser Mann, der mir zuhört:
Hiob_Hi_18_34_35_\"Hiob redet mit Unverstand, und seine Worte sind nicht klug.\"
Hiob_Hi_18_34_36_O, daß Hiob versucht würde bis ans Ende! darum daß er sich zu ungerechten Leuten kehrt.
Hiob_Hi_18_34_37_Denn er hat über seine Sünde noch gelästert; er treibt Spott unter uns und macht seiner Reden viel wider Gott.
Hiob_Hi_18_35_1_Und es hob an Elihu und sprach:
Hiob_Hi_18_35_2_Achtest du das für Recht, daß du sprichst: \"Ich bin gerechter denn Gott\"?
Hiob_Hi_18_35_3_Denn du sprichst: \"Wer gilt bei dir etwas? Was hilft es, ob ich nicht sündige?\"
Hiob_Hi_18_35_4_Ich will dir antworten ein Wort und deinen Freunden mit dir.
Hiob_Hi_18_35_5_Schaue gen Himmel und siehe; und schau an die Wolken, daß sie dir zu hoch sind.
Hiob_Hi_18_35_6_Sündigst du, was kannst du ihm Schaden? Und ob deiner Missetaten viel ist, was kannst du ihm tun?
Hiob_Hi_18_35_7_Und ob du gerecht seist, was kannst du ihm geben, oder was wird er von deinen Händen nehmen?
Hiob_Hi_18_35_8_Einem Menschen, wie du bist, mag wohl etwas tun deine Bosheit, und einem Menschenkind deine Gerechtigkeit.
Hiob_Hi_18_35_9_Man schreit, daß viel Gewalt geschieht, und ruft über den Arm der Großen;
Hiob_Hi_18_35_10_aber man fragt nicht: \"Wo ist Gott, mein Schöpfer, der Lobgesänge gibt in der Nacht,
Hiob_Hi_18_35_11_der uns klüger macht denn das Vieh auf Erden und weiser denn die Vögel unter dem Himmel?\"
Hiob_Hi_18_35_12_Da schreien sie über den Hochmut der Bösen, und er wird sie nicht erhören.
Hiob_Hi_18_35_13_Denn Gott wird das Eitle nicht erhören, und der Allmächtige wird es nicht ansehen.
Hiob_Hi_18_35_14_Nun sprichst du gar, du wirst ihn nicht sehen. Aber es ist ein Gericht vor ihm, harre sein nur!
Hiob_Hi_18_35_15_ob auch sein Zorn so bald nicht heimsucht und er sich's nicht annimmt, daß so viel Laster da sind.
Hiob_Hi_18_35_16_Darum hat Hiob seinen Mund umsonst aufgesperrt und gibt stolzes Gerede vor mit Unverstand.
Hiob_Hi_18_36_1_Elihu redet weiter und sprach:
Hiob_Hi_18_36_2_Harre mir noch ein wenig, ich will dir's zeigen; denn ich habe noch von Gottes wegen etwas zu sagen.
Hiob_Hi_18_36_3_Ich will mein Wissen weither holen und beweisen, daß mein Schöpfer recht habe.
Hiob_Hi_18_36_4_Meine Reden sollen ohne Zweifel nicht falsch sein; mein Verstand soll ohne Tadel vor dir sein.
Hiob_Hi_18_36_5_Siehe, Gott ist mächtig, und verachtet doch niemand; er ist mächtig von Kraft des Herzens.
Hiob_Hi_18_36_6_Den Gottlosen erhält er nicht, sondern hilft dem Elenden zum Recht.
Hiob_Hi_18_36_7_Er wendet seine Augen nicht von dem Gerechten; sondern mit Königen auf dem Thron läßt er sie sitzen immerdar, daß sie hoch bleiben.
Hiob_Hi_18_36_8_Und wenn sie gefangen blieben in Stöcken und elend gebunden mit Stricken,
Hiob_Hi_18_36_9_so verkündigt er ihnen, was sie getan haben, und ihre Untugenden, daß sie sich überhoben,
Hiob_Hi_18_36_10_und öffnet ihnen das Ohr zur Zucht und sagt ihnen, daß sie sich von dem Unrechten bekehren sollen.
Hiob_Hi_18_36_11_Gehorchen sie und dienen ihm, so werden sie bei guten Tagen alt werden und mit Lust leben.
Hiob_Hi_18_36_12_Gehorchen sie nicht, so werden sie ins Schwert fallen und vergehen in Unverstand.
Hiob_Hi_18_36_13_Die Heuchler werden voll Zorns; sie schreien nicht, wenn er sie gebunden hat.
Hiob_Hi_18_36_14_So wird ihre Seele in der Jugend sterben und ihr Leben unter den Hurern.
Hiob_Hi_18_36_15_Aber den Elenden wird er in seinem Elend erretten und dem Armen das Ohr öffnen in der Trübsal.
Hiob_Hi_18_36_16_Und auch dich lockt er aus dem Rachen der Angst in weiten Raum, da keine Bedrängnis mehr ist; und an deinem Tische, voll des Guten, wirst du Ruhe haben.
Hiob_Hi_18_36_17_Du aber machst die Sache der Gottlosen gut, daß ihre Sache und ihr Recht erhalten wird.
Hiob_Hi_18_36_18_Siehe zu, daß nicht vielleicht Zorn dich verlocke zum Hohn, oder die Größe des Lösegelds dich verleite.
Hiob_Hi_18_36_19_Meinst du, daß er deine Gewalt achte oder Gold oder irgend eine Stärke oder Vermögen?
Hiob_Hi_18_36_20_Du darfst der Nacht nicht begehren, welche Völker wegnimmt von ihrer Stätte.
Hiob_Hi_18_36_21_Hüte dich und kehre dich nicht zum Unrecht, wie du denn vor Elend angefangen hast.
Hiob_Hi_18_36_22_Siehe Gott ist zu hoch in seiner Kraft; wo ist ein Lehrer, wie er ist?
Hiob_Hi_18_36_23_Wer will ihm weisen seinen Weg, und wer will zu ihm sagen: \"Du tust Unrecht?\"
Hiob_Hi_18_36_24_Gedenke daß du sein Werk erhebest, davon die Leute singen.
Hiob_Hi_18_36_25_Denn alle Menschen sehen es; die Leute schauen's von ferne.
Hiob_Hi_18_36_26_Siehe Gott ist groß und unbekannt; seiner Jahre Zahl kann niemand erforschen.
Hiob_Hi_18_36_27_Er macht das Wasser zu kleinen Tropfen und treibt seine Wolken zusammen zum Regen,
Hiob_Hi_18_36_28_daß die Wolken fließen und triefen sehr auf die Menschen.
Hiob_Hi_18_36_29_Wenn er sich vornimmt die Wolken auszubreiten wie sein hoch Gezelt,
Hiob_Hi_18_36_30_siehe, so breitet er aus sein Licht über dieselben und bedeckt alle Enden des Meeres.
Hiob_Hi_18_36_31_Denn damit schreckt er die Leute und gibt doch Speise die Fülle.
Hiob_Hi_18_36_32_Er deckt den Blitz wie mit Händen und heißt ihn doch wieder kommen.
Hiob_Hi_18_36_33_Davon zeugt sein Geselle, des Donners Zorn in den Wolken.
Hiob_Hi_18_37_1_Des entsetzt sich mein Herz und bebt.
Hiob_Hi_18_37_2_O höret doch, wie der Donner zürnt, und was für Gespräch von seinem Munde ausgeht!
Hiob_Hi_18_37_3_Er läßt ihn hinfahren unter allen Himmeln, und sein Blitz scheint auf die Enden der Erde.
Hiob_Hi_18_37_4_Ihm nach brüllt der Donner, und er donnert mit seinem großen Schall; und wenn sein Donner gehört wird, kann man's nicht aufhalten.
Hiob_Hi_18_37_5_Gott donnert mit seinem Donner wunderbar und tut große Dinge und wird doch nicht erkannt.
Hiob_Hi_18_37_6_Er spricht zum Schnee, so ist er bald auf Erden, und zum Platzregen, so ist der Platzregen da mit Macht.
Hiob_Hi_18_37_7_Aller Menschen Hand hält er verschlossen, daß die Leute lernen, was er tun kann.
Hiob_Hi_18_37_8_Das wilde Tier geht in seine Höhle und bleibt an seinem Ort.
Hiob_Hi_18_37_9_Von Mittag her kommt Wetter und von Mitternacht Kälte.
Hiob_Hi_18_37_10_Vom Odem Gottes kommt Frost, und große Wasser ziehen sich eng zusammen.
Hiob_Hi_18_37_11_Die Wolken beschwert er mit Wasser, und durch das Gewölk bricht sein Licht.
Hiob_Hi_18_37_12_Er kehrt die Wolken, wo er hin will, daß sie schaffen alles, was er ihnen gebeut, auf dem Erdboden:
Hiob_Hi_18_37_13_es sei zur Züchtigung über ein Land oder zur Gnade, läßt er sie kommen.
Hiob_Hi_18_37_14_Da merke auf, Hiob, stehe und vernimm die Wunder Gottes!
Hiob_Hi_18_37_15_Weißt du wie Gott solches über sie bringt und wie er das Licht aus seinen Wolken läßt hervorbrechen?
Hiob_Hi_18_37_16_Weißt du wie sich die Wolken ausstreuen, die Wunder des, der vollkommen ist an Wissen?
Hiob_Hi_18_37_17_Du, des Kleider warm sind, wenn das Land still ist vom Mittagswinde,
Hiob_Hi_18_37_18_ja, du wirst mit ihm den Himmel ausbreiten, der fest ist wie ein gegossener Spiegel.
Hiob_Hi_18_37_19_Zeige uns, was wir ihm sagen sollen; denn wir können nichts vorbringen vor Finsternis.
Hiob_Hi_18_37_20_Wer wird ihm erzählen, daß ich wolle reden? So jemand redet, der wird verschlungen.
Hiob_Hi_18_37_21_Jetzt sieht man das Licht nicht, das am Himmel hell leuchtet; wenn aber der Wind weht, so wird's klar.
Hiob_Hi_18_37_22_Von Mitternacht kommt Gold; um Gott her ist schrecklicher Glanz.
Hiob_Hi_18_37_23_Den Allmächtigen aber können wir nicht finden, der so groß ist von Kraft; das Recht und eine gute Sache beugt er nicht.
Hiob_Hi_18_37_24_Darum müssen ihn fürchten die Leute; und er sieht keinen an, wie weise sie sind.
Hiob_Hi_18_38_1_Und der HERR antwortete Hiob aus dem Wetter und sprach:
Hiob_Hi_18_38_2_Wer ist der, der den Ratschluß verdunkelt mit Worten ohne Verstand?
Hiob_Hi_18_38_3_Gürte deine Lenden wie ein Mann; ich will dich fragen, lehre mich!
Hiob_Hi_18_38_4_Wo warst du, da ich die Erde gründete? Sage an, bist du so klug!
Hiob_Hi_18_38_5_Weißt du, wer ihr das Maß gesetzt hat oder wer über sie eine Richtschnur gezogen hat?
Hiob_Hi_18_38_6_Worauf stehen ihre Füße versenkt, oder wer hat ihren Eckstein gelegt,
Hiob_Hi_18_38_7_da mich die Morgensterne miteinander lobten und jauchzten alle Kinder Gottes?
Hiob_Hi_18_38_8_Wer hat das Meer mit Türen verschlossen, da es herausbrach wie aus Mutterleib,
Hiob_Hi_18_38_9_da ich's mit Wolken kleidete und in Dunkel einwickelte wie in Windeln,
Hiob_Hi_18_38_10_da ich ihm den Lauf brach mit meinem Damm und setzte ihm Riegel und Türen
Hiob_Hi_18_38_11_und sprach: \"Bis hierher sollst du kommen und nicht weiter; hier sollen sich legen deine stolzen Wellen!\"?
Hiob_Hi_18_38_12_Hast du bei deiner Zeit dem Morgen geboten und der Morgenröte ihren Ort gezeigt,
Hiob_Hi_18_38_13_daß sie die Ecken der Erde fasse und die Gottlosen herausgeschüttelt werden?
Hiob_Hi_18_38_14_Sie wandelt sich wie Ton unter dem Siegel, und alles steht da wie im Kleide.
Hiob_Hi_18_38_15_Und den Gottlosen wird ihr Licht genommen, und der Arm der Hoffärtigen wird zerbrochen.
Hiob_Hi_18_38_16_Bist du in den Grund des Meeres gekommen und in den Fußtapfen der Tiefe gewandelt?
Hiob_Hi_18_38_17_Haben sich dir des Todes Tore je aufgetan, oder hast du gesehen die Tore der Finsternis?
Hiob_Hi_18_38_18_Hast du vernommen wie breit die Erde sei? Sage an, weißt du solches alles!
Hiob_Hi_18_38_19_Welches ist der Weg, da das Licht wohnt, und welches ist der Finsternis Stätte,
Hiob_Hi_18_38_20_daß du mögest ergründen seine Grenze und merken den Pfad zu seinem Hause?
Hiob_Hi_18_38_21_Du weißt es ja; denn zu der Zeit wurdest du geboren, und deiner Tage sind viel.
Hiob_Hi_18_38_22_Bist du gewesen, da der Schnee her kommt, oder hast du gesehen, wo der Hagel her kommt,
Hiob_Hi_18_38_23_die ich habe aufbehalten bis auf die Zeit der Trübsal und auf den Tag des Streites und Krieges?
Hiob_Hi_18_38_24_Durch welchen Weg teilt sich das Licht und fährt der Ostwind hin über die Erde?
Hiob_Hi_18_38_25_Wer hat dem Platzregen seinen Lauf ausgeteilt und den Weg dem Blitz und dem Donner
Hiob_Hi_18_38_26_und läßt regnen aufs Land da niemand ist, in der Wüste, da kein Mensch ist,
Hiob_Hi_18_38_27_daß er füllt die Einöde und Wildnis und macht das Gras wächst?
Hiob_Hi_18_38_28_Wer ist des Regens Vater? Wer hat die Tropfen des Taues gezeugt?
Hiob_Hi_18_38_29_Aus wes Leib ist das Eis gegangen, und wer hat den Reif unter dem Himmel gezeugt,
Hiob_Hi_18_38_30_daß das Wasser verborgen wird wie unter Steinen und die Tiefe oben gefriert?
Hiob_Hi_18_38_31_Kannst du die Bande der sieben Sterne zusammenbinden oder das Band des Orion auflösen?
Hiob_Hi_18_38_32_Kannst du den Morgenstern hervorbringen zu seiner Zeit oder den Bären am Himmel samt seinen Jungen heraufführen?
Hiob_Hi_18_38_33_Weißt du des Himmels Ordnungen, oder bestimmst du seine Herrschaft über die Erde?
Hiob_Hi_18_38_34_Kannst du deine Stimme zu der Wolke erheben, daß dich die Menge des Wassers bedecke?
Hiob_Hi_18_38_35_Kannst du die Blitze auslassen, daß sie hinfahren und sprechen zu dir: Hier sind wir?
Hiob_Hi_18_38_36_Wer gibt die Weisheit in das Verborgene? Wer gibt verständige Gedanken?
Hiob_Hi_18_38_37_Wer ist so weise, der die Wolken zählen könnte? Wer kann die Wasserschläuche am Himmel ausschütten,
Hiob_Hi_18_38_38_wenn der Staub begossen wird, daß er zuhauf läuft und die Schollen aneinander kleben?
Hiob_Hi_18_38_39_Kannst du der Löwin ihren Raub zu jagen geben und die jungen Löwen sättigen,
Hiob_Hi_18_38_40_wenn sie sich legen in ihre Stätten und ruhen in der Höhle, da sie lauern?
Hiob_Hi_18_38_41_Wer bereitet den Raben die Speise, wenn seine Jungen zu Gott rufen und fliegen irre, weil sie nicht zu essen haben?
Hiob_Hi_18_39_1_Weißt du die Zeit, wann die Gemsen auf den Felsen gebären? oder hast du gemerkt, wann die Hinden schwanger gehen?
Hiob_Hi_18_39_2_Hast du gezählt ihre Monden, wann sie voll werden? oder weißt du die Zeit, wann sie gebären?
