Hiob_Hi_18_20_17_Er wird nicht sehen die Ströme noch die Wasserbäche, die mit Honig und Butter fließen.
Hiob_Hi_18_20_18_Er wird arbeiten, und des nicht genießen; und seine Güter werden andern, daß er deren nicht froh wird.
Hiob_Hi_18_20_19_Denn er hat unterdrückt und verlassen den Armen; er hat Häuser an sich gerissen, die er nicht erbaut hat.
Hiob_Hi_18_20_20_Denn sein Wanst konnte nicht voll werden; so wird er mit seinem köstlichen Gut nicht entrinnen.
Hiob_Hi_18_20_21_Nichts blieb übrig vor seinem Fressen; darum wird sein gutes Leben keinen Bestand haben.
Hiob_Hi_18_20_22_Wenn er gleich die Fülle und genug hat, wird ihm doch angst werden; aller Hand Mühsal wird über ihn kommen.
Hiob_Hi_18_20_23_Es wird ihm der Wanst einmal voll werden, wenn er wird den Grimm seines Zorns über ihn senden und über ihn wird regnen lassen seine Speise.
Hiob_Hi_18_20_24_Er wird fliehen vor dem eisernen Harnisch, und der eherne Bogen wird ihn verjagen.
Hiob_Hi_18_20_25_Ein bloßes Schwert wird durch ihn ausgehen; und des Schwertes Blitz, der ihm bitter sein wird, wird mit Schrecken über ihn fahren.
Hiob_Hi_18_20_26_Es ist keine Finsternis da, die ihn verdecken möchte. Es wird ihn ein Feuer verzehren, das nicht angeblasen ist; und wer übrig ist in seiner Hütte, dem wird's übel gehen.
Hiob_Hi_18_20_27_Der Himmel wird seine Missetat eröffnen, und die Erde wird sich gegen ihn setzen.
Hiob_Hi_18_20_28_Das Getreide in seinem Hause wird weggeführt werden, zerstreut am Tage seines Zorns.
Hiob_Hi_18_20_29_Das ist der Lohn eines gottlosen Menschen bei Gott und das Erbe, das ihm zugesprochen wird von Gott.
Hiob_Hi_18_21_1_Hiob antwortete und sprach:
Hiob_Hi_18_21_2_Hört doch meiner Rede zu und laßt mir das anstatt eurer Tröstungen sein!
Hiob_Hi_18_21_3_Vertragt mich, daß ich auch rede, und spottet darnach mein!
Hiob_Hi_18_21_4_Handle ich denn mit einem Menschen? oder warum sollte ich ungeduldig sein?
Hiob_Hi_18_21_5_Kehrt euch her zu mir; ihr werdet erstarren und die Hand auf den Mund legen müssen.
Hiob_Hi_18_21_6_Wenn ich daran denke, so erschrecke ich, und Zittern kommt mein Fleisch an.
Hiob_Hi_18_21_7_Warum leben denn die Gottlosen, werden alt und nehmen zu an Gütern?
Hiob_Hi_18_21_8_Ihr Same ist sicher um sie her, und ihre Nachkömmlinge sind bei ihnen.
Hiob_Hi_18_21_9_Ihr Haus hat Frieden vor der Furcht, und Gottes Rute ist nicht über ihnen.
Hiob_Hi_18_21_10_Seinen Stier läßt man zu, und es mißrät ihm nicht; seine Kuh kalbt und ist nicht unfruchtbar.
Hiob_Hi_18_21_11_Ihre jungen Kinder lassen sie ausgehen wie eine Herde, und ihre Knaben hüpfen.
Hiob_Hi_18_21_12_Sie jauchzen mit Pauken und Harfen und sind fröhlich mit Flöten.
Hiob_Hi_18_21_13_Sie werden alt bei guten Tagen und erschrecken kaum einen Augenblick vor dem Tode,
Hiob_Hi_18_21_14_die doch sagen zu Gott: \"Hebe dich von uns, wir wollen von deinen Wegen nicht wissen!
Hiob_Hi_18_21_15_Wer ist der Allmächtige, daß wir ihm dienen sollten? oder was sind wir gebessert, so wir ihn anrufen?\"
Hiob_Hi_18_21_16_\"Aber siehe, ihr Glück steht nicht in ihren Händen; darum soll der Gottlosen Sinn ferne von mir sein.\"
Hiob_Hi_18_21_17_Wie oft geschieht's denn, daß die Leuchte der Gottlosen verlischt und ihr Unglück über sie kommt? daß er Herzeleid über sie austeilt in seinem Zorn?
Hiob_Hi_18_21_18_daß sie werden wie Stoppeln vor dem Winde und wie Spreu, die der Sturmwind wegführt?
Hiob_Hi_18_21_19_\"Gott spart desselben Unglück auf seine Kinder\". Er vergelte es ihm selbst, daß er's innewerde.
Hiob_Hi_18_21_20_Seine Augen mögen sein Verderben sehen, und vom Grimm des Allmächtigen möge er trinken.
Hiob_Hi_18_21_21_Denn was ist ihm gelegen an seinem Hause nach ihm, wenn die Zahl seiner Monden ihm zugeteilt ist?
Hiob_Hi_18_21_22_Wer will Gott lehren, der auch die Hohen richtet?
Hiob_Hi_18_21_23_Dieser stirbt frisch und gesund in allem Reichtum und voller Genüge,
Hiob_Hi_18_21_24_sein Melkfaß ist voll Milch, und seine Gebeine werden gemästet mit Mark;
Hiob_Hi_18_21_25_jener aber stirbt mit betrübter Seele und hat nie mit Freuden gegessen;
Hiob_Hi_18_21_26_und liegen gleich miteinander in der Erde, und Würmer decken sie zu.
Hiob_Hi_18_21_27_Siehe, ich kenne eure Gedanken wohl und euer frevles Vornehmen gegen mich.
Hiob_Hi_18_21_28_Denn ihr sprecht: \"Wo ist das Haus des Fürsten? und wo ist die Hütte, da die Gottlosen wohnten?\"
Hiob_Hi_18_21_29_Habt ihr denn die Wanderer nicht befragt und nicht gemerkt ihre Zeugnisse?
Hiob_Hi_18_21_30_Denn der Böse wird erhalten am Tage des Verderbens, und am Tage des Grimms bleibt er.
Hiob_Hi_18_21_31_Wer will ihm ins Angesicht sagen, was er verdient? wer will ihm vergelten, was er tut?
Hiob_Hi_18_21_32_Und er wird zu Grabe geleitet und hält Wache auf seinem Hügel.
Hiob_Hi_18_21_33_Süß sind ihm die Schollen des Tales, und alle Menschen ziehen ihm nach; und derer, die ihm vorangegangen sind, ist keine Zahl.
Hiob_Hi_18_21_34_Wie tröstet ihr mich so vergeblich, und eure Antworten finden sich unrecht!
Hiob_Hi_18_22_1_Da antwortete Eliphas von Theman und sprach:
Hiob_Hi_18_22_2_Kann denn ein Mann Gottes etwas nützen? Nur sich selber nützt ein Kluger.
Hiob_Hi_18_22_3_Meinst du, dem Allmächtigen liege daran, daß du gerecht seist? Was hilft's ihm, wenn deine Wege ohne Tadel sind?
Hiob_Hi_18_22_4_Meinst du wegen deiner Gottesfurcht strafe er dich und gehe mit dir ins Gericht?
Hiob_Hi_18_22_5_Nein, deine Bosheit ist zu groß, und deiner Missetaten ist kein Ende.
Hiob_Hi_18_22_6_Du hast etwa deinem Bruder ein Pfand genommen ohne Ursache; du hast den Nackten die Kleider ausgezogen;
Hiob_Hi_18_22_7_du hast die Müden nicht getränkt mit Wasser und hast dem Hungrigen dein Brot versagt;
Hiob_Hi_18_22_8_du hast Gewalt im Lande geübt und prächtig darin gegessen;
Hiob_Hi_18_22_9_die Witwen hast du leer lassen gehen und die Arme der Waisen zerbrochen.
Hiob_Hi_18_22_10_Darum bist du mit Stricken umgeben, und Furcht hat dich plötzlich erschreckt.
Hiob_Hi_18_22_11_Solltest du denn nicht die Finsternis sehen und die Wasserflut, die dich bedeckt?
Hiob_Hi_18_22_12_Ist nicht Gott hoch droben im Himmel? Siehe, die Sterne an droben in der Höhe!
Hiob_Hi_18_22_13_Und du sprichst: \"Was weiß Gott? Sollte er, was im Dunkeln ist, richten können?
Hiob_Hi_18_22_14_Die Wolken sind die Vordecke, und er sieht nicht; er wandelt im Umkreis des Himmels.\"
Hiob_Hi_18_22_15_Achtest du wohl auf den Weg, darin vorzeiten die Ungerechten gegangen sind?
Hiob_Hi_18_22_16_die vergangen sind, ehe denn es Zeit war, und das Wasser hat ihren Grund weggewaschen;
Hiob_Hi_18_22_17_die zu Gott sprachen: \"Hebe dich von uns! was sollte der Allmächtige uns tun können?\"
Hiob_Hi_18_22_18_so er doch ihr Haus mit Gütern füllte. Aber der Gottlosen Rat sei ferne von mir.
Hiob_Hi_18_22_19_Die Gerechten werden es sehen und sich freuen, und der Unschuldige wird ihrer spotten:
Hiob_Hi_18_22_20_\"Fürwahr, unser Widersacher ist verschwunden; und sein Übriggelassenes hat das Feuer verzehrt.\"
Hiob_Hi_18_22_21_So vertrage dich nun mit ihm und habe Frieden; daraus wird dir viel Gutes kommen.
Hiob_Hi_18_22_22_Höre das Gesetz von seinem Munde und fasse seine Reden in dein Herz.
Hiob_Hi_18_22_23_Wirst du dich bekehren zu dem Allmächtigen, so wirst du aufgebaut werden. Tue nur Unrecht ferne hinweg von deiner Hütte
Hiob_Hi_18_22_24_und wirf in den Staub dein Gold und zu den Steinen der Bäche das Ophirgold,
Hiob_Hi_18_22_25_so wird der Allmächtige dein Gold sein und wie Silber, das dir zugehäuft wird.
Hiob_Hi_18_22_26_Dann wirst du Lust haben an dem Allmächtigen und dein Antlitz zu Gott aufheben.
Hiob_Hi_18_22_27_So wirst du ihn bitten, und er wird dich hören, und wirst dein Gelübde bezahlen.
Hiob_Hi_18_22_28_Was du wirst vornehmen, wird er dir lassen gelingen; und das Licht wird auf deinem Wege scheinen.
Hiob_Hi_18_22_29_Denn die sich demütigen, die erhöht er; und wer seine Augen niederschlägt, der wird genesen.
Hiob_Hi_18_22_30_Auch der nicht unschuldig war wird errettet werden; er wird aber errettet um deiner Hände Reinigkeit willen.
Hiob_Hi_18_23_1_Hiob antwortete und sprach:
Hiob_Hi_18_23_2_Meine Rede bleibt noch betrübt; meine Macht ist schwach über meinem Seufzen.
Hiob_Hi_18_23_3_Ach daß ich wüßte, wie ich ihn finden und zu seinem Stuhl kommen möchte
Hiob_Hi_18_23_4_und das Recht vor ihm sollte vorlegen und den Mund voll Verantwortung fassen
Hiob_Hi_18_23_5_und erfahren die Reden, die er mir antworten, und vernehmen, was er mir sagen würde!
Hiob_Hi_18_23_6_Will er mit großer Macht mit mir rechten? Er stelle sich nicht so gegen mich,
Hiob_Hi_18_23_7_sondern lege mir's gleich vor, so will ich mein Recht wohl gewinnen.
Hiob_Hi_18_23_8_Aber ich gehe nun stracks vor mich, so ist er nicht da; gehe ich zurück, so spüre ich ihn nicht;
Hiob_Hi_18_23_9_ist er zur Linken, so schaue ich ihn nicht; verbirgt er sich zur Rechten, so sehe ich ihn nicht.
Hiob_Hi_18_23_10_Er aber kennt meinen Weg wohl. Er versuche mich, so will ich erfunden werden wie das Gold.
Hiob_Hi_18_23_11_Denn ich setze meinen Fuß auf seine Bahn und halte seinen Weg und weiche nicht ab
Hiob_Hi_18_23_12_und trete nicht von dem Gebot seiner Lippen und bewahre die Rede seines Mundes mehr denn mein eigen Gesetz.
Hiob_Hi_18_23_13_Doch er ist einig; wer will ihm wehren? Und er macht's wie er will.
Hiob_Hi_18_23_14_Denn er wird vollführen, was mir bestimmt ist, und hat noch viel dergleichen im Sinne.
Hiob_Hi_18_23_15_Darum erschrecke ich vor ihm; und wenn ich's bedenke, so fürchte ich mich vor ihm.
Hiob_Hi_18_23_16_Gott hat mein Herz blöde gemacht, und der Allmächtige hat mich erschreckt.
Hiob_Hi_18_23_17_Denn die Finsternis macht kein Ende mit mir, und das Dunkel will vor mir nicht verdeckt werden.
Hiob_Hi_18_24_1_Warum sind von dem Allmächtigen nicht Zeiten vorbehalten, und warum sehen, die ihn kennen, seine Tage nicht?
Hiob_Hi_18_24_2_Man verrückt die Grenzen, raubt die Herde und weidet sie.
Hiob_Hi_18_24_3_Sie treiben der Waisen Esel weg und nehmen der Witwe Ochsen zum Pfande.
Hiob_Hi_18_24_4_Die Armen müssen ihnen weichen, und die Dürftigen im Lande müssen sich verkriechen.
Hiob_Hi_18_24_5_Siehe, wie Wildesel in der Wüste gehen sie hinaus an ihr Werk und suchen Nahrung; die Einöde gibt ihnen Speise für ihre Kinder.
Hiob_Hi_18_24_6_Sie ernten auf dem Acker, was er trägt, und lesen den Weinberg des Gottlosen.
Hiob_Hi_18_24_7_Sie liegen in der Nacht nackt ohne Gewand und haben keine Decke im Frost.
Hiob_Hi_18_24_8_Sie müssen sich zu den Felsen halten, wenn ein Platzregen von den Bergen auf sie gießt, weil sie sonst keine Zuflucht haben.
Hiob_Hi_18_24_9_Man reißt das Kind von den Brüsten und macht's zum Waisen und macht die Leute arm mit Pfänden.
Hiob_Hi_18_24_10_Den Nackten lassen sie ohne Kleider gehen, und den Hungrigen nehmen sie die Garben.
Hiob_Hi_18_24_11_Sie zwingen sie, Öl zu machen auf ihrer Mühle und ihre Kelter zu treten, und lassen sie doch Durst leiden.
Hiob_Hi_18_24_12_Sie machen die Leute in der Stadt seufzend und die Seele der Erschlagenen schreiend, und Gott stürzt sie nicht.
Hiob_Hi_18_24_13_Jene sind abtrünnig geworden vom Licht und kennen seinen Weg nicht und kehren nicht wieder zu seiner Straße.
Hiob_Hi_18_24_14_Wenn der Tag anbricht, steht auf der Mörder und erwürgt den Armen und Dürftigen; und des Nachts ist er wie ein Dieb.
Hiob_Hi_18_24_15_Das Auge des Ehebrechers hat acht auf das Dunkel, und er spricht: \"Mich sieht kein Auge\", und verdeckt sein Antlitz.
Hiob_Hi_18_24_16_Im Finstern bricht man in die Häuser ein; des Tages verbergen sie sich miteinander und scheuen das Licht.
Hiob_Hi_18_24_17_Denn wie wenn der Morgen käme, ist ihnen allen die Finsternis; denn sie sind bekannt mit den Schrecken der Finsternis.
Hiob_Hi_18_24_18_\"Er fährt leicht wie auf einem Wasser dahin; seine Habe wird gering im Lande, und er baut seinen Weinberg nicht.
Hiob_Hi_18_24_19_Der Tod nimmt weg, die da sündigen, wie die Hitze und Dürre das Schneewasser verzehrt.
Hiob_Hi_18_24_20_Der Mutterschoß vergißt sein; die Würmer haben ihre Lust an ihm. Sein wird nicht mehr gedacht; er wird zerbrochen wie ein fauler Baum,
Hiob_Hi_18_24_21_er, der beleidigt hat die Einsame, die nicht gebiert, und hat der Witwe kein Gutes getan.\"
Hiob_Hi_18_24_22_Aber Gott erhält die Mächtigen durch seine Kraft, daß sie wieder aufstehen, wenn sie am Leben verzweifelten.
Hiob_Hi_18_24_23_Er gibt ihnen, daß sie sicher seien und eine Stütze haben; und seine Augen sind über ihren Wegen.
Hiob_Hi_18_24_24_Sie sind hoch erhöht, und über ein kleines sind sie nicht mehr; sinken sie hin, so werden sie weggerafft wie alle andern, und wie das Haupt auf den Ähren werden sie abgeschnitten.
Hiob_Hi_18_24_25_Ist's nicht also? Wohlan, wer will mich Lügen strafen und bewähren, daß meine Rede nichts sei?
Hiob_Hi_18_25_1_Da antwortete Bildad von Suah und sprach:
Hiob_Hi_18_25_2_Ist nicht Herrschaft und Schrecken bei ihm, der Frieden macht unter seinen Höchsten?
Hiob_Hi_18_25_3_Wer will seine Kriegsscharen zählen? und über wen geht nicht auf sein Licht?
Hiob_Hi_18_25_4_Und wie kann ein Mensch gerecht vor Gott sein? und wie kann rein sein eines Weibes Kind?
Hiob_Hi_18_25_5_Siehe, auch der Mond scheint nicht helle, und die Sterne sind nicht rein vor seinen Augen:
Hiob_Hi_18_25_6_wie viel weniger ein Mensch, die Made, und ein Menschenkind, der Wurm!
Hiob_Hi_18_26_1_Hiob antwortete und sprach:
Hiob_Hi_18_26_2_Wie stehest du dem bei, der keine Kraft hat, hilfst dem, der keine Stärke in den Armen hat!
Hiob_Hi_18_26_3_Wie gibst du Rat dem, der keine Weisheit hat, und tust kund Verstandes die Fülle!
Hiob_Hi_18_26_4_Zu wem redest du? und wes Odem geht von dir aus?
Hiob_Hi_18_26_5_Die Toten ängsten sich tief unter den Wassern und denen, die darin wohnen.
Hiob_Hi_18_26_6_Das Grab ist aufgedeckt vor ihm, und der Abgrund hat keine Decke.
Hiob_Hi_18_26_7_Er breitet aus die Mitternacht über das Leere und hängt die Erde an nichts.
Hiob_Hi_18_26_8_Er faßt das Wasser zusammen in seine Wolken, und die Wolken zerreißen darunter nicht.
Hiob_Hi_18_26_9_Er verhüllt seinen Stuhl und breitet seine Wolken davor.
Hiob_Hi_18_26_10_Er hat um das Wasser ein Ziel gesetzt, bis wo Licht und Finsternis sich scheiden.
Hiob_Hi_18_26_11_Die Säulen des Himmels zittern und entsetzen sich vor seinem Schelten.
Hiob_Hi_18_26_12_Von seiner Kraft wird das Meer plötzlich ungestüm, und durch seinen Verstand zerschmettert er Rahab.
Hiob_Hi_18_26_13_Am Himmel wird's schön durch seinen Wind, und seine Hand durchbohrt die flüchtige Schlange.
Hiob_Hi_18_26_14_Siehe, also geht sein Tun, und nur ein geringes Wörtlein davon haben wir vernommen. Wer will aber den Donner seiner Macht verstehen?
Hiob_Hi_18_27_1_Und Hiob fuhr fort und hob an seine Sprüche und sprach:
Hiob_Hi_18_27_2_So wahr Gott lebt, der mir mein Recht weigert, und der Allmächtige, der meine Seele betrübt;
Hiob_Hi_18_27_3_solange mein Odem in mir ist und der Hauch von Gott in meiner Nase ist:
Hiob_Hi_18_27_4_meine Lippen sollen nichts Unrechtes reden, und meine Zunge soll keinen Betrug sagen.
Hiob_Hi_18_27_5_Das sei ferne von mir, daß ich euch recht gebe; bis daß mein Ende kommt, will ich nicht weichen von meiner Unschuld.
Hiob_Hi_18_27_6_Von meiner Gerechtigkeit, die ich habe, will ich nicht lassen; mein Gewissen beißt mich nicht meines ganzen Lebens halben.
Hiob_Hi_18_27_7_Aber mein Feind müsse erfunden werden als ein Gottloser, und der sich wider mich auflehnt, als ein Ungerechter.
Hiob_Hi_18_27_8_Denn was ist die Hoffnung des Heuchlers, wenn Gott ein Ende mit ihm macht und seine Seele hinreißt?
Hiob_Hi_18_27_9_Meinst du das Gott sein Schreien hören wird, wenn die Angst über ihn kommt?
Hiob_Hi_18_27_10_Oder kann er an dem Allmächtigen seine Lust haben und Gott allezeit anrufen?
Hiob_Hi_18_27_11_Ich will euch lehren von der Hand Gottes; und was bei dem Allmächtigen gilt, will ich nicht verhehlen.
Hiob_Hi_18_27_12_Siehe, ihr haltet euch alle für klug; warum bringt ihr denn solch unnütze Dinge vor?
Hiob_Hi_18_27_13_Das ist der Lohn eines gottlosen Menschen bei Gott und das Erbe der Tyrannen, das sie von dem Allmächtigen nehmen werden:
Hiob_Hi_18_27_14_wird er viele Kinder haben, so werden sie des Schwertes sein; und seine Nachkömmlinge werden des Brots nicht satt haben.
Hiob_Hi_18_27_15_Die ihm übrigblieben, wird die Seuche ins Grab bringen; und seine Witwen werden nicht weinen.
Hiob_Hi_18_27_16_Wenn er Geld zusammenbringt wie Staub und sammelt Kleider wie Lehm,
Hiob_Hi_18_27_17_so wird er es wohl bereiten; aber der Gerechte wird es anziehen, und der Unschuldige wird das Geld austeilen.
Hiob_Hi_18_27_18_Er baut sein Haus wie eine Spinne, und wie ein Wächter seine Hütte macht.
Hiob_Hi_18_27_19_Der Reiche, wenn er sich legt, wird er's nicht mitraffen; er wird seine Augen auftun, und da wird nichts sein.
Hiob_Hi_18_27_20_Es wird ihn Schrecken überfallen wie Wasser; des Nachts wird ihn das Ungewitter wegnehmen.
Hiob_Hi_18_27_21_Der Ostwind wird ihn wegführen, daß er dahinfährt; und Ungestüm wird ihn von seinem Ort treiben.
Hiob_Hi_18_27_22_Er wird solches über ihn führen und wird sein nicht schonen; vor seiner Hand muß er fliehen und wieder fliehen.
Hiob_Hi_18_27_23_Man wird über ihn mit den Händen klatschen und über ihn zischen, wo er gewesen ist.
Hiob_Hi_18_28_1_Es hat das Silber seine Gänge, und das Gold, das man läutert seinen Ort.
Hiob_Hi_18_28_2_Eisen bringt man aus der Erde, und aus den Steinen schmelzt man Erz.
Hiob_Hi_18_28_3_Man macht der Finsternis ein Ende und findet zuletzt das Gestein tief verborgen.
Hiob_Hi_18_28_4_Man bricht einen Schacht von da aus, wo man wohnt; darin hangen und schweben sie als die Vergessenen, da kein Fuß hin tritt, fern von den Menschen.
Hiob_Hi_18_28_5_Man zerwühlt unten die Erde wie mit Feuer, darauf doch oben die Speise wächst.
Hiob_Hi_18_28_6_Man findet Saphir an etlichen Orten, und Erdenklöße, da Gold ist.
Hiob_Hi_18_28_7_Den Steig kein Adler erkannt hat und kein Geiersauge gesehen;
Hiob_Hi_18_28_8_es hat das stolze Wild nicht darauf getreten und ist kein Löwe darauf gegangen.
Hiob_Hi_18_28_9_Auch legt man die Hand an die Felsen und gräbt die Berge um.
Hiob_Hi_18_28_10_Man reißt Bäche aus den Felsen; und alles, was köstlich ist, sieht das Auge.
Hiob_Hi_18_28_11_Man wehrt dem Strome des Wassers und bringt, das darinnen verborgen ist, ans Licht.
Hiob_Hi_18_28_12_Wo will man aber die Weisheit finden? und wo ist die Stätte des Verstandes?
Hiob_Hi_18_28_13_Niemand weiß, wo sie liegt, und sie wird nicht gefunden im Lande der Lebendigen.
Hiob_Hi_18_28_14_Die Tiefe spricht: \"Sie ist in mir nicht\"; und das Meer spricht: \"Sie ist nicht bei mir\".
Hiob_Hi_18_28_15_Man kann nicht Gold um sie geben noch Silber darwägen, sie zu bezahlen.
Hiob_Hi_18_28_16_Es gilt ihr nicht gleich ophirisch Gold oder köstlicher Onyx und Saphir.
Hiob_Hi_18_28_17_Gold und Glas kann man ihr nicht vergleichen noch um sie golden Kleinod wechseln.
Hiob_Hi_18_28_18_Korallen und Kristall achtet man gegen sie nicht. Die Weisheit ist höher zu wägen denn Perlen.
Hiob_Hi_18_28_19_Topaz aus dem Mohrenland wird ihr nicht gleich geschätzt, und das reinste Gold gilt ihr nicht gleich.
Hiob_Hi_18_28_20_Woher kommt denn die Weisheit? und wo ist die Stätte des Verstandes?
Hiob_Hi_18_28_21_Sie ist verhohlen vor den Augen aller Lebendigen, auch den Vögeln unter dem Himmel.
Hiob_Hi_18_28_22_Der Abgrund und der Tod sprechen: \"Wir haben mit unsern Ohren ihr Gerücht gehört.\"
Hiob_Hi_18_28_23_Gott weiß den Weg dazu und kennt ihre Stätte.
Hiob_Hi_18_28_24_Denn er sieht die Enden der Erde und schaut alles, was unter dem Himmel ist.
Hiob_Hi_18_28_25_Da er dem Winde sein Gewicht machte und setzte dem Wasser sein gewisses Maß;
Hiob_Hi_18_28_26_da er dem Regen ein Ziel machte und dem Blitz und Donner den Weg:
Hiob_Hi_18_28_27_da sah er sie und verkündigte sie, bereitete sie und ergründete sie
Hiob_Hi_18_28_28_und sprach zu den Menschen: Siehe, die Furcht des HERRN, das ist Weisheit; und meiden das Böse, das ist Verstand.
Hiob_Hi_18_29_1_Und Hiob hob abermals an seine Sprüche und sprach:
Hiob_Hi_18_29_2_O daß ich wäre wie in den vorigen Monden, in den Tagen, da mich Gott behütete;
Hiob_Hi_18_29_3_da seine Leuchte über meinem Haupt schien und ich bei seinem Licht in der Finsternis ging;
Hiob_Hi_18_29_4_wie war ich in der Reife meines Lebens, da Gottes Geheimnis über meiner Hütte war;
Hiob_Hi_18_29_5_da der Allmächtige noch mit mir war und meine Kinder um mich her;
Hiob_Hi_18_29_6_da ich meine Tritte wusch in Butter und die Felsen mir Ölbäche gossen;
Hiob_Hi_18_29_7_da ich ausging zum Tor in der Stadt und mir ließ meinen Stuhl auf der Gasse bereiten;
Hiob_Hi_18_29_8_da mich die Jungen sahen und sich versteckten, und die Alten vor mir aufstanden;
Hiob_Hi_18_29_9_da die Obersten aufhörten zu reden und legten ihre Hand auf ihren Mund;
Hiob_Hi_18_29_10_da die Stimme der Fürsten sich verkroch und ihre Zunge am Gaumen klebte!
Hiob_Hi_18_29_11_Denn wessen Ohr mich hörte, der pries mich selig; und wessen Auge mich sah, der rühmte mich.
Hiob_Hi_18_29_12_Denn ich errettete den Armen, der da schrie, und den Waisen, der keinen Helfer hatte.
Hiob_Hi_18_29_13_Der Segen des, der verderben sollte, kam über mich; und ich erfreute das Herz der Witwe.
Hiob_Hi_18_29_14_Gerechtigkeit war mein Kleid, das ich anzog wie einen Rock; und mein Recht war mein fürstlicher Hut.
Hiob_Hi_18_29_15_Ich war des Blinden Auge und des Lahmen Fuß.
Hiob_Hi_18_29_16_Ich war ein Vater der Armen; und die Sache des, den ich nicht kannte, die erforschte ich.
Hiob_Hi_18_29_17_Ich zerbrach die Backenzähne des Ungerechten und riß den Raub aus seinen Zähnen.
Hiob_Hi_18_29_18_Ich gedachte: \"Ich will in meinem Nest ersterben und meiner Tage viel machen wie Sand.\"
Hiob_Hi_18_29_19_Meine Wurzel war aufgetan dem Wasser, und der Tau blieb über meinen Zweigen.
Hiob_Hi_18_29_20_Meine Herrlichkeit erneute sich immer an mir, und mein Bogen ward immer stärker in meiner Hand.
Hiob_Hi_18_29_21_Sie hörten mir zu und schwiegen und warteten auf meinen Rat.
Hiob_Hi_18_29_22_Nach meinen Worten redete niemand mehr, und meine Rede troff auf sie.
Hiob_Hi_18_29_23_Sie warteten auf mich wie auf den Regen und sperrten ihren Mund auf als nach dem Spätregen.
Hiob_Hi_18_29_24_Wenn ich mit ihnen lachte, wurden sie nicht zu kühn darauf; und das Licht meines Angesichts machte mich nicht geringer.
Hiob_Hi_18_29_25_Wenn ich zu ihrem Geschäft wollte kommen, so mußte ich obenan sitzen und wohnte wie ein König unter Kriegsknechten, da ich tröstete, die Leid trugen.
Hiob_Hi_18_30_1_Nun aber lachen sie mein, die jünger sind denn ich, deren Väter ich verachtet hätte, sie zu stellen unter meine Schafhunde;
Hiob_Hi_18_30_2_deren Vermögen ich für nichts hielt; die nicht zum Alter kommen konnten;
Hiob_Hi_18_30_3_die vor Hunger und Kummer einsam flohen in die Einöde, neulich verdarben und elend wurden;
Hiob_Hi_18_30_4_die da Nesseln ausraufen um die Büsche, und Ginsterwurzel ist ihre Speise;
Hiob_Hi_18_30_5_aus der Menschen Mitte werden sie weggetrieben, man schreit über sie wie über einen Dieb;
Hiob_Hi_18_30_6_in grausigen Tälern wohnen sie, in den Löchern der Erde und Steinritzen;
Hiob_Hi_18_30_7_zwischen den Büschen rufen sie, und unter den Disteln sammeln sie sich:
Hiob_Hi_18_30_8_die Kinder gottloser und verachteter Leute, die man aus dem Lande weggetrieben.
Hiob_Hi_18_30_9_Nun bin ich ihr Spottlied geworden und muß ihr Märlein sein.
Hiob_Hi_18_30_10_Sie haben einen Greuel an mir und machen sich ferne von mir und scheuen sich nicht, vor meinem Angesicht zu speien.
Hiob_Hi_18_30_11_Sie haben ihr Seil gelöst und mich zunichte gemacht und ihren Zaum vor mir abgetan.
Hiob_Hi_18_30_12_Zur Rechten haben sich Buben wider mich gesetzt und haben meinen Fuß ausgestoßen und haben wider mich einen Weg gemacht, mich zu verderben.
Hiob_Hi_18_30_13_Sie haben meine Steige zerbrochen; es war ihnen so leicht, mich zu beschädigen, daß sie keiner Hilfe dazu bedurften.
Hiob_Hi_18_30_14_Sie sind gekommen wie zu einer weiten Lücke der Mauer herein und sind ohne Ordnung dahergefallen.
Hiob_Hi_18_30_15_Schrecken hat sich gegen mich gekehrt und hat verfolgt wie der Wind meine Herrlichkeit; und wie eine Wolke zog vorüber mein glückseliger Stand.
Hiob_Hi_18_30_16_Nun aber gießt sich aus meine Seele über mich, und mich hat ergriffen die elende Zeit.
Hiob_Hi_18_30_17_Des Nachts wird mein Gebein durchbohrt allenthalben; und die mich nagen, legen sich nicht schlafen.
Hiob_Hi_18_30_18_Mit großer Gewalt werde ich anders und anders gekleidet, und ich werde damit umgürtet wie mit einem Rock.
Hiob_Hi_18_30_19_Man hat mich in den Kot getreten und gleich geachtet dem Staub und der Asche.
Hiob_Hi_18_30_20_Schreie ich zu dir, so antwortest du mir nicht; trete ich hervor, so achtest du nicht auf mich.
Hiob_Hi_18_30_21_Du hast mich verwandelt in einen Grausamen und zeigst an mit der Stärke deiner Hand, daß du mir gram bist.
Hiob_Hi_18_30_22_Du hebst mich auf und lässest mich auf dem Winde fahren und zerschmelzest mich kräftig.
Hiob_Hi_18_30_23_Denn ich weiß du wirst mich dem Tod überantworten; da ist das bestimmte Haus aller Lebendigen.
Hiob_Hi_18_30_24_Aber wird einer nicht die Hand ausstrecken unter Trümmern und nicht schreien vor seinem Verderben?
Hiob_Hi_18_30_25_Ich weinte ja über den, der harte Zeit hatte; und meine Seele jammerte der Armen.
Hiob_Hi_18_30_26_Ich wartete des Guten, und es kommt das Böse; ich hoffte aufs Licht, und es kommt Finsternis.
Hiob_Hi_18_30_27_Meine Eingeweide sieden und hören nicht auf; mich hat überfallen die elende Zeit.
Hiob_Hi_18_30_28_Ich gehe schwarz einher, und brennt mich doch die Sonne nicht; ich stehe auf in der Gemeinde und schreie.
Hiob_Hi_18_30_29_Ich bin ein Bruder der Schakale und ein Geselle der Strauße.
Hiob_Hi_18_30_30_Meine Haut über mir ist schwarz geworden, und meine Gebeine sind verdorrt vor Hitze.
Hiob_Hi_18_30_31_Meine Harfe ist eine Klage geworden und meine Flöte ein Weinen.
