Hiob_Hi_18_10_12_Leben und Wohltat hast du an mir getan, und dein Aufsehen bewahrt meinen Odem.
Hiob_Hi_18_10_13_Aber dies verbargst du in deinem Herzen, ich weiß, daß du solches im Sinn hattest:
Hiob_Hi_18_10_14_wenn ich sündigte, so wolltest du es bald merken und meine Missetat nicht ungestraft lassen.
Hiob_Hi_18_10_15_Bin ich gottlos, dann wehe mir! bin ich gerecht, so darf ich doch mein Haupt nicht aufheben, als der ich voll Schmach bin und sehe mein Elend.
Hiob_Hi_18_10_16_Und wenn ich es aufrichte, so jagst du mich wie ein Löwe und handelst wiederum wunderbar an mir.
Hiob_Hi_18_10_17_Du erneuest deine Zeugen wider mich und machst deines Zornes viel auf mich; es zerplagt mich eins über das andere in Haufen.
Hiob_Hi_18_10_18_Warum hast du mich aus Mutterleib kommen lassen? Ach, daß ich wäre umgekommen und mich nie ein Auge gesehen hätte!
Hiob_Hi_18_10_19_So wäre ich, als die nie gewesen sind, von Mutterleibe zum Grabe gebracht.
Hiob_Hi_18_10_20_Ist denn mein Leben nicht kurz? So höre er auf und lasse ab von mir, daß ich ein wenig erquickt werde,
Hiob_Hi_18_10_21_ehe ich denn hingehe und komme nicht wieder, ins Land der Finsternis und des Dunkels,
Hiob_Hi_18_10_22_ins Land da es stockfinster ist und da keine Ordnung ist, und wenn's hell wird, so ist es wie Finsternis.
Hiob_Hi_18_11_1_Da antwortete Zophar von Naema und sprach:
Hiob_Hi_18_11_2_Wenn einer lang geredet, muß er nicht auch hören? Muß denn ein Schwätzer immer recht haben?
Hiob_Hi_18_11_3_Müssen die Leute zu deinem eitlen Geschwätz schweigen, daß du spottest und niemand dich beschäme?
Hiob_Hi_18_11_4_Du sprichst: Meine Rede ist rein, und lauter bin ich vor deinen Augen.
Hiob_Hi_18_11_5_Ach, daß Gott mit dir redete und täte seine Lippen auf
Hiob_Hi_18_11_6_und zeigte dir die heimliche Weisheit! Denn er hätte noch wohl mehr an dir zu tun, auf daß du wissest, daß er deiner Sünden nicht aller gedenkt.
Hiob_Hi_18_11_7_Meinst du, daß du wissest, was Gott weiß, und wollest es so vollkommen treffen wie der Allmächtige?
Hiob_Hi_18_11_8_Es ist höher denn der Himmel; was willst du tun? tiefer denn die Hölle; was kannst du wissen?
Hiob_Hi_18_11_9_länger denn die Erde und breiter denn das Meer.
Hiob_Hi_18_11_10_So er daherfährt und gefangen legt und Gericht hält, wer will's ihm wehren?
Hiob_Hi_18_11_11_Denn er kennt die losen Leute, er sieht die Untugend, und sollte es nicht merken?
Hiob_Hi_18_11_12_Ein unnützer Mann bläht sich, und ein geborener Mensch will sein wie ein junges Wild.
Hiob_Hi_18_11_13_Wenn du dein Herz richtetest und deine Hände zu ihm ausbreitetest;
Hiob_Hi_18_11_14_wenn du die Untugend, die in deiner Hand ist, fern von dir tätest, daß in deiner Hütte kein Unrecht bliebe:
Hiob_Hi_18_11_15_so möchtest du dein Antlitz aufheben ohne Tadel und würdest fest sein und dich nicht fürchten.
Hiob_Hi_18_11_16_Dann würdest du der Mühsal vergessen und so wenig gedenken als des Wassers, das vorübergeht;
Hiob_Hi_18_11_17_und die Zeit deines Lebens würde aufgehen wie der Mittag, und das Finstere würde ein lichter Morgen werden;
Hiob_Hi_18_11_18_und dürftest dich dessen trösten, daß Hoffnung da sei; würdest dich umsehen und in Sicherheit schlafen legen;
Hiob_Hi_18_11_19_würdest ruhen, und niemand würde dich aufschrecken; und viele würden vor dir flehen.
Hiob_Hi_18_11_20_Aber die Augen der Gottlosen werden verschmachten, und sie werden nicht entrinnen können; denn Hoffnung wird ihrer Seele fehlen.
Hiob_Hi_18_12_1_Da antwortete Hiob und sprach:
Hiob_Hi_18_12_2_Ja, ihr seid die Leute, mit euch wird die Weisheit sterben!
Hiob_Hi_18_12_3_Ich habe so wohl ein Herz als ihr und bin nicht geringer denn ihr; und wer ist, der solches nicht wisse?
Hiob_Hi_18_12_4_Ich muß von meinem Nächsten verlacht sein, der ich Gott anrief, und er erhörte mich. Der Gerechte und Fromme muß verlacht sein
Hiob_Hi_18_12_5_und ist ein verachtet Lichtlein vor den Gedanken der Stolzen, steht aber, daß sie sich daran ärgern.
Hiob_Hi_18_12_6_Der Verstörer Hütten haben die Fülle, und Ruhe haben, die wider Gott toben, die ihren Gott in der Faust führen.
Hiob_Hi_18_12_7_Frage doch das Vieh, das wird dich's lehren und die Vögel unter dem Himmel, die werden dir's sagen;
Hiob_Hi_18_12_8_oder rede mit der Erde, die wird dich's lehren, und die Fische im Meer werden dir's erzählen.
Hiob_Hi_18_12_9_Wer erkennte nicht an dem allem, daß des HERRN Hand solches gemacht hat?
Hiob_Hi_18_12_10_daß in seiner Hand ist die Seele alles dessen, was da lebt, und der Geist des Fleisches aller Menschen?
Hiob_Hi_18_12_11_Prüft nicht das Ohr die Rede? und der Mund schmeckt die Speise?
Hiob_Hi_18_12_12_Ja, \"bei den Großvätern ist die Weisheit, und der Verstand bei den Alten\".
Hiob_Hi_18_12_13_Bei ihm ist Weisheit und Gewalt, Rat und Verstand.
Hiob_Hi_18_12_14_Siehe, wenn er zerbricht, so hilft kein Bauen; wenn er jemand einschließt, kann niemand aufmachen.
Hiob_Hi_18_12_15_Siehe, wenn er das Wasser verschließt, so wird alles dürr; und wenn er's ausläßt, so kehrt es das Land um.
Hiob_Hi_18_12_16_Er ist stark und führt es aus. Sein ist, der da irrt und der da verführt.
Hiob_Hi_18_12_17_Er führt die Klugen wie einen Raub und macht die Richter toll.
Hiob_Hi_18_12_18_Er löst auf der Könige Zwang und bindet mit einem Gurt ihre Lenden.
Hiob_Hi_18_12_19_Er führt die Priester wie einen Raub und bringt zu Fall die Festen.
Hiob_Hi_18_12_20_Er entzieht die Sprache den Bewährten und nimmt weg den Verstand der Alten.
Hiob_Hi_18_12_21_Er schüttet Verachtung auf die Fürsten und macht den Gürtel der Gewaltigen los.
Hiob_Hi_18_12_22_Er öffnet die finsteren Gründe und bringt heraus das Dunkel an das Licht.
Hiob_Hi_18_12_23_Er macht etliche zu großem Volk und bringt sie wieder um. Er breitet ein Volk aus und treibt es wieder weg.
Hiob_Hi_18_12_24_Er nimmt weg den Mut der Obersten des Volkes im Lande und macht sie irre auf einem Umwege, da kein Weg ist,
Hiob_Hi_18_12_25_daß sie in Finsternis tappen ohne Licht; und macht sie irre wie die Trunkenen.
Hiob_Hi_18_13_1_Siehe, das alles hat mein Auge gesehen und mein Ohr gehört, und ich habe es verstanden.
Hiob_Hi_18_13_2_Was ihr wißt, das weiß ich auch; und bin nicht geringer denn ihr.
Hiob_Hi_18_13_3_Doch wollte ich gern zu dem Allmächtigen reden und wollte gern mit Gott rechten.
Hiob_Hi_18_13_4_Aber ihr deutet's fälschlich und seid alle unnütze Ärzte.
Hiob_Hi_18_13_5_Wollte Gott, ihr schwieget, so wäret ihr weise.
Hiob_Hi_18_13_6_Höret doch meine Verantwortung und merket auf die Sache, davon ich rede!
Hiob_Hi_18_13_7_Wollt ihr Gott verteidigen mit Unrecht und für ihn List brauchen?
Hiob_Hi_18_13_8_Wollt ihr seine Person ansehen? Wollt ihr Gott vertreten?
Hiob_Hi_18_13_9_Wird's euch auch wohl gehen, wenn er euch richten wird? Meint ihr, daß ihr ihn täuschen werdet, wie man einen Menschen täuscht?
Hiob_Hi_18_13_10_Er wird euch strafen, wo ihr heimlich Person ansehet.
Hiob_Hi_18_13_11_Wird er euch nicht erschrecken, wenn er sich wird hervortun, und wird seine Furcht nicht über euch fallen?
Hiob_Hi_18_13_12_Eure Denksprüche sind Aschensprüche; eure Bollwerke werden wie Lehmhaufen sein.
Hiob_Hi_18_13_13_Schweiget mir, daß ich rede, es komme über mich, was da will.
Hiob_Hi_18_13_14_Was soll ich mein Fleisch mit meinen Zähnen davontragen und meine Seele in meine Hände legen?
Hiob_Hi_18_13_15_Siehe, er wird mich doch erwürgen, und ich habe nichts zu hoffen; doch will ich meine Wege vor ihm verantworten.
Hiob_Hi_18_13_16_Er wird ja mein Heil sein; denn es kommt kein Heuchler vor ihn.
Hiob_Hi_18_13_17_Höret meine Rede, und meine Auslegung gehe ein zu euren Ohren.
Hiob_Hi_18_13_18_Siehe, ich bin zum Rechtsstreit gerüstet; ich weiß, daß ich recht behalten werde.
Hiob_Hi_18_13_19_Wer ist, der mit mir rechten könnte? Denn dann wollte ich schweigen und verscheiden.
Hiob_Hi_18_13_20_Zweierlei tue mir nur nicht, so will ich mich vor dir verbergen:
Hiob_Hi_18_13_21_laß deine Hand fern von mir sein, und dein Schrecken erschrecke mich nicht!
Hiob_Hi_18_13_22_Dann rufe, ich will antworten, oder ich will reden, antworte du mir!
Hiob_Hi_18_13_23_Wie viel ist meiner Missetaten und Sünden? Laß mich wissen meine Übertretung und Sünde.
Hiob_Hi_18_13_24_Warum verbirgst du dein Antlitz und hältst mich für deinen Feind?
Hiob_Hi_18_13_25_Willst du wider ein fliegend Blatt so ernst sein und einen dürren Halm verfolgen?
Hiob_Hi_18_13_26_Denn du schreibst mir Betrübnis an und willst über mich bringen die Sünden meiner Jugend.
Hiob_Hi_18_13_27_Du hast meinen Fuß in den Stock gelegt und hast acht auf alle meine Pfade und siehst auf die Fußtapfen meiner Füße,
Hiob_Hi_18_13_28_der ich doch wie Moder vergehe und wie ein Kleid, das die Motten fressen.
Hiob_Hi_18_14_1_Der Mensch, vom Weibe geboren, lebt kurze Zeit und ist voll Unruhe,
Hiob_Hi_18_14_2_geht auf wie eine Blume und fällt ab, flieht wie ein Schatten und bleibt nicht.
Hiob_Hi_18_14_3_Und du tust deine Augen über einen solchen auf, daß du mich vor dir ins Gericht ziehest.
Hiob_Hi_18_14_4_Kann wohl ein Reiner kommen von den Unreinen? Auch nicht einer.
Hiob_Hi_18_14_5_Er hat seine bestimmte Zeit, die Zahl seiner Monden steht bei dir; du hast ein Ziel gesetzt, das wird er nicht überschreiten.
Hiob_Hi_18_14_6_So tu dich von ihm, daß er Ruhe habe, bis daß seine Zeit komme, deren er wie ein Tagelöhner wartet.
Hiob_Hi_18_14_7_Ein Baum hat Hoffnung, wenn er schon abgehauen ist, daß er sich wieder erneue, und seine Schößlinge hören nicht auf.
Hiob_Hi_18_14_8_Ob seine Wurzel in der Erde veraltet und sein Stamm im Staub erstirbt,
Hiob_Hi_18_14_9_so grünt er doch wieder vom Geruch des Wassers und wächst daher, als wäre er erst gepflanzt.
Hiob_Hi_18_14_10_Aber der Mensch stirbt und ist dahin; er verscheidet, und wo ist er?
Hiob_Hi_18_14_11_Wie ein Wasser ausläuft aus dem See, und wie ein Strom versiegt und vertrocknet,
Hiob_Hi_18_14_12_so ist ein Mensch, wenn er sich legt, und wird nicht aufstehen und wird nicht aufwachen, solange der Himmel bleibt, noch von seinem Schlaf erweckt werden.
Hiob_Hi_18_14_13_Ach daß du mich in der Hölle verdecktest und verbärgest, bis dein Zorn sich lege, und setztest mir ein Ziel, daß du an mich dächtest.
Hiob_Hi_18_14_14_Wird ein toter Mensch wieder leben? Alle Tage meines Streites wollte ich harren, bis daß meine Veränderung komme!
Hiob_Hi_18_14_15_Du würdest rufen und ich dir antworten; es würde dich verlangen nach dem Werk deiner Hände.
Hiob_Hi_18_14_16_Jetzt aber zählst du meine Gänge. Hast du nicht acht auf meine Sünden?
Hiob_Hi_18_14_17_Du hast meine Übertretungen in ein Bündlein versiegelt und meine Missetat zusammengefaßt.
Hiob_Hi_18_14_18_Zerfällt doch ein Berg und vergeht, und ein Fels wird von seinem Ort versetzt;
Hiob_Hi_18_14_19_Wasser wäscht Steine weg, und seine Fluten flößen die Erde weg: aber des Menschen Hoffnung ist verloren;
Hiob_Hi_18_14_20_denn du stößest ihn gar um, daß er dahinfährt, veränderst sein Wesen und lässest ihn fahren.
Hiob_Hi_18_14_21_Sind seine Kinder in Ehren, das weiß er nicht; oder ob sie gering sind, des wird er nicht gewahr.
Hiob_Hi_18_14_22_Nur sein eigen Fleisch macht ihm Schmerzen, und seine Seele ist ihm voll Leides.
Hiob_Hi_18_15_1_Da antwortete Eliphas von Theman und sprach:
Hiob_Hi_18_15_2_Soll ein weiser Mann so aufgeblasene Worte reden und seinen Bauch so blähen mit leeren Reden?
Hiob_Hi_18_15_3_Du verantwortest dich mit Worten, die nicht taugen, und dein Reden ist nichts nütze.
Hiob_Hi_18_15_4_Du hast die Furcht fahren lassen und redest verächtlich vor Gott.
Hiob_Hi_18_15_5_Denn deine Missetat lehrt deinen Mund also, und hast erwählt eine listige Zunge.
Hiob_Hi_18_15_6_Dein Mund verdammt dich, und nicht ich; deine Lippen zeugen gegen dich.
Hiob_Hi_18_15_7_Bist du der erste Mensch geboren? bist du vor allen Hügeln empfangen?
Hiob_Hi_18_15_8_Hast du Gottes heimlichen Rat gehört und die Weisheit an dich gerissen?
Hiob_Hi_18_15_9_Was weißt du, das wir nicht wissen? was verstehst du, das nicht bei uns sei?
Hiob_Hi_18_15_10_Es sind Graue und Alte unter uns, die länger gelebt haben denn dein Vater.
Hiob_Hi_18_15_11_Sollten Gottes Tröstungen so gering vor dir gelten und ein Wort, in Lindigkeit zu dir gesprochen?
Hiob_Hi_18_15_12_Was nimmt dein Herz vor? was siehst du so stolz?
Hiob_Hi_18_15_13_Was setzt sich dein Mut gegen Gott, daß du solche Reden aus deinem Munde lässest?
Hiob_Hi_18_15_14_Was ist ein Mensch, daß er sollte rein sein, und daß er sollte gerecht sein, der von einem Weibe geboren ist?
Hiob_Hi_18_15_15_Siehe, unter seinen Heiligen ist keiner ohne Tadel, und die im Himmel sind nicht rein vor ihm.
Hiob_Hi_18_15_16_Wie viel weniger ein Mensch, der ein Greuel und schnöde ist, der Unrecht säuft wie Wasser.
Hiob_Hi_18_15_17_Ich will dir's zeigen, höre mir zu, und ich will dir erzählen, was ich gesehen habe,
Hiob_Hi_18_15_18_was die Weisen gesagt haben und ihren Vätern nicht verhohlen gewesen ist,
Hiob_Hi_18_15_19_welchen allein das Land gegeben war, daß kein Fremder durch sie gehen durfte:
Hiob_Hi_18_15_20_\"Der Gottlose bebt sein Leben lang, und dem Tyrannen ist die Zahl seiner Jahre verborgen.
Hiob_Hi_18_15_21_Was er hört, das schreckt ihn; und wenn's gleich Friede ist, fürchtet er sich, der Verderber komme,
Hiob_Hi_18_15_22_glaubt nicht, daß er möge dem Unglück entrinnen, und versieht sich immer des Schwerts.
Hiob_Hi_18_15_23_Er zieht hin und her nach Brot, und es dünkt ihn immer, die Zeit seines Unglücks sei vorhanden.
Hiob_Hi_18_15_24_Angst und Not schrecken ihn und schlagen ihn nieder wie ein König mit seinem Heer.
Hiob_Hi_18_15_25_Denn er hat seine Hand wider Gott gestreckt und sich wider den Allmächtigen gesträubt.
Hiob_Hi_18_15_26_Er läuft mit dem Kopf an ihn und ficht halsstarrig wider ihn.
Hiob_Hi_18_15_27_Er brüstet sich wie ein fetter Wanst und macht sich feist und dick.
Hiob_Hi_18_15_28_Er wohnt in verstörten Städten, in Häusern, da man nicht bleiben darf, die auf einem Haufen liegen sollen.
Hiob_Hi_18_15_29_Er wird nicht reich bleiben, und sein Gut wird nicht bestehen, und sein Glück wird sich nicht ausbreiten im Lande.
Hiob_Hi_18_15_30_Unfall wird nicht von ihm lassen. Die Flamme wird seine Zweige verdorren, und er wird ihn durch den Odem seines Mundes wegnehmen.
Hiob_Hi_18_15_31_Er wird nicht bestehen, denn er ist in seinem eiteln Dünkel betrogen; und eitel wird sein Lohn werden.
Hiob_Hi_18_15_32_Er wird ein Ende nehmen vor der Zeit; und sein Zweig wird nicht grünen.
Hiob_Hi_18_15_33_Er wird abgerissen werden wie eine unzeitige Traube vom Weinstock, und wie ein Ölbaum seine Blüte abwirft.
Hiob_Hi_18_15_34_Denn der Heuchler Versammlung wird einsam bleiben; und das Feuer wird fressen die Hütten derer, die Geschenke nehmen.
Hiob_Hi_18_15_35_Sie gehen schwanger mit Unglück und gebären Mühsal, und ihr Schoß bringt Trug.\"
Hiob_Hi_18_16_1_Hiob antwortete und sprach:
Hiob_Hi_18_16_2_Ich habe solches oft gehört. Ihr seid allzumal leidige Tröster!
Hiob_Hi_18_16_3_Wollen die leeren Worte kein Ende haben? Oder was macht dich so frech, also zu reden?
Hiob_Hi_18_16_4_Ich könnte auch wohl reden wie ihr. Wäre eure Seele an meiner Statt, so wollte ich auch Worte gegen euch zusammenbringen und mein Haupt also über euch schütteln.
Hiob_Hi_18_16_5_Ich wollte euch stärken mit dem Munde und mit meinen Lippen trösten.
Hiob_Hi_18_16_6_Aber wenn ich schon rede, so schont mein der Schmerz nicht; lasse ich's anstehen so geht er nicht von mir.
Hiob_Hi_18_16_7_Nun aber macht er mich müde und verstört alles, was ich bin.
Hiob_Hi_18_16_8_Er hat mich runzlig gemacht, das zeugt wider mich; und mein Elend steht gegen mich auf und verklagt mich ins Angesicht.
Hiob_Hi_18_16_9_Sein Grimm zerreißt, und der mir gram ist, beißt die Zähne über mich zusammen; mein Widersacher funkelt mit seinen Augen auf mich.
Hiob_Hi_18_16_10_Sie haben ihren Mund aufgesperrt gegen mich und haben mich schmählich auf meine Backen geschlagen; sie haben ihren Mut miteinander an mir gekühlt.
Hiob_Hi_18_16_11_Gott hat mich übergeben dem Ungerechten und hat mich in der Gottlosen Hände kommen lassen.
Hiob_Hi_18_16_12_Ich war in Frieden, aber er hat mich zunichte gemacht; er hat mich beim Hals genommen und zerstoßen und hat mich zum Ziel aufgerichtet.
Hiob_Hi_18_16_13_Er hat mich umgeben mit seinen Schützen; er hat meine Nieren gespalten und nicht verschont; er hat meine Galle auf die Erde geschüttet.
Hiob_Hi_18_16_14_Er hat mir eine Wunde über die andere gemacht; er ist an mich gelaufen wie ein Gewaltiger.
Hiob_Hi_18_16_15_Ich habe einen Sack um meine Haut genäht und habe mein Horn in den Staub gelegt.
Hiob_Hi_18_16_16_Mein Antlitz ist geschwollen von Weinen, und meine Augenlider sind verdunkelt,
Hiob_Hi_18_16_17_wiewohl kein Frevel in meiner Hand ist und mein Gebet ist rein.
Hiob_Hi_18_16_18_Ach Erde, bedecke mein Blut nicht! und mein Geschrei finde keine Ruhestätte!
Hiob_Hi_18_16_19_Auch siehe da, meine Zunge ist mein Himmel; und der mich kennt, ist in der Höhe.
Hiob_Hi_18_16_20_Meine Freunde sind meine Spötter; aber mein Auge tränt zu Gott,
Hiob_Hi_18_16_21_daß er entscheiden möge zwischen dem Mann und Gott, zwischen dem Menschenkind und seinem Freunde.
Hiob_Hi_18_16_22_Denn die bestimmten Jahre sind gekommen, und ich gehe hin des Weges, den ich nicht wiederkommen werde.
Hiob_Hi_18_17_1_Mein Odem ist schwach, und meine Tage sind abgekürzt; das Grab ist da.
Hiob_Hi_18_17_2_Fürwahr, Gespött umgibt mich, und auf ihrem Hadern muß mein Auge weilen.
Hiob_Hi_18_17_3_Sei du selber mein Bürge bei dir; wer will mich sonst vertreten?
Hiob_Hi_18_17_4_Denn du hast ihrem Herzen den Verstand verborgen; darum wirst du ihnen den Sieg geben.
Hiob_Hi_18_17_5_Es rühmt wohl einer seinen Freunden die Ausbeute; aber seiner Kinder Augen werden verschmachten.
Hiob_Hi_18_17_6_Er hat mich zum Sprichwort unter den Leuten gemacht, und ich muß mir ins Angesicht speien lassen.
Hiob_Hi_18_17_7_Mein Auge ist dunkel geworden vor Trauern, und alle meine Glieder sind wie ein Schatten.
Hiob_Hi_18_17_8_Darüber werden die Gerechten sich entsetzen, und die Unschuldigen werden sich entrüsten gegen die Heuchler.
Hiob_Hi_18_17_9_Aber der Gerechte wird seinen Weg behalten; und wer reine Hände hat, wird an Stärke zunehmen.
Hiob_Hi_18_17_10_Wohlan, so kehrt euch alle her und kommt; ich werde doch keinen Weisen unter euch finden.
Hiob_Hi_18_17_11_Meine Tage sind vergangen; meine Anschläge sind zerrissen, die mein Herz besessen haben.
Hiob_Hi_18_17_12_Sie wollen aus der Nacht Tag machen und aus dem Tage Nacht.
Hiob_Hi_18_17_13_Wenn ich gleich lange harre, so ist doch bei den Toten mein Haus, und in der Finsternis ist mein Bett gemacht;
Hiob_Hi_18_17_14_Die Verwesung heiße ich meinen Vater und die Würmer meine Mutter und meine Schwester:
Hiob_Hi_18_17_15_was soll ich denn harren? und wer achtet mein Hoffen?
Hiob_Hi_18_17_16_Hinunter zu den Toten wird es fahren und wird mit mir in dem Staub liegen.
Hiob_Hi_18_18_1_Da antwortete Bildad von Suah und sprach:
Hiob_Hi_18_18_2_Wann wollt ihr der Reden ein Ende machen? Merkt doch; darnach wollen wir reden.
Hiob_Hi_18_18_3_Warum werden wir geachtet wie Vieh und sind so unrein vor euren Augen?
Hiob_Hi_18_18_4_Willst du vor Zorn bersten? Meinst du, daß um deinetwillen die Erde verlassen werde und der Fels von seinem Ort versetzt werde?
Hiob_Hi_18_18_5_Und doch wird das Licht der Gottlosen verlöschen, und der Funke seines Feuers wird nicht leuchten.
Hiob_Hi_18_18_6_Das Licht wird finster werden in seiner Hütte, und seine Leuchte über ihm verlöschen.
Hiob_Hi_18_18_7_Seine kräftigen Schritte werden in die Enge kommen, und sein Anschlag wird ihn fällen.
Hiob_Hi_18_18_8_Denn er ist mit seinen Füßen in den Strick gebracht und wandelt im Netz.
Hiob_Hi_18_18_9_Der Strick wird seine Ferse halten, und die Schlinge wird ihn erhaschen.
Hiob_Hi_18_18_10_Sein Strick ist gelegt in die Erde, und seine Falle auf seinem Gang.
Hiob_Hi_18_18_11_Um und um wird ihn schrecken plötzliche Furcht, daß er nicht weiß, wo er hinaus soll.
Hiob_Hi_18_18_12_Hunger wird seine Habe sein, und Unglück wird ihm bereit sein und anhangen.
Hiob_Hi_18_18_13_Die Glieder seines Leibes werden verzehrt werden; seine Glieder wird verzehren der Erstgeborene des Todes.
Hiob_Hi_18_18_14_Seine Hoffnung wird aus seiner Hütte ausgerottet werden, und es wird ihn treiben zum König des Schreckens.
Hiob_Hi_18_18_15_In seiner Hütte wird nichts bleiben; über seine Stätte wird Schwefel gestreut werden.
Hiob_Hi_18_18_16_Von unten werden verdorren seine Wurzeln, und von oben abgeschnitten seine Zweige.
Hiob_Hi_18_18_17_Sein Gedächtnis wird vergehen in dem Lande, und er wird keinen Namen haben auf der Gasse.
Hiob_Hi_18_18_18_Er wird vom Licht in die Finsternis vertrieben und vom Erdboden verstoßen werden.
Hiob_Hi_18_18_19_Er wird keine Kinder haben und keine Enkel unter seinem Volk; es wird ihm keiner übrigbleiben in seinen Gütern.
Hiob_Hi_18_18_20_Die nach ihm kommen, werden sich über seinen Tag entsetzen; und die vor ihm sind, wird eine Furcht ankommen.
Hiob_Hi_18_18_21_Das ist die Wohnung des Ungerechten; und dies ist die Stätte des, der Gott nicht achtet.
Hiob_Hi_18_19_1_Hiob antwortete und sprach:
Hiob_Hi_18_19_2_Wie lange plagt ihr doch meine Seele und peinigt mich mit Worten?
Hiob_Hi_18_19_3_Ihr habt mich nun zehnmal gehöhnt und schämt euch nicht, daß ihr mich also umtreibt.
Hiob_Hi_18_19_4_Irre ich, so irre ich mir.
Hiob_Hi_18_19_5_Wollt ihr wahrlich euch über mich erheben und wollt meine Schmach mir beweisen,
Hiob_Hi_18_19_6_so merkt doch nun einmal, daß mir Gott Unrecht tut und hat mich mit seinem Jagdstrick umgeben.
Hiob_Hi_18_19_7_Siehe, ob ich schon schreie über Frevel, so werde ich doch nicht erhört; ich rufe, und ist kein Recht da.
Hiob_Hi_18_19_8_Er hat meinen Weg verzäunt, daß ich nicht kann hinübergehen, und hat Finsternis auf meinen Steig gestellt.
Hiob_Hi_18_19_9_Er hat meine Ehre mir ausgezogen und die Krone von meinem Haupt genommen.
Hiob_Hi_18_19_10_Er hat mich zerbrochen um und um und läßt mich gehen und hat ausgerissen meine Hoffnung wie einen Baum.
Hiob_Hi_18_19_11_Sein Zorn ist über mich ergrimmt, und er achtet mich für seinen Feind.
Hiob_Hi_18_19_12_Seine Kriegsscharen sind miteinander gekommen und haben ihren Weg gegen mich gebahnt und haben sich um meine Hütte her gelagert.
Hiob_Hi_18_19_13_Er hat meine Brüder fern von mir getan, und meine Verwandten sind mir fremd geworden.
Hiob_Hi_18_19_14_Meine Nächsten haben sich entzogen, und meine Freunde haben mein vergessen.
Hiob_Hi_18_19_15_Meine Hausgenossen und meine Mägde achten mich für fremd; ich bin unbekannt geworden vor ihren Augen.
Hiob_Hi_18_19_16_Ich rief meinen Knecht, und er antwortete mir nicht; ich mußte ihn anflehen mit eigenem Munde.
Hiob_Hi_18_19_17_Mein Odem ist zuwider meinem Weibe, und ich bin ein Ekel den Kindern meines Leibes.
Hiob_Hi_18_19_18_Auch die jungen Kinder geben nichts auf mich; wenn ich ihnen widerstehe, so geben sie mir böse Worte.
Hiob_Hi_18_19_19_Alle meine Getreuen haben einen Greuel an mir; und die ich liebhatte, haben sich auch gegen mich gekehrt.
Hiob_Hi_18_19_20_Mein Gebein hanget an mir an Haut und Fleisch, und ich kann meine Zähne mit der Haut nicht bedecken.
Hiob_Hi_18_19_21_Erbarmt euch mein, erbarmt euch mein, ihr meine Freunde! denn die Hand Gottes hat mich getroffen.
Hiob_Hi_18_19_22_Warum verfolgt ihr mich gleich wie Gott und könnt meines Fleisches nicht satt werden?
Hiob_Hi_18_19_23_Ach daß meine Reden geschrieben würden! ach daß sie in ein Buch gestellt würden!
Hiob_Hi_18_19_24_mit einem eisernen Griffel auf Blei und zum ewigem Gedächtnis in Stein gehauen würden!
Hiob_Hi_18_19_25_Aber ich weiß, daß mein Erlöser lebt; und als der letzte wird er über dem Staube sich erheben.
Hiob_Hi_18_19_26_Und nachdem diese meine Haut zerschlagen ist, werde ich ohne mein Fleisch Gott sehen.
Hiob_Hi_18_19_27_Denselben werde ich mir sehen, und meine Augen werden ihn schauen, und kein Fremder. Darnach sehnen sich meine Nieren in meinem Schoß.
Hiob_Hi_18_19_28_Wenn ihr sprecht: Wie wollen wir ihn verfolgen und eine Sache gegen ihn finden!
Hiob_Hi_18_19_29_so fürchtet euch vor dem Schwert; denn das Schwert ist der Zorn über die Missetaten, auf daß ihr wißt, daß ein Gericht sei.
Hiob_Hi_18_20_1_Da antwortete Zophar von Naema und sprach:
Hiob_Hi_18_20_2_Darauf muß ich antworten und kann nicht harren.
Hiob_Hi_18_20_3_Denn ich muß hören, wie man mich straft und tadelt; aber der Geist meines Verstandes soll für mich antworten.
Hiob_Hi_18_20_4_Weißt du nicht, daß es allezeit so gegangen ist, seitdem Menschen auf Erden gewesen sind:
Hiob_Hi_18_20_5_daß der Ruhm der Gottlosen steht nicht lange und die Freude des Heuchlers währt einen Augenblick?
Hiob_Hi_18_20_6_Wenngleich seine Höhe in den Himmel reicht und sein Haupt an die Wolken rührt,
Hiob_Hi_18_20_7_so wird er doch zuletzt umkommen wie Kot, daß die, welche ihn gesehen haben, werden sagen: Wo ist er?
Hiob_Hi_18_20_8_Wie ein Traum vergeht, so wird er auch nicht zu finden sein, und wie ein Gesicht in der Nacht verschwindet.
Hiob_Hi_18_20_9_Welch Auge ihn gesehen hat, wird ihn nicht mehr sehen; und seine Stätte wird ihn nicht mehr schauen.
Hiob_Hi_18_20_10_Seine Kinder werden betteln gehen, und seine Hände müssen seine Habe wieder hergeben.
Hiob_Hi_18_20_11_Seine Gebeine werden seine heimlichen Sünden wohl bezahlen, und sie werden sich mit ihm in die Erde legen.
Hiob_Hi_18_20_12_Wenn ihm die Bosheit in seinem Munde wohl schmeckt, daß er sie birgt unter seiner Zunge,
Hiob_Hi_18_20_13_daß er sie hegt und nicht losläßt und sie zurückhält in seinem Gaumen,
Hiob_Hi_18_20_14_so wird seine Speise inwendig im Leibe sich verwandeln in Otterngalle.
Hiob_Hi_18_20_15_Die Güter, die er verschlungen hat, muß er wieder ausspeien, und Gott wird sie aus seinem Bauch stoßen.
Hiob_Hi_18_20_16_Er wird der Ottern Gift saugen, und die Zunge der Schlange wird ihn töten.
