Hiob_Hi_18_42_1_Es war ein Mann im Lande Uz, der hieß Hiob. Derselbe war schlecht und recht, gottesfürchtig und mied das Böse.
Hiob_Hi_18_42_2_Und zeugte sieben Söhne und drei Töchter;
Hiob_Hi_18_42_3_und seines Viehs waren siebentausend Schafe, dreitausend Kamele, fünfhundert Joch Rinder und fünfhundert Eselinnen, und er hatte viel Gesinde; und er war herrlicher denn alle, die gegen Morgen wohnten.
Hiob_Hi_18_42_4_Und seine Söhne gingen und machten ein Mahl, ein jeglicher in seinem Hause auf seinen Tag, und sandten hin und luden ihre drei Schwestern, mit ihnen zu essen und zu trinken.
Hiob_Hi_18_42_5_Und wenn die Tage des Mahls um waren, sandte Hiob hin und heiligte sie und machte sich des Morgens früh auf und opferte Brandopfer nach ihrer aller Zahl; denn Hiob gedachte: Meine Söhne möchten gesündigt und Gott abgesagt haben in ihrem Herzen. Also tat Hiob allezeit.
Hiob_Hi_18_42_6_Es begab sich aber auf einen Tag, da die Kinder Gottes kamen und vor den HERRN traten, kam der Satan auch unter ihnen.
Hiob_Hi_18_42_7_Der HERR aber sprach zu dem Satan: Wo kommst du her? Satan antwortete dem HERRN und sprach: Ich habe das Land umher durchzogen.
Hiob_Hi_18_42_8_Der HERR sprach zu Satan: Hast du nicht achtgehabt auf meinen Knecht Hiob? Denn es ist seinesgleichen nicht im Lande, schlecht und recht, gottesfürchtig und meidet das Böse.
Hiob_Hi_18_42_9_Der Satan antwortete dem HERRN und sprach: Meinst du, daß Hiob umsonst Gott fürchtet?
Hiob_Hi_18_42_10_Hast du doch ihn, sein Haus und alles, was er hat, ringsumher verwahrt. Du hast das Werk seiner Hände gesegnet, und sein Gut hat sich ausgebreitet im Lande.
Hiob_Hi_18_42_11_Aber recke deine Hand aus und taste an alles, was er hat: was gilt's, er wird dir ins Angesicht absagen?
Hiob_Hi_18_42_12_Der HERR sprach zum Satan: Siehe, alles, was er hat, sei in deiner Hand; nur an ihn selbst lege deine Hand nicht. Da ging der Satan aus von dem HERRN.
Hiob_Hi_18_42_13_Des Tages aber, da seine Söhne und Töchter aßen und Wein tranken in ihres Bruders Hause, des Erstgeborenen,
Hiob_Hi_18_42_14_kam ein Bote zu Hiob und sprach: Die Rinder pflügten, und die Eselinnen gingen neben ihnen auf der Weide,
Hiob_Hi_18_42_15_da fielen die aus Saba herein und nahmen sie und schlugen die Knechte mit der Schärfe des Schwerts; und ich bin allein entronnen, daß ich dir's ansagte.
Hiob_Hi_18_42_16_Da er noch redete, kam ein anderer und sprach: Das Feuer Gottes fiel vom Himmel und verbrannte Schafe und Knechte und verzehrte sie; und ich bin allein entronnen, daß ich dir's ansagte.
Hiob_Hi_18_42_17_Da der noch redete, kam einer und sprach: Die Chaldäer machte drei Rotten und überfielen die Kamele und nahmen sie und schlugen die Knechte mit der Schärfe des Schwerts; und ich bin allein entronnen, daß ich dir's ansagte.
Hiob_Hi_18_42_18_Da der noch redete, kam einer und sprach: Deine Söhne und Töchter aßen und tranken im Hause ihres Bruders, des Erstgeborenen,
Hiob_Hi_18_42_19_Und siehe, da kam ein großer Wind von der Wüste her und stieß auf die vier Ecken des Hauses und warf's auf die jungen Leute, daß sie starben; und ich bin allein entronnen, daß ich dir's ansagte.
Hiob_Hi_18_42_20_Da stand Hiob auf und zerriß seine Kleider und raufte sein Haupt und fiel auf die Erde und betete an
Hiob_Hi_18_42_21_und sprach: Ich bin nackt von meiner Mutter Leibe gekommen, nackt werde ich wieder dahinfahren. Der HERR hat's gegeben, der HERR hat's genommen; der Name des HERRN sei gelobt.
Hiob_Hi_18_42_22_In diesem allem sündigte Hiob nicht und tat nichts Törichtes wider Gott.
Hiob_Hi_18_2_1_Es begab sich aber des Tages, da die Kinder Gottes kamen und traten vor den HERRN, daß der Satan auch unter ihnen kam und vor den HERRN trat.
Hiob_Hi_18_2_2_Da sprach der HERR zu dem Satan: Wo kommst du her? Der Satan antwortete dem HERRN und sprach: Ich habe das Land umher durchzogen.
Hiob_Hi_18_2_3_Der HERR sprach zu dem Satan: Hast du nicht acht auf meinen Knecht Hiob gehabt? Denn es ist seinesgleichen im Lande nicht, schlecht und recht, gottesfürchtig und meidet das Böse und hält noch fest an seiner Frömmigkeit; du aber hast mich bewogen, daß ich ihn ohne Ursache verderbt habe.
Hiob_Hi_18_2_4_Der Satan antwortete dem HERRN und sprach: Haut für Haut; und alles was ein Mann hat, läßt er für sein Leben.
Hiob_Hi_18_2_5_Aber recke deine Hand aus und taste sein Gebein und Fleisch an: was gilt's, er wird dir ins Angesicht absagen?
Hiob_Hi_18_2_6_Der HERR sprach zu dem Satan: Siehe da, er ist in deiner Hand; doch schone seines Lebens!
Hiob_Hi_18_2_7_Da fuhr der Satan aus vom Angesicht des HERRN und schlug Hiob mit bösen Schwären von der Fußsohle an bis auf seinen Scheitel.
Hiob_Hi_18_2_8_Und er nahm eine Scherbe und schabte sich und saß in der Asche.
Hiob_Hi_18_2_9_Und sein Weib sprach zu ihm: Hältst du noch fest an deiner Frömmigkeit? Ja, sage Gott ab und stirb!
Hiob_Hi_18_2_10_Er aber sprach zu ihr: Du redest, wie die närrischen Weiber reden. Haben wir Gutes empfangen von Gott und sollten das Böse nicht auch annehmen? In diesem allem versündigte sich Hiob nicht mit seinen Lippen.
Hiob_Hi_18_2_11_Da aber die drei Freunde Hiobs hörten all das Unglück, das über ihn gekommen war, kamen sie, ein jeglicher aus seinem Ort: Eliphas von Theman, Bildad von Suah und Zophar von Naema. Denn sie wurden eins, daß sie kämen, ihn zu beklagen und zu trösten.
Hiob_Hi_18_2_12_Und da sie ihre Augen aufhoben von ferne, kannten sie ihn nicht und hoben auf ihre Stimme und weinten, und ein jeglicher zerriß sein Kleid, und sie sprengten Erde auf ihr Haupt gen Himmel
Hiob_Hi_18_2_13_und saßen mit ihm auf der Erde sieben Tage und sieben Nächte und redeten nichts mit ihm; denn sie sahen, daß der Schmerz sehr groß war.
Hiob_Hi_18_3_1_Darnach tat Hiob seinen Mund auf und verfluchte seinen Tag.
Hiob_Hi_18_3_2_Und Hiob sprach:
Hiob_Hi_18_3_3_Der Tag müsse verloren sein, darin ich geboren bin, und die Nacht, welche sprach: Es ist ein Männlein empfangen!
Hiob_Hi_18_3_4_Derselbe Tag müsse finster sein, und Gott von obenherab müsse nicht nach ihm fragen; kein Glanz müsse über ihn scheinen!
Hiob_Hi_18_3_5_Finsternis und Dunkel müssen ihn überwältigen, und dicke Wolken müssen über ihm bleiben, und der Dampf am Tage mache ihn gräßlich!
Hiob_Hi_18_3_6_Die Nacht müsse Dunkel einnehmen; sie müsse sich nicht unter den Tagen des Jahres freuen noch in die Zahl der Monden kommen!
Hiob_Hi_18_3_7_Siehe, die Nacht müsse einsam sein und kein Jauchzen darin sein!
Hiob_Hi_18_3_8_Es müssen sie verfluchen die Verflucher des Tages und die da bereit sind, zu erregen den Leviathan!
Hiob_Hi_18_3_9_Ihre Sterne müssen finster sein in ihrer Dämmerung; sie hoffe aufs Licht, und es komme nicht, und müsse nicht sehen die Wimpern der Morgenröte,
Hiob_Hi_18_3_10_darum daß sie nicht verschlossen hat die Tür des Leibes meiner Mutter und nicht verborgen das Unglück vor meinen Augen!
Hiob_Hi_18_3_11_Warum bin ich nicht gestorben von Mutterleib an? Warum bin ich nicht verschieden, da ich aus dem Leibe kam?
Hiob_Hi_18_3_12_Warum hat man mich auf den Schoß gesetzt? Warum bin ich mit Brüsten gesäugt?
Hiob_Hi_18_3_13_So läge ich doch nun und wäre still, schliefe und hätte Ruhe
Hiob_Hi_18_3_14_mit den Königen und Ratsherren auf Erden, die das Wüste bauen,
Hiob_Hi_18_3_15_oder mit den Fürsten, die Gold haben und deren Häuser voll Silber sind.
Hiob_Hi_18_3_16_Oder wie eine unzeitige Geburt, die man verborgen hat, wäre ich gar nicht, wie Kinder, die das Licht nie gesehen haben.
Hiob_Hi_18_3_17_Daselbst müssen doch aufhören die Gottlosen mit Toben; daselbst ruhen doch, die viel Mühe gehabt haben.
Hiob_Hi_18_3_18_Da haben doch miteinander Frieden die Gefangenen und hören nicht die Stimme des Drängers.
Hiob_Hi_18_3_19_Da sind beide, klein und groß, und der Knecht ist frei von seinem Herrn.
Hiob_Hi_18_3_20_Warum ist das Licht gegeben dem Mühseligen und das Leben den betrübten Herzen
Hiob_Hi_18_3_21_(die des Todes warten, und er kommt nicht, und grüben ihn wohl aus dem Verborgenen,
Hiob_Hi_18_3_22_die sich sehr freuten und fröhlich wären, wenn sie ein Grab bekämen),
Hiob_Hi_18_3_23_dem Manne, dessen Weg verborgen ist und vor ihm von Gott verzäunt ward?
Hiob_Hi_18_3_24_Denn wenn ich essen soll, muß ich seufzen, und mein Heulen fährt heraus wie Wasser.
Hiob_Hi_18_3_25_Denn was ich gefürchtet habe ist über mich gekommen, und was ich sorgte, hat mich getroffen.
Hiob_Hi_18_3_26_War ich nicht glückselig? War ich nicht fein stille? Hatte ich nicht gute Ruhe? Und es kommt solche Unruhe!
Hiob_Hi_18_4_1_Da antwortete Eliphas von Theman und sprach:
Hiob_Hi_18_4_2_Du hast's vielleicht nicht gern, so man versucht, mit dir zu reden; aber wer kann sich's enthalten?
Hiob_Hi_18_4_3_Siehe, du hast viele unterwiesen und lässige Hände gestärkt;
Hiob_Hi_18_4_4_deine Rede hat die Gefallenen aufgerichtet, und die bebenden Kniee hast du gekräftigt.
Hiob_Hi_18_4_5_Nun aber es an dich kommt, wirst du weich; und nun es dich trifft, erschrickst du.
Hiob_Hi_18_4_6_Ist nicht deine Gottesfurcht dein Trost, deine Hoffnung die Unsträflichkeit deiner Wege?
Hiob_Hi_18_4_7_Gedenke doch, wo ist ein Unschuldiger umgekommen? oder wo sind die Gerechten je vertilgt?
Hiob_Hi_18_4_8_Wie ich wohl gesehen habe: die da Mühe pflügen und Unglück säten, ernteten es auch ein;
Hiob_Hi_18_4_9_durch den Odem Gottes sind sie umgekommen und vom Geist seines Zorns vertilgt.
Hiob_Hi_18_4_10_Das Brüllen der Löwen und die Stimme der großen Löwen und die Zähne der jungen Löwen sind zerbrochen.
Hiob_Hi_18_4_11_Der Löwe ist umgekommen, daß er nicht mehr raubt, und die Jungen der Löwin sind zerstreut.
Hiob_Hi_18_4_12_Und zu mir ist gekommen ein heimlich Wort, und mein Ohr hat ein Wörtlein davon empfangen.
Hiob_Hi_18_4_13_Da ich Gesichte betrachtete in der Nacht, wenn der Schlaf auf die Leute fällt,
Hiob_Hi_18_4_14_da kam mich Furcht und Zittern an, und alle meine Gebeine erschraken.
Hiob_Hi_18_4_15_Und da der Geist an mir vorüberging standen mir die Haare zu Berge an meinem Leibe.
Hiob_Hi_18_4_16_Da stand ein Bild vor meinen Augen, und ich kannte seine Gestalt nicht; es war still, und ich hörte eine Stimme:
Hiob_Hi_18_4_17_Wie kann ein Mensch gerecht sein vor Gott? oder ein Mann rein sein vor dem, der ihn gemacht hat?
Hiob_Hi_18_4_18_Siehe, unter seinen Knechten ist keiner ohne Tadel, und seine Boten zeiht er der Torheit:
Hiob_Hi_18_4_19_wie viel mehr die in Lehmhäusern wohnen und auf Erde gegründet sind und werden von Würmern gefressen!
Hiob_Hi_18_4_20_Es währt vom Morgen bis an den Abend, so werden sie zerschlagen; und ehe sie es gewahr werden, sind sie gar dahin,
Hiob_Hi_18_4_21_und ihre Nachgelassenen vergehen und sterben auch unversehens.
Hiob_Hi_18_5_1_Rufe doch! was gilts, ob einer dir antworte? Und an welchen von den Heiligen willst du dich wenden?
Hiob_Hi_18_5_2_Einen Toren aber erwürgt wohl der Unmut, und den Unverständigen tötet der Eifer.
Hiob_Hi_18_5_3_Ich sah einen Toren eingewurzelt, und ich fluchte plötzlich seinem Hause.
Hiob_Hi_18_5_4_Seine Kinder werden fern sein vom Heil und werden zerschlagen werden im Tor, da kein Erretter sein wird.
Hiob_Hi_18_5_5_Seine Ernte wird essen der Hungrige und auch aus den Hecken sie holen, und sein Gut werden die Durstigen aussaufen.
Hiob_Hi_18_5_6_Denn Mühsal aus der Erde nicht geht und Unglück aus dem Acker nicht wächst;
Hiob_Hi_18_5_7_sondern der Mensch wird zu Unglück geboren, wie die Vögel schweben, emporzufliegen.
Hiob_Hi_18_5_8_Ich aber würde zu Gott mich wenden und meine Sache vor ihn bringen,
Hiob_Hi_18_5_9_der große Dinge tut, die nicht zu erforschen sind, und Wunder, die nicht zu zählen sind:
Hiob_Hi_18_5_10_der den Regen aufs Land gibt und läßt Wasser kommen auf die Gefilde;
Hiob_Hi_18_5_11_der die Niedrigen erhöht und den Betrübten emporhilft.
Hiob_Hi_18_5_12_Er macht zunichte die Anschläge der Listigen, daß es ihre Hand nicht ausführen kann;
Hiob_Hi_18_5_13_er fängt die Weisen in ihrer Listigkeit und stürzt der Verkehrten Rat,
Hiob_Hi_18_5_14_daß sie des Tages in der Finsternis laufen und tappen am Mittag wie in der Nacht.
Hiob_Hi_18_5_15_Er hilft den Armen von dem Schwert, von ihrem Munde und von der Hand des Mächtigen,
Hiob_Hi_18_5_16_und ist des Armen Hoffnung, daß die Bosheit wird ihren Mund müssen zuhalten.
Hiob_Hi_18_5_17_Siehe, selig ist der Mensch, den Gott straft; darum weigere dich der Züchtigung des Allmächtigen nicht.
Hiob_Hi_18_5_18_Denn er verletzt und verbindet; er zerschlägt und seine Hand heilt.
Hiob_Hi_18_5_19_Aus sechs Trübsalen wird er dich erretten, und in der siebenten wird dich kein Übel rühren:
Hiob_Hi_18_5_20_in der Teuerung wird er dich vom Tod erlösen und im Kriege von des Schwertes Hand;
Hiob_Hi_18_5_21_Er wird dich verbergen vor der Geißel Zunge, daß du dich nicht fürchtest vor dem Verderben, wenn es kommt;
Hiob_Hi_18_5_22_im Verderben und im Hunger wirst du lachen und dich vor den wilden Tieren im Lande nicht fürchten;
Hiob_Hi_18_5_23_sondern sein Bund wird sein mit den Steinen auf dem Felde, und die wilden Tiere im Lande werden Frieden mit dir halten.
Hiob_Hi_18_5_24_Und du wirst erfahren, daß deine Hütte Frieden hat, und wirst deine Behausung versorgen und nichts vermissen,
Hiob_Hi_18_5_25_und wirst erfahren, daß deines Samens wird viel werden und deine Nachkommen wie das Gras auf Erden,
Hiob_Hi_18_5_26_und wirst im Alter zum Grab kommen, wie Garben eingeführt werden zu seiner Zeit.
Hiob_Hi_18_5_27_Siehe, das haben wir erforscht und ist also; dem gehorche und merke du dir's.
Hiob_Hi_18_6_1_Hiob antwortete und sprach:
Hiob_Hi_18_6_2_Wenn man doch meinen Unmut wöge und mein Leiden zugleich in die Waage legte!
Hiob_Hi_18_6_3_Denn nun ist es schwerer als Sand am Meer; darum gehen meine Worte irre.
Hiob_Hi_18_6_4_Denn die Pfeile des Allmächtigen stecken in mir: derselben Gift muß mein Geist trinken, und die Schrecknisse Gottes sind auf mich gerichtet.
Hiob_Hi_18_6_5_Das Wild schreit nicht, wenn es Gras hat; der Ochse blökt nicht, wenn er sein Futter hat.
Hiob_Hi_18_6_6_Kann man auch essen, was ungesalzen ist? Oder wer mag kosten das Weiße um den Dotter?
Hiob_Hi_18_6_7_Was meine Seele widerte anzurühren, das ist meine Speise, mir zum Ekel.
Hiob_Hi_18_6_8_O, daß meine Bitte geschähe und Gott gäbe mir, was ich hoffe!
Hiob_Hi_18_6_9_Daß Gott anfinge und zerschlüge mich und ließe seine Hand gehen und zerscheiterte mich!
Hiob_Hi_18_6_10_So hätte ich nun Trost, und wollte bitten in meiner Krankheit, daß er nur nicht schonte, habe ich doch nicht verleugnet die Reden des Heiligen.
Hiob_Hi_18_6_11_Was ist meine Kraft, daß ich möge beharren? und welches ist mein Ende, daß meine Seele geduldig sein sollte?
Hiob_Hi_18_6_12_Ist doch meine Kraft nicht steinern und mein Fleisch nicht ehern.
Hiob_Hi_18_6_13_Habe ich doch nirgend Hilfe, und mein Vermögen ist dahin.
Hiob_Hi_18_6_14_Wer Barmherzigkeit seinem Nächsten verweigert, der verläßt des Allmächtigen Furcht.
Hiob_Hi_18_6_15_Meine Brüder trügen wie ein Bach, wie Wasserströme, die vergehen,
Hiob_Hi_18_6_16_die trübe sind vom Eis, in die der Schnee sich birgt:
Hiob_Hi_18_6_17_zur Zeit, wenn sie die Hitze drückt, versiegen sie; wenn es heiß wird, vergehen sie von ihrer Stätte.
Hiob_Hi_18_6_18_Die Reisezüge gehen ab vom Wege, sie treten aufs Ungebahnte und kommen um;
Hiob_Hi_18_6_19_die Reisezüge von Thema blicken ihnen nach, die Karawanen von Saba hofften auf sie:
Hiob_Hi_18_6_20_aber sie wurden zu Schanden über ihrer Hoffnung und mußten sich schämen, als sie dahin kamen.
Hiob_Hi_18_6_21_So seid ihr jetzt ein Nichts geworden, und weil ihr Jammer sehet, fürchtet ihr euch.
Hiob_Hi_18_6_22_Habe ich auch gesagt: Bringet her von eurem Vermögen und schenkt mir
Hiob_Hi_18_6_23_und errettet mich aus der Hand des Feindes und erlöst mich von der Hand der Gewalttätigen?
Hiob_Hi_18_6_24_Lehret mich, so will ich schweigen; und was ich nicht weiß, darin unterweist mich.
Hiob_Hi_18_6_25_Warum tadelt ihr rechte Rede? Wer ist unter euch, der sie strafen könnte?
Hiob_Hi_18_6_26_Gedenket ihr, Worte zu strafen? Aber eines Verzweifelten Rede ist für den Wind.
Hiob_Hi_18_6_27_Ihr fielet wohl über einen armen Waisen her und grübet eurem Nachbarn Gruben.
Hiob_Hi_18_6_28_Doch weil ihr habt angehoben, sehet auf mich, ob ich vor euch mit Lügen bestehen werde.
Hiob_Hi_18_6_29_Antwortet, was recht ist; meine Antwort wird noch recht bleiben.
Hiob_Hi_18_6_30_Ist denn auf meiner Zunge Unrecht, oder sollte mein Gaumen Böses nicht merken?
Hiob_Hi_18_7_1_Muß nicht der Mensch immer im Streit sein auf Erden, und sind seine Tage nicht wie eines Tagelöhners?
Hiob_Hi_18_7_2_Wie ein Knecht sich sehnt nach dem Schatten und ein Tagelöhner, daß seine Arbeit aus sei,
Hiob_Hi_18_7_3_also habe ich wohl ganze Monden vergeblich gearbeitet, und elender Nächte sind mir viel geworden.
Hiob_Hi_18_7_4_Wenn ich mich legte, sprach ich: Wann werde ich aufstehen? Und der Abend ward mir lang; ich wälzte mich und wurde des satt bis zur Dämmerung.
Hiob_Hi_18_7_5_Mein Fleisch ist um und um wurmig und knotig; meine Haut ist verschrumpft und zunichte geworden.
Hiob_Hi_18_7_6_Meine Tage sind leichter dahingeflogen denn die Weberspule und sind vergangen, daß kein Aufhalten dagewesen ist.
Hiob_Hi_18_7_7_Gedenke, daß mein Leben ein Wind ist und meine Augen nicht wieder Gutes sehen werden.
Hiob_Hi_18_7_8_Und kein lebendiges Auge wird mich mehr schauen; sehen deine Augen nach mir, so bin ich nicht mehr.
Hiob_Hi_18_7_9_Eine Wolke vergeht und fährt dahin: also, wer in die Hölle hinunterfährt, kommt nicht wieder herauf
Hiob_Hi_18_7_10_und kommt nicht wieder in sein Haus, und sein Ort kennt ihn nicht mehr.
Hiob_Hi_18_7_11_Darum will ich auch meinem Munde nicht wehren; ich will reden in der Angst meines Herzens und will klagen in der Betrübnis meiner Seele.
Hiob_Hi_18_7_12_Bin ich denn ein Meer oder ein Meerungeheuer, daß du mich so verwahrst?
Hiob_Hi_18_7_13_Wenn ich gedachte: Mein Bett soll mich trösten, mein Lager soll mir meinen Jammer erleichtern,
Hiob_Hi_18_7_14_so erschrecktest du mich mit Träumen und machtest mir Grauen durch Gesichte,
Hiob_Hi_18_7_15_daß meine Seele wünschte erstickt zu sein und meine Gebeine den Tod.
Hiob_Hi_18_7_16_Ich begehre nicht mehr zu leben. Laß ab von mir, denn meine Tage sind eitel.
Hiob_Hi_18_7_17_Was ist ein Mensch, daß du ihn groß achtest und bekümmerst dich um ihn?
Hiob_Hi_18_7_18_Du suchst ihn täglich heim und versuchst ihn alle Stunden.
Hiob_Hi_18_7_19_Warum tust du dich nicht von mir und lässest mich nicht, bis ich nur meinen Speichel schlinge?
Hiob_Hi_18_7_20_Habe ich gesündigt, was tue ich dir damit, o du Menschenhüter? Warum machst du mich zum Ziel deiner Anläufe, daß ich mir selbst eine Last bin?
Hiob_Hi_18_7_21_Und warum vergibst du mir meine Missetat nicht und nimmst weg meine Sünde? Denn nun werde ich mich in die Erde legen, und wenn du mich morgen suchst, werde ich nicht da sein.
Hiob_Hi_18_8_1_Da antwortete Bildad von Suah und sprach:
Hiob_Hi_18_8_2_Wie lange willst du solches reden und sollen die Reden deines Mundes so einen stolzen Mut haben?
Hiob_Hi_18_8_3_Meinst du, daß Gott unrecht richte oder der Allmächtige das Recht verkehre?
Hiob_Hi_18_8_4_Haben deine Söhne vor ihm gesündigt, so hat er sie verstoßen um ihrer Missetat willen.
Hiob_Hi_18_8_5_So du aber dich beizeiten zu Gott tust und zu dem Allmächtigen flehst,
Hiob_Hi_18_8_6_und so du rein und fromm bist, so wird er aufwachen zu dir und wird wieder aufrichten deine Wohnung um deiner Gerechtigkeit willen;
Hiob_Hi_18_8_7_und was du zuerst wenig gehabt hast, wird hernach gar sehr zunehmen.
Hiob_Hi_18_8_8_Denn frage die vorigen Geschlechter und merke auf das, was ihr Väter erforscht haben;
Hiob_Hi_18_8_9_denn wir sind von gestern her und wissen nichts; unser Leben ist ein Schatten auf Erden.
Hiob_Hi_18_8_10_Sie werden dich's lehren und dir sagen und ihre Rede aus ihrem Herzen hervorbringen:
Hiob_Hi_18_8_11_\"Kann auch ein Rohr aufwachsen, wo es nicht feucht steht? oder Schilf wachsen ohne Wasser?
Hiob_Hi_18_8_12_Sonst wenn's noch in der Blüte ist, ehe es abgehauen wird, verdorrt es vor allem Gras.
Hiob_Hi_18_8_13_So geht es allen denen, die Gottes vergessen; und die Hoffnung der Heuchler wird verloren sein.
Hiob_Hi_18_8_14_Denn seine Zuversicht vergeht, und seine Hoffnung ist eine Spinnwebe.
Hiob_Hi_18_8_15_Er verläßt sich auf sein Haus, und wird doch nicht bestehen; er wird sich daran halten, aber doch nicht stehenbleiben.
Hiob_Hi_18_8_16_Er steht voll Saft im Sonnenschein, und seine Reiser wachsen hervor in seinem Garten.
Hiob_Hi_18_8_17_Seine Saat steht dick bei den Quellen und sein Haus auf Steinen.
Hiob_Hi_18_8_18_Wenn er ihn aber verschlingt von seiner Stätte, wird sie sich gegen ihn stellen, als kennte sie ihn nicht.
Hiob_Hi_18_8_19_Siehe, das ist die Freude seines Wesens; und aus dem Staube werden andere wachsen.\"
Hiob_Hi_18_8_20_Darum siehe, daß Gott nicht verwirft die Frommen und erhält nicht die Hand der Boshaften,
Hiob_Hi_18_8_21_bis daß dein Mund voll Lachens werde und deine Lippen voll Jauchzens.
Hiob_Hi_18_8_22_Die dich aber hassen, werden zu Schanden werden, und der Gottlosen Hütte wird nicht bestehen.
Hiob_Hi_18_9_1_Hiob antwortete und sprach:
Hiob_Hi_18_9_2_Ja, ich weiß gar wohl, daß es also ist und daß ein Mensch nicht recht behalten mag gegen Gott.
Hiob_Hi_18_9_3_Hat er Lust, mit ihm zu hadern, so kann er ihm auf tausend nicht eins antworten.
Hiob_Hi_18_9_4_Er ist weise und mächtig; wem ist's je gelungen, der sich wider ihn gelegt hat?
Hiob_Hi_18_9_5_Er versetzt Berge, ehe sie es innewerden, die er in seinem Zorn umkehrt.
Hiob_Hi_18_9_6_Er bewegt die Erde aus ihrem Ort, daß ihre Pfeiler zittern.
Hiob_Hi_18_9_7_Er spricht zur Sonne, so geht sie nicht auf, und versiegelt die Sterne.
Hiob_Hi_18_9_8_Er breitet den Himmel aus allein und geht auf den Wogen des Meeres.
Hiob_Hi_18_9_9_Er macht den Wagen am Himmel und Orion und die Plejaden und die Sterne gegen Mittag.
Hiob_Hi_18_9_10_Er tut große Dinge, die nicht zu erforschen sind, und Wunder, deren keine Zahl ist.
Hiob_Hi_18_9_11_Siehe, er geht an mir vorüber, ehe ich's gewahr werde, und wandelt vorbei, ehe ich's merke.
Hiob_Hi_18_9_12_Siehe, wenn er hinreißt, wer will ihm wehren? Wer will zu ihm sagen: Was machst du?
Hiob_Hi_18_9_13_Er ist Gott; seinen Zorn kann niemand stillen; unter ihn mußten sich beugen die Helfer Rahabs.
Hiob_Hi_18_9_14_Wie sollte ich denn ihm antworten und Worte finden gegen ihn?
Hiob_Hi_18_9_15_Wenn ich auch recht habe, kann ich ihm dennoch nicht antworten, sondern ich müßte um mein Recht flehen.
Hiob_Hi_18_9_16_Wenn ich ihn schon anrufe, und er mir antwortet, so glaube ich doch nicht, daß er meine Stimme höre.
Hiob_Hi_18_9_17_Denn er fährt über mich mit Ungestüm und macht mir Wunden viel ohne Ursache.
Hiob_Hi_18_9_18_Er läßt meinen Geist sich nicht erquicken, sondern macht mich voll Betrübnis.
Hiob_Hi_18_9_19_Will man Macht, so ist er zu mächtig; will man Recht, wer will mein Zeuge sein?
Hiob_Hi_18_9_20_Sage ich, daß ich gerecht bin, so verdammt er mich doch; bin ich Unschuldig, so macht er mich doch zu Unrecht.
Hiob_Hi_18_9_21_Ich bin unschuldig! ich frage nicht nach meiner Seele, begehre keines Lebens mehr.
Hiob_Hi_18_9_22_Es ist eins, darum sage ich: Er bringt um beide, den Frommen und den Gottlosen.
Hiob_Hi_18_9_23_Wenn er anhebt zu geißeln, so dringt er alsbald zum Tod und spottet der Anfechtung der Unschuldigen.
Hiob_Hi_18_9_24_Das Land aber wird gegeben unter die Hand der Gottlosen, und der Richter Antlitz verhüllt er. Ist's nicht also, wer anders sollte es tun?
Hiob_Hi_18_9_25_Meine Tage sind schneller gewesen denn ein Läufer; sie sind geflohen und haben nichts Gutes erlebt.
Hiob_Hi_18_9_26_Sie sind dahingefahren wie die Rohrschiffe, wie ein Adler fliegt zur Speise.
Hiob_Hi_18_9_27_Wenn ich gedenke: Ich will meiner Klage vergessen und meine Gebärde lassen fahren und mich erquicken,
Hiob_Hi_18_9_28_so fürchte ich alle meine Schmerzen, weil ich weiß, daß du mich nicht unschuldig sein lässest.
Hiob_Hi_18_9_29_Ich muß ja doch ein Gottloser sein; warum mühe ich mich denn so vergeblich?
Hiob_Hi_18_9_30_Wenn ich mich gleich mit Schneewasser wüsche und reinigte mein Hände mit Lauge,
Hiob_Hi_18_9_31_so wirst du mich doch tauchen in Kot, und so werden mir meine Kleider greulich anstehen.
Hiob_Hi_18_9_32_Denn er ist nicht meinesgleichen, dem ich antworten könnte, daß wir vor Gericht miteinander kämen.
Hiob_Hi_18_9_33_Es ist zwischen uns kein Schiedsmann, der seine Hand auf uns beide lege.
Hiob_Hi_18_9_34_Er nehme von mir seine Rute und lasse seinen Schrecken von mir,
Hiob_Hi_18_9_35_daß ich möge reden und mich nicht vor ihm fürchten dürfe; denn ich weiß, daß ich kein solcher bin.
Hiob_Hi_18_10_1_Meine Seele verdrießt mein Leben; ich will meiner Klage bei mir ihren Lauf lassen und reden in der Betrübnis meiner Seele
Hiob_Hi_18_10_2_und zu Gott sagen: Verdamme mich nicht! laß mich wissen, warum du mit mir haderst.
Hiob_Hi_18_10_3_Gefällt dir's, daß du Gewalt tust und mich verwirfst, den deine Hände gemacht haben, und bringst der Gottlosen Vornehmen zu Ehren?
Hiob_Hi_18_10_4_Hast du denn auch fleischliche Augen, oder siehst du, wie ein Mensch sieht?
Hiob_Hi_18_10_5_Oder ist deine Zeit wie eines Menschen Zeit, oder deine Jahre wie eines Mannes Jahre?
Hiob_Hi_18_10_6_daß du nach einer Missetat fragest und suchest meine Sünde,
Hiob_Hi_18_10_7_so du doch weißt wie ich nicht gottlos sei, so doch niemand ist, der aus deiner Hand erretten könne.
Hiob_Hi_18_10_8_Deine Hände haben mich bereitet und gemacht alles, was ich um und um bin; und du wolltest mich verderben?
Hiob_Hi_18_10_9_Gedenke doch, daß du mich aus Lehm gemacht hast; und wirst mich wieder zu Erde machen?
Hiob_Hi_18_10_10_Hast du mich nicht wie Milch hingegossen und wie Käse lassen gerinnen?
Hiob_Hi_18_10_11_Du hast mir Haut und Fleisch angezogen; mit Gebeinen und Adern hast du mich zusammengefügt.
