1 Korinther_1Kor_46_14_37_So sich jemand läßt dünken, er sei ein Prophet oder geistlich, der erkenne, was ich euch schreibe; denn es sind des HERRN Gebote.
1 Korinther_1Kor_46_14_38_Ist aber jemand unwissend, der sei unwissend.
1 Korinther_1Kor_46_14_39_Darum, liebe Brüder, fleißiget euch des Weissagens und wehret nicht, mit Zungen zu reden.
1 Korinther_1Kor_46_14_40_Lasset alles ehrbar und ordentlich zugehen.
1 Korinther_1Kor_46_15_1_Ich erinnere euch aber, liebe Brüder, des Evangeliums, das ich euch verkündigt habe, welches ihr auch angenommen habt, in welchem ihr auch stehet,
1 Korinther_1Kor_46_15_2_durch welches ihr auch selig werdet: welchergestalt ich es euch verkündigt habe, so ihr's behalten habt; es wäre denn, daß ihr umsonst geglaubt hättet.
1 Korinther_1Kor_46_15_3_Denn ich habe euch zuvörderst gegeben, was ich empfangen habe: daß Christus gestorben sei für unsre Sünden nach der Schrift,
1 Korinther_1Kor_46_15_4_und daß er begraben sei, und daß er auferstanden sei am dritten Tage nach der Schrift,
1 Korinther_1Kor_46_15_5_und daß er gesehen worden ist von Kephas, darnach von den Zwölfen.
1 Korinther_1Kor_46_15_6_Darnach ist er gesehen worden von mehr denn fünfhundert Brüdern auf einmal, deren noch viele leben, etliche aber sind entschlafen.
1 Korinther_1Kor_46_15_7_Darnach ist er gesehen worden von Jakobus, darnach von allen Aposteln.
1 Korinther_1Kor_46_15_8_Am letzten ist er auch von mir, einer unzeitigen Geburt gesehen worden.
1 Korinther_1Kor_46_15_9_Denn ich bin der geringste unter den Aposteln, der ich nicht wert bin, daß ich ein Apostel heiße, darum daß ich die Gemeinde Gottes verfolgt habe.
1 Korinther_1Kor_46_15_10_Aber von Gottes Gnade bin ich, was ich bin. Und seine Gnade an mir ist nicht vergeblich gewesen, sondern ich habe vielmehr gearbeitet denn sie alle; nicht aber ich, sondern Gottes Gnade, die mit mir ist.
1 Korinther_1Kor_46_15_11_Es sei nun ich oder jene: also predigen wir, und also habt ihr geglaubt.
1 Korinther_1Kor_46_15_12_So aber Christus gepredigt wird, daß er sei von den Toten auferstanden, wie sagen denn etliche unter euch, die Auferstehung der Toten sei nichts?
1 Korinther_1Kor_46_15_13_Ist die Auferstehung der Toten nichts, so ist auch Christus nicht auferstanden.
1 Korinther_1Kor_46_15_14_Ist aber Christus nicht auferstanden, so ist unsre Predigt vergeblich, so ist auch euer Glaube vergeblich.
1 Korinther_1Kor_46_15_15_Wir würden aber auch erfunden als falsche Zeugen Gottes, daß wir wider Gott gezeugt hätten, er hätte Christum auferweckt, den er nicht auferweckt hätte, wenn doch die Toten nicht auferstehen.
1 Korinther_1Kor_46_15_16_Denn so die Toten nicht auferstehen, so ist auch Christus nicht auferstanden.
1 Korinther_1Kor_46_15_17_Ist Christus aber nicht auferstanden, so ist euer Glaube eitel, so seid ihr noch in euren Sünden.
1 Korinther_1Kor_46_15_18_So sind auch die, so in Christo entschlafen sind, verloren.
1 Korinther_1Kor_46_15_19_Hoffen wir allein in diesem Leben auf Christum, so sind wir die elendesten unter allen Menschen.
1 Korinther_1Kor_46_15_20_Nun ist aber Christus auferstanden von den Toten und der Erstling geworden unter denen, die da schlafen.
1 Korinther_1Kor_46_15_21_Sintemal durch einen Menschen der Tod und durch einen Menschen die Auferstehung der Toten kommt.
1 Korinther_1Kor_46_15_22_Denn gleichwie sie in Adam alle sterben, also werden sie in Christo alle lebendig gemacht werden.
1 Korinther_1Kor_46_15_23_Ein jeglicher aber in seiner Ordnung: der Erstling Christus; darnach die Christo angehören, wenn er kommen wird;
1 Korinther_1Kor_46_15_24_darnach das Ende, wenn er das Reich Gott und dem Vater überantworten wird, wenn er aufheben wird alle Herrschaft und alle Obrigkeit und Gewalt.
1 Korinther_1Kor_46_15_25_Er muß aber herrschen, bis daß er \"alle seine Feinde unter seine Füße lege\".
1 Korinther_1Kor_46_15_26_Der letzte Feind, der aufgehoben wird, ist der Tod.
1 Korinther_1Kor_46_15_27_Denn \"er hat ihm alles unter seine Füße getan\". Wenn er aber sagt, daß es alles untertan sei, ist's offenbar, daß ausgenommen ist, der ihm alles untergetan hat.
1 Korinther_1Kor_46_15_28_Wenn aber alles ihm untertan sein wird, alsdann wird auch der Sohn selbst untertan sein dem, der ihm alles untergetan hat, auf daß Gott sei alles in allen.
1 Korinther_1Kor_46_15_29_Was machen sonst, die sich taufen lassen über den Toten, so überhaupt die Toten nicht auferstehen? Was lassen sie sich taufen über den Toten?
1 Korinther_1Kor_46_15_30_Und was stehen wir alle Stunde in der Gefahr?
1 Korinther_1Kor_46_15_31_Bei unserm Ruhm, den ich habe in Christo Jesu, unserm HERRN, ich sterbe täglich.
1 Korinther_1Kor_46_15_32_Habe ich nach menschlicher Meinung zu Ephesus mit wilden Tieren gefochten, was hilft's mir? So die Toten nicht auferstehen, \"laßt uns essen und trinken; denn morgen sind wir tot!\"
1 Korinther_1Kor_46_15_33_Lasset euch nicht verführen! Böse Geschwätze verderben gute Sitten.
1 Korinther_1Kor_46_15_34_Werdet doch einmal recht nüchtern und sündigt nicht! Denn etliche wissen nichts von Gott; das sage ich euch zur Schande.
1 Korinther_1Kor_46_15_35_Möchte aber jemand sagen: Wie werden die Toten auferstehen, und mit welchem Leibe werden sie kommen?
1 Korinther_1Kor_46_15_36_Du Narr: was du säst, wird nicht lebendig, es sterbe denn.
1 Korinther_1Kor_46_15_37_Und was du säst, ist ja nicht der Leib, der werden soll, sondern ein bloßes Korn, etwa Weizen oder der andern eines.
1 Korinther_1Kor_46_15_38_Gott aber gibt ihm einen Leib, wie er will, und einem jeglichen von den Samen seinen eigenen Leib.
1 Korinther_1Kor_46_15_39_Nicht ist alles Fleisch einerlei Fleisch; sondern ein anderes Fleisch ist der Menschen, ein anderes des Viehs, ein anderes der Fische, ein anderes der Vögel.
1 Korinther_1Kor_46_15_40_Und es sind himmlische Körper und irdische Körper; aber eine andere Herrlichkeit haben die himmlischen Körper und eine andere die irdischen.
1 Korinther_1Kor_46_15_41_Eine andere Klarheit hat die Sonne, eine andere Klarheit hat der Mond, eine andere Klarheit haben die Sterne; denn ein Stern übertrifft den andern an Klarheit.
1 Korinther_1Kor_46_15_42_Also auch die Auferstehung der Toten. Es wird gesät verweslich, und wird auferstehen unverweslich.
1 Korinther_1Kor_46_15_43_Es wird gesät in Unehre, und wird auferstehen in Herrlichkeit. Es wird gesät in Schwachheit, und wird auferstehen in Kraft.
1 Korinther_1Kor_46_15_44_Es wird gesät ein natürlicher Leib, und wird auferstehen ein geistlicher Leib. Ist ein natürlicher Leib, so ist auch ein geistlicher Leib.
1 Korinther_1Kor_46_15_45_Wie es geschrieben steht: der erste Mensch, Adam, \"ward zu einer lebendigen Seele\", und der letzte Adam zum Geist, der da lebendig macht.
1 Korinther_1Kor_46_15_46_Aber der geistliche Leib ist nicht der erste, sondern der natürliche; darnach der geistliche.
1 Korinther_1Kor_46_15_47_Der erste Mensch ist von der Erde und irdisch; der andere Mensch ist der HERR vom Himmel.
1 Korinther_1Kor_46_15_48_Welcherlei der irdische ist, solcherlei sind auch die irdischen; und welcherlei der himmlische ist, solcherlei sind auch die himmlischen.
1 Korinther_1Kor_46_15_49_Und wie wir getragen haben das Bild des irdischen, also werden wir auch tragen das Bild des himmlischen.
1 Korinther_1Kor_46_15_50_Das sage ich aber, liebe Brüder, daß Fleisch und Blut nicht können das Reich Gottes ererben; auch wird das Verwesliche nicht erben das Unverwesliche.
1 Korinther_1Kor_46_15_51_Siehe, ich sage euch ein Geheimnis: Wir werden nicht alle entschlafen, wir werden aber alle verwandelt werden;
1 Korinther_1Kor_46_15_52_und dasselbe plötzlich, in einem Augenblick, zur Zeit der letzten Posaune. Denn es wird die Posaune schallen, und die Toten werden auferstehen unverweslich, und wir werden verwandelt werden.
1 Korinther_1Kor_46_15_53_Denn dies Verwesliche muß anziehen die Unverweslichkeit, und dies Sterbliche muß anziehen die Unsterblichkeit.
1 Korinther_1Kor_46_15_54_Wenn aber das Verwesliche wird anziehen die Unverweslichkeit, und dies Sterbliche wird anziehen die Unsterblichkeit, dann wird erfüllt werden das Wort, das geschrieben steht:
1 Korinther_1Kor_46_15_55_\"Der Tod ist verschlungen in den Sieg. Tod, wo ist dein Stachel? Hölle, wo ist dein Sieg?\"
1 Korinther_1Kor_46_15_56_Aber der Stachel des Todes ist die Sünde; die Kraft aber der Sünde ist das Gesetz.
1 Korinther_1Kor_46_15_57_Gott aber sei Dank, der uns den Sieg gegeben hat durch unsern HERRN Jesus Christus!
1 Korinther_1Kor_46_15_58_Darum, meine lieben Brüder, seid fest, unbeweglich, und nehmet immer zu in dem Werk des HERRN, sintemal ihr wisset, daß eure Arbeit nicht vergeblich ist in dem HERRN.
1 Korinther_1Kor_46_16_1_Was aber die Steuer anlangt, die den Heiligen geschieht; wie ich den Gemeinden in Galatien geordnet habe, also tut auch ihr.
1 Korinther_1Kor_46_16_2_An jeglichem ersten Tag der Woche lege bei sich selbst ein jeglicher unter euch und sammle, was ihn gut dünkt, auf daß nicht, wenn ich komme, dann allererst die Steuer zu sammeln sei.
1 Korinther_1Kor_46_16_3_Wenn ich aber gekommen bin, so will ich die, welche ihr dafür anseht, mit Briefen senden, daß sie hinbringen eure Wohltat gen Jerusalem.
1 Korinther_1Kor_46_16_4_So es aber wert ist, daß ich auch hinreise, sollen sie mit mir reisen.
1 Korinther_1Kor_46_16_5_Ich will aber zu euch kommen, wenn ich durch Mazedonien gezogen bin; denn durch Mazedonien werde ich ziehen.
1 Korinther_1Kor_46_16_6_Bei euch aber werde ich vielleicht bleiben oder auch überwintern, auf daß ihr mich geleitet, wo ich hin ziehen werde.
1 Korinther_1Kor_46_16_7_Ich will euch jetzt nicht sehen im Vorüberziehen; denn ich hoffe, ich werde etliche Zeit bei euch bleiben, so es der HERR zuläßt.
1 Korinther_1Kor_46_16_8_Ich werde aber zu Ephesus bleiben bis Pfingsten.
1 Korinther_1Kor_46_16_9_Denn mir ist eine große Tür aufgetan, die viel Frucht wirkt, und sind viel Widersacher da.
1 Korinther_1Kor_46_16_10_So Timotheus kommt, so sehet zu, daß er ohne Furcht bei euch sei; denn er treibt auch das Werk des HERRN wie ich.
1 Korinther_1Kor_46_16_11_Daß ihn nun nicht jemand verachte! Geleitet ihn aber im Frieden, daß er zu mir komme; denn ich warte sein mit den Brüdern.
1 Korinther_1Kor_46_16_12_Von Apollos, dem Bruder, aber wisset, daß ich ihn sehr viel ermahnt habe, daß er zu euch käme mit den Brüdern; und es war durchaus sein Wille nicht, daß er jetzt käme; er wird aber kommen, wenn es ihm gelegen sein wird.
1 Korinther_1Kor_46_16_13_Wachet, stehet im Glauben, seid männlich und seid stark!
1 Korinther_1Kor_46_16_14_Alle eure Dinge lasset in der Liebe geschehen!
1 Korinther_1Kor_46_16_15_Ich ermahne euch aber, liebe Brüder: Ihr kennet das Haus des Stephanas, daß sie sind die Erstlinge in Achaja und haben sich selbst verordnet zum Dienst den Heiligen;
1 Korinther_1Kor_46_16_16_daß auch ihr solchen untertan seid und allen, die mitwirken und arbeiten.
1 Korinther_1Kor_46_16_17_Ich freue mich über die Ankunft des Stephanas und Fortunatus und Achaikus; denn wo ich an euch Mangel hatte, das haben sie erstattet.
1 Korinther_1Kor_46_16_18_Sie haben erquickt meinen und euren Geist. Erkennet die an, die solche sind!
1 Korinther_1Kor_46_16_19_Es grüßen euch die Gemeinden in Asien. Es grüßt euch sehr in dem HERRN Aquila und Priscilla samt der Gemeinde in ihrem Hause.
1 Korinther_1Kor_46_16_20_Es grüßen euch alle Brüder. Grüßet euch untereinander mit dem heiligen Kuß.
1 Korinther_1Kor_46_16_21_Ich, Paulus, grüße euch mit meiner Hand.
1 Korinther_1Kor_46_16_22_So jemand den HERRN Jesus Christus nicht liebhat, der sei anathema. Maran atha! (das heißt: der sei verflucht. Unser HERR kommt!)
1 Korinther_1Kor_46_16_23_Die Gnade des HERRN Jesu Christi sei mit euch!
1 Korinther_1Kor_46_16_24_Meine Liebe sei mit euch allen in Christo Jesu! Amen.
